title,authors,date,target year
GWAS summary-based pathway analysis correcting for the genetic confounding impact of environmental exposures,"Qianrui Fan, Feng Zhang, Wenyu Wang, Jiawen Xu, Jingcan Hao ...",08 March 2017,2017
An algorithmic perspective of de novo cis-regulatory motif finding based on ChIP-seq data,"Bingqiang Liu, Jinyu Yang, Yang Li, Adam McDermaid, Qin Ma",08 March 2017,2017
Review and comparative assessment of sequence-based predictors of protein-binding residues,"Jian Zhang, Lukasz Kurgan",01 March 2017,2017
How the strengths of Lisp-family languages facilitate building complex and flexible bioinformatics applications,"Bohdan B Khomtchouk, Edmund Weitz, Peter D Karp, Claes Wahlestedt",01 March 2017,2017
miRandb: a resource of online services for miRNA research,"Seyed Hamid Aghaee-Bakhtiari, Ehsan Arefian, Pierre Lau",01 March 2017,2017
Circular RNA identification based on multiple seed matching,"Yuan Gao, Jinyang Zhang, Fangqing Zhao",28 February 2017,2017
Critical evaluation of bioinformatics tools for the prediction of protein crystallization propensity,"Huilin Wang, Liubin Feng, Geoffrey I Webb, Lukasz Kurgan, Jiangning Song ...",27 February 2017,2017
Selecting between-sample RNA-Seq normalization methods from the perspective of their assumptions,"Ciaran Evans, Johanna Hardin, Daniel M Stoebel",27 February 2017,2017
A review of network-based approaches to drug repositioning,"Maryam Lotfi Shahreza, Nasser Ghadiri, Sayed Rasoul Mousavi, Jaleh Varshosaz, James R Green",27 February 2017,2017
Individualized analysis of differentially expressed miRNAs with application to the identification of miRNAs deregulated commonly in lung cancer tissues,"Haidan Yan, Hao Cai, Qingzhou Guan, Jun He, Juan Zhang ...",23 February 2017,2017
A review of connectivity map and computational approaches in pharmacogenomics,"Aliyu Musa, Laleh Soltan Ghoraie, Shu-Dong Zhang, Galina Glazko, Olli Yli-Harja ...",23 February 2017,2017
Strategies for processing and quality control of Illumina genotyping arrays,"Shilin Zhao, Wang Jing, David C Samuels, Quanghu Sheng, Yu Shyr ...",20 February 2017,2017
Molecular dynamics recipes for genome research,"Tommaso Biagini, Giovanni Chillemi, Gianluigi Mazzoccoli, Alessandro Grottesi, Caterina Fusilli ...",18 February 2017,2017
"Detection of drug–drug interactions through data mining studies using clinical sources, scientific literature and social media","Santiago Vilar, Carol Friedman, George Hripcsak",17 February 2017,2017
Genome-wide analysis reveals that exon methylation facilitates its selective usage in the human transcriptome,"Shengli Li, Jiwei Zhang, Shenglin Huang, Xianghuo He",16 February 2017,2017
"Systematic analyses of drugs and disease indications in RepurposeDB reveal pharmacological, biological and epidemiological factors influencing drug repositioning","Khader Shameer, Benjamin S Glicksberg, Rachel Hodos, Kipp W Johnson, Marcus A Badgeley ...",15 February 2017,2017
HpQTL: a geometric morphometric platform to compute the genetic architecture of heterophylly,"Lidan Sun, Jing Wang, Xuli Zhu, Libo Jiang, Kirk Gosik ...",15 February 2017,2017
Genome-wide characterization of lncRNAs in acute myeloid leukemia,"Lijun Lei, Siyu Xia, Dan Liu, Xiaoqing Li, Jing Feng ...",15 February 2017,2017
Probabilistic natural mapping of gene-level tests for genome-wide association studies,"Feng Bao, Yue Deng, Mulong Du, Zhiquan Ren, Qingzhao Zhang ...",15 February 2017,2017
Benchmarking CRISPR on-target sgRNA design,"Jifang Yan, Guohui Chuai, Chi Zhou, Chenyu Zhu, Jing Yang ...",15 February 2017,2017
A simple way to detect disease-associated cellular molecular alterations from mixed-cell blood samples,"Guini Hong, Hongdong Li, Mengyao Li, Weicheng Zheng, Jing Li ...",14 February 2017,2017
DNA copy number profiling using single-cell sequencing,"Xuefeng Wang, Hao Chen, Nancy R Zhang",04 February 2017,2017
How trees allocate carbon for optimal growth: insight from a game-theoretic model,"Liyong Fu, Lidan Sun, Han Hao, Libo Jiang, Sheng Zhu ...",01 February 2017,2017
Methodological implementation of mixed linear models in multi-locus genome-wide association studies,"Yang-Jun Wen, Hanwen Zhang, Yuan-Li Ni, Bo Huang, Jin Zhang ...",01 February 2017,2017
SmProt: a database of small proteins encoded by annotated coding and non-coding RNA loci,"Yajing Hao, Lili Zhang, Yiwei Niu, Tanxi Cai, Jianjun Luo ...",29 January 2017,2017
Feasibility of sample size calculation for RNA-seq studies,"Alicia Poplawski, Harald Binder",18 January 2017,2017
A landscape of synthetic viable interactions in cancer,"Yunyan Gu, Ruiping Wang, Yue Han, Wenbin Zhou, Zhangxiang Zhao ...",17 January 2017,2017
hppRNA—a Snakemake-based handy parameter-free pipeline for RNA-Seq analysis of numerous samples,Dapeng Wang,17 January 2017,2017
Notions of similarity for systems biology models,"Ron Henkel, Robert Hoehndorf, Tim Kacprowski, Christian Knüpfer, Wolfram Liebermeister ...",17 January 2017,2017
Top considerations for creating bioinformatics software documentation,"Mehran Karimzadeh, Michael M Hoffman",14 January 2017,2017
High-throughput sequencing of the T-cell receptor repertoire: pitfalls and opportunities,"James M Heather, Mazlina Ismail, Theres Oakes, Benny Chain",10 January 2017,2017
VRprofile: gene-cluster-detection-based profiling of virulence and antibiotic resistance traits encoded within genome sequences of pathogenic bacteria,"Jun Li, Cui Tai, Zixin Deng, Weihong Zhong, Yongqun He ...",10 January 2017,2017
Elemental metabolomics,"Ping Zhang, Constantinos A Georgiou, Vladimir Brusic",10 January 2017,2017
miRDis: a Web tool for endogenous and exogenous microRNA discovery based on deep-sequencing data analysis,"Hanyuan Zhang, Bruno Vieira Resende e Silva, Juan Cui",10 January 2017,2017
Gene co-expression analysis for functional classification and gene–disease predictions,"Sipko van Dam, Urmo Võsa, Adriaan van der Graaf, Lude Franke, João Pedro de Magalhães",10 January 2017,2017
Evaluating approaches to find exon chains based on long reads,"Anna Kuosmanen, Tuukka Norri, Veli Mäkinen",09 January 2017,2017
A review of connectivity map and computational approaches in pharmacogenomics,"Aliyu Musa, Laleh Soltan Ghoraie, Shu-Dong Zhang, Galina Glazko, Olli Yli-Harja ...",09 January 2017,2017
Exploiting next-generation sequencing to solve the haplotyping puzzle in polyploids: a simulation study,"Ehsan Motazedi, Richard Finkers, Chris Maliepaard, Dick de Ridder",08 January 2017,2017
Transformation and model choice for RNA-seq co-expression analysis,"Andrea Rau, Cathy Maugis-Rabusseau",08 January 2017,2017
Mapping morphological shape as a high-dimensional functional curve,"Guifang Fu, Mian Huang, Wenhao Bo, Han Hao, Rongling Wu",06 January 2017,2017
Survey of local and global biological network alignment: the need to reconcile the two sides of the same coin,"Pietro Hiram Guzzi, Tijana Milenković",05 January 2017,2017
Plant genome and transcriptome annotations: from misconceptions to simple solutions,"Marie E Bolger, Borjana Arsova, Björn Usadel",05 January 2017,2017
Design of RNAs: comparing programs for inverse RNA folding,"Alexander Churkin, Matan Drory Retwitzer, Vladimir Reinharz, Yann Ponty, Jérôme Waldispühl ...",03 January 2017,2017
miRandb: a resource of online services for miRNA research,"Seyed Hamid Aghaee-Bakhtiari, Ehsan Arefian, Pierre Lau",03 January 2017,2017
