title,authors,year,citations
Accurate prediction of orthologs in the presence of divergence after duplication,"Manuel Lafond, Mona Meghdari Miardan, David Sankoff",2018.0,13.0
A scalable estimator of SNP heritability for biobank-scale data,"Yue Wu, Sriram Sankararaman",2018.0,15.0
LONGO: an R package for interactive gene length dependent analysis for neuronal identity,"Matthew J McCoy, Alexander J Paul, Matheus B Victor, Michelle Richner, Harrison W Gabel ...",2018.0,6.0
ISMB 2018 proceedings,"Yana Bromberg, Predrag Radivojac",2018.0,10.0
Author Index,,2016.0,4.0
appreci8: a pipeline for precise variant calling integrating 8 tools,"Sarah Sandmann, Mohsen Karimi, Aniek O de Graaf, Christian Rohde, Stefanie Göllner ...",2018.0,8.0
Prediction of human-Bacillus anthracis protein–protein interactions using multi-layer neural network,"Ibrahim Ahmed, Peter Witbooi, Alan Christoffels",2018.0,14.0
ncdDetect2: improved models of the site-specific mutation rate in cancer and driver detection with robust significance evaluation,"Malene Juul, Tobias Madsen, Qianyun Guo, Johanna Bertl, Asger Hobolth ...",2019.0,1.0
runibic: a Bioconductor package for parallel row-based biclustering of gene expression data,"Patryk Orzechowski, Artur Pańszczyk, Xiuzhen Huang, Jason H Moore",2018.0,11.0
Tightly integrated genomic and epigenomic data mining using tensor decomposition,Jianwen Fang,2019.0,4.0
A descriptive marker gene approach to single-cell pseudotime inference,"Kieran R Campbell, Christopher Yau",2017.0,850.0
MetaPOAP: presence or absence of metabolic pathways in metagenome-assembled genomes,"Lewis M Ward, Patrick M Shih, Woodward W Fischer",2018.0,19.0
SOPanG: online text searching over a pan-genome,"Aleksander Cisłak, Szymon Grabowski, Jan Holub",2018.0,11.0
Robust clustering of noisy high-dimensional gene expression data for patients subtyping,"Pietro Coretto, Angela Serra, Roberto Tagliaferri",2018.0,6.0
Practical dynamic de Bruijn graphs,"Victoria G Crawford, Alan Kuhnle, Christina Boucher, Rayan Chikhi, Travis Gagie",2016.0,22.0
Predicting miRNA–disease association based on inductive matrix completion,"Xing Chen, Lei Wang, Jia Qu, Na-Na Guan, Jian-Qiang Li",2018.0,198.0
Learned protein embeddings for machine learning,"Kevin K Yang, Zachary Wu, Claire N Bedbrook, Frances H Arnold",2019.0,69.0
iLoc-lncRNA: predict the subcellular location of lncRNAs by incorporating octamer composition into general PseKNC,"Zhen-Dong Su, Yan Huang, Zhao-Yue Zhang, Ya-Wei Zhao, Dong Wang ...",2018.0,146.0
SCIP: a single-cell image processor toolbox,"Leonardo Martins, Ramakanth Neeli-Venkata, Samuel M D Oliveira, Antti Häkkinen, Andre S Ribeiro ...",2018.0,5.0
Meffil: efficient normalization and analysis of very large DNA methylation datasets,"J L Min, G Hemani, G Davey Smith, C Relton, M Suderman",2018.0,57.0
Reverse-engineering flow-cytometry gating strategies for phenotypic labelling and high-performance cell sorting,"Etienne Becht, Yannick Simoni, Elaine Coustan-Smith, Maximilien Evrard, Yang Cheng ...",2019.0,8.0
GIFT: Guided and Interpretable Factorization for Tensors with an application to large-scale multi-platform cancer analysis,"Jungwoo Lee, Sejoon Oh, Lee Sael",2018.0,7.0
SpliceRover: interpretable convolutional neural networks for improved splice site prediction,"Jasper Zuallaert, Fréderic Godin, Mijung Kim, Arne Soete, Yvan Saeys ...",2018.0,32.0
BioStructMap: a Python tool for integration of protein structure and sequence-based features,"Andrew J Guy, Vashti Irani, Jack S Richards, Paul A Ramsland",2018.0,1.0
snpAD: an ancient DNA genotype caller,Kay Prüfer,2020.0,26.0
Using tree-based methods for detection of gene–gene interactions in the presence of a polygenic signal: simulation study with application to educational attainment in the Generation Scotland Cohort Study,"Joeri J Meijsen, Alexandros Rammos, Archie Campbell, Caroline Hayward, David J Porteous ...",2019.0,5.0
GWASinlps: non-local prior based iterative SNP selection tool for genome-wide association studies,"Nilotpal Sanyal, Min-Tzu Lo, Karolina Kauppi, Srdjan Djurovic, Ole A Andreassen ...",2019.0,6.0
Prediction of kinetics of protein folding with non-redundant contact information,"Luciano Censoni, Leandro Martínez",2018.0,5.0
Predicting clone genotypes from tumor bulk sequencing of multiple samples,"Sayaka Miura, Karen Gomez, Oscar Murillo, Louise A Huuki, Tracy Vu ...",2018.0,15.0
Grimon: graphical interface to visualize multi-omics networks,"Masahiro Kanai, Yuichi Maeda, Yukinori Okada",2018.0,2.0
13Check_RNA: a tool to evaluate 13C chemical shift assignments of RNA,"A A Icazatti, O A Martin, M Villegas, I Szleifer, J A Vila",2018.0,1.0
panISa: ab initio detection of insertion sequences in bacterial genomes from short read sequence data,"Panisa Treepong, Christophe Guyeux, Alexandre Meunier, Charlotte Couchoud, Didier Hocquet ...",2018.0,11.0
Accurate prediction of protein contact maps by coupling residual two-dimensional bidirectional long short-term memory with convolutional neural networks,"Jack Hanson, Kuldip Paliwal, Thomas Litfin, Yuedong Yang, Yaoqi Zhou",2018.0,74.0
MolArt: a molecular structure annotation and visualization tool,"David Hoksza, Piotr Gawron, Marek Ostaszewski, Reinhard Schneider",2018.0,9.0
SONiCS: PCR stutter noise correction in genome-scale microsatellites,"Katarzyna Z Kedzierska, Livia Gerber, Daniele Cagnazzi, Michael Krützen, Aakrosh Ratan ...",2018.0,3.0
Estimating pseudocounts and fold changes for digital expression measurements,Florian Erhard,2018.0,4.0
htsget: a protocol for securely streaming genomic data,"Jerome Kelleher, Mike Lin, C H Albach, Ewan Birney, Robert Davies ...",2019.0,3.0
ICBdocker: a Docker image for proteome annotation and visualization,"Nicola Bordin, Damien P Devos",2018.0,1.0
mol2sphere: spherical decomposition of multi-domain molecules for visualization and coarse grained spatial modeling,"Joseph Masison, Paul J Michalski, Leslie M Loew, Adam D Schuyler",2018.0,2.0
HUME: large-scale detection of causal genetic factors of adverse drug reactions,"Mehrdad Mansouri, Bowei Yuan, Colin J D Ross, Bruce C Carleton, Martin Ester",2018.0,4.0
Operon-mapper: a web server for precise operon identification in bacterial and archaeal genomes,"Blanca Taboada, Karel Estrada, Ricardo Ciria, Enrique Merino",2018.0,44.0
Deep convolutional networks for quality assessment of protein folds,"Georgy Derevyanko, Sergei Grudinin, Yoshua Bengio, Guillaume Lamoureux",2018.0,46.0
"GeneSpy, a user-friendly and flexible genomic context visualizer","Pierre Simon Garcia, Frédéric Jauffrit, Christophe Grangeasse, Céline Brochier-Armanet",2019.0,12.0
The ancestral KH peptide at the root of a domain family with three different folds,"Joana Pereira, Andrei N Lupas",2018.0,5.0
RiboSketch: versatile visualization of multi-stranded RNA and DNA secondary structure,"Jacob S Lu, Eckart Bindewald, Wojciech K Kasprzak, Bruce A Shapiro",2018.0,6.0
"ePCR: an R-package for survival and time-to-event prediction in advanced prostate cancer, applied to real-world patient cohorts","Teemu D Laajala, Mika Murtojärvi, Arho Virkki, Tero Aittokallio",2018.0,2.0
Metaxa2 Database Builder: enabling taxonomic identification from metagenomic or metabarcoding data using any genetic marker,"Johan Bengtsson-Palme, Rodney T Richardson, Marco Meola, Christian Wurzbacher, Émilie D Tremblay ...",2018.0,33.0
Prioritizing predictive biomarkers for gene essentiality in cancer cells with mRNA expression data and DNA copy number profile,"Yuanfang Guan, Tingyang Li, Hongjiu Zhang, Fan Zhu, Gilbert S Omenn",2018.0,2.0
ClusterScan: simple and generalistic identification of genomic clusters,"Massimiliano Volpe, Marco Miralto, Stefano Gustincich, Remo Sanges",2018.0,3.0
DDR: efficient computational method to predict drug–target interactions using graph mining and machine learning approaches,"Rawan S Olayan, Haitham Ashoor, Vladimir B Bajic",2018.0,64.0
Optimality and identification of dynamic models in systems biology: an inverse optimal control framework,"Nikolaos Tsiantis, Eva Balsa-Canto, Julio R Banga",2018.0,14.0
"TranscriptClean: variant-aware correction of indels, mismatches and splice junctions in long-read transcripts","Dana Wyman, Ali Mortazavi",2019.0,14.0
Chemical shift-based identification of monosaccharide spin-systems with NMR spectroscopy to complement untargeted glycomics,"Piotr Klukowski, Mario Schubert",2019.0,7.0
iMetaLab 1.0: a web platform for metaproteomics data analysis,"Bo Liao, Zhibin Ning, Kai Cheng, Xu Zhang, Leyuan Li ...",2018.0,26.0
gmxapi: a high-level interface for advanced control and extension of molecular dynamics simulations,"M Eric Irrgang, Jennifer M Hays, Peter M Kasson",2018.0,3.0
SciApps: a cloud-based platform for reproducible bioinformatics workflows,"Liya Wang, Zhenyuan Lu, Peter Van Buren, Doreen Ware",2018.0,15.0
SSMART: sequence-structure motif identification for RNA-binding proteins,"Alina Munteanu, Neelanjan Mukherjee, Uwe Ohler",2018.0,12.0
Modelling BioNano optical data and simulation study of genome map assembly,"Ping Chen, Xinyun Jing, Jian Ren, Han Cao, Pei Hao ...",2018.0,6.0
3DPatch: fast 3D structure visualization with residue conservation,"David Jakubec, Jiří Vondrášek, Robert D Finn",2019.0,
Graph-guided multi-task sparse learning model: a method for identifying antigenic variants of influenza A(H3N2) virus,"Lei Han, Lei Li, Feng Wen, Lei Zhong, Tong Zhang ...",2019.0,3.0
ImmunomeBrowser: a tool to aggregate and visualize complex and heterogeneous epitopes in reference proteins,"Sandeep Kumar Dhanda, Randi Vita, Brendan Ha, Alba Grifoni, Bjoern Peters ...",2018.0,14.0
AA9int: SNP interaction pattern search using non-hierarchical additive model set,"Hui-Yi Lin, Po-Yu Huang, Dung-Tsa Chen, Heng-Yuan Tung, Thomas A Sellers ...",2018.0,1.0
iEnhancer-EL: identifying enhancers and their strength with ensemble learning approach,"Bin Liu, Kai Li, De-Shuang Huang, Kuo-Chen Chou",2018.0,90.0
snpEnrichR: analyzing co-localization of SNPs and their proxies in genomic regions,"Kari Nousiainen, Kartiek Kanduri, Isis Ricaño-Ponce, Cisca Wijmenga, Riitta Lahesmaa ...",2018.0,
MetQy—an R package to query metabolic functions of genes and genomes,"Andrea S Martinez-Vernon, Frederick Farrell, Orkun S Soyer",2018.0,2.0
Detection of multi-dimensional co-exclusion patterns in microbial communities,"Levent Albayrak, Kamil Khanipov, George Golovko, Yuriy Fofanov",2018.0,5.0
Integrating proteomic or transcriptomic data into metabolic models using linear bound flux balance analysis,"Mingyuan Tian, Jennifer L Reed",2018.0,25.0
MIDORI server: a webserver for taxonomic assignment of unknown metazoan mitochondrial-encoded sequences using a curated database,"Matthieu Leray, Shian-Lei Ho, I-Jeng Lin, Ryuji J Machida",2018.0,8.0
Message from the ISCB: 2018 ISCB Accomplishments by a Senior Scientist Award,"Christiana N Fogg, Diane E Kovats, Ron Shamir",2018.0,1.0
2018 ISCB Innovator Award recognizes M. Madan Babu,"Christiana N Fogg, Diane E Kovats, Ron Shamir",2018.0,
Message from the ISCB: 2018 Outstanding Contributions to ISCB Award: Russ Altman,"Christiana N Fogg, Diane E Kovats, Ron Shamir",2018.0,
2018 ISCB Overton Prize awarded to Cole Trapnell,"Christiana N Fogg, Diane E Kovats, Ron Shamir",2018.0,
An in silico proteomics screen to predict and prioritize protein–protein interactions dependent on post-translationally modified motifs,"Anna M Schmoker, Heather E Driscoll, Stefanie R Geiger, James J Vincent, Alicia M Ebert ...",2018.0,2.0
DeepMirTar: a deep-learning approach for predicting human miRNA targets,"Ming Wen, Peisheng Cong, Zhimin Zhang, Hongmei Lu, Tonghua Li",2018.0,27.0
ProAcePred: prokaryote lysine acetylation sites prediction based on elastic net feature optimization,"Guodong Chen, Man Cao, Kun Luo, Lina Wang, Pingping Wen ...",2018.0,10.0
ACPred-FL: a sequence-based predictor using effective feature representation to improve the prediction of anti-cancer peptides,"Leyi Wei, Chen Zhou, Huangrong Chen, Jiangning Song, Ran Su",2018.0,120.0
"Axe: rapid, competitive sequence read demultiplexing using a trie","Kevin D Murray, Justin O Borevitz",2018.0,19.0
ggCyto: next generation open-source visualization software for cytometry,"Phu Van, Wenxin Jiang, Raphael Gottardo, Greg Finak",2018.0,13.0
deepNF: deep network fusion for protein function prediction,"Vladimir Gligorijević, Meet Barot, Richard Bonneau",2018.0,66.0
PREQUAL: detecting non-homologous characters in sets of unaligned homologous sequences,"Simon Whelan, Iker Irisarri, Fabien Burki",2018.0,29.0
Improved design and analysis of CRISPR knockout screens,"Chen-Hao Chen, Tengfei Xiao, Han Xu, Peng Jiang, Clifford A Meyer ...",2018.0,19.0
Lost in translation: bioinformatic analysis of variations affecting the translation initiation codon in the human genome,"Francisco Abad-Navarro, María Eugenia de la Morena-Barrio, Jesualdo Tomás Fernández-Breis, Javier Corral",2018.0,1.0
Knotty: efficient and accurate prediction of complex RNA pseudoknot structures,"Hosna Jabbari, Ian Wark, Carlo Montemagno, Sebastian Will",2018.0,12.0
The Rényi divergence enables accurate and precise cluster analysis for localization microscopy,"Adela D Staszowska, Patrick Fox-Roberts, Liisa M Hirvonen, Christopher J Peddie, Lucy M Collinson ...",2018.0,2.0
LiveKraken––real-time metagenomic classification of illumina data,"Simon H Tausch, Benjamin Strauch, Andreas Andrusch, Tobias P Loka, Martin S Lindner ...",2018.0,16.0
TEcandidates: prediction of genomic origin of expressed transposable elements using RNA-seq data,"Braulio Valdebenito-Maturana, Gonzalo Riadi",2018.0,7.0
Accelerating flux balance calculations in genome-scale metabolic models by localizing the application of loopless constraints,"Siu H J Chan, Lin Wang, Satyakam Dash, Costas D Maranas",2018.0,12.0
Transfer learning for biomedical named entity recognition with neural networks,"John M Giorgi, Gary D Bader",2018.0,64.0
Predicting Cancer Drug Response using a Recommender System,"Chayaporn Suphavilai, Denis Bertrand, Niranjan Nagarajan",2018.0,38.0
An automated method for detecting alternatively spliced protein domains,"Vitor Coelho, Michael Sammeth",2018.0,
TriPoly: haplotype estimation for polyploids using sequencing data of related individuals,"Ehsan Motazedi, Dick de Ridder, Richard Finkers, Samantha Baldwin, Susan Thomson ...",2018.0,13.0
LncADeep: an ab initio lncRNA identification and functional annotation tool based on deep learning,"Cheng Yang, Longshu Yang, Man Zhou, Haoling Xie, Chengjiu Zhang ...",2018.0,48.0
A graph-embedded deep feedforward network for disease outcome classification and feature selection using gene expression data,"Yunchuan Kong, Tianwei Yu",2018.0,41.0
MODE-TASK: large-scale protein motion tools,"Caroline Ross, Bilal Nizami, Michael Glenister, Olivier Sheik Amamuddy, Ali Rana Atilgan ...",2018.0,10.0
RIFRAF: a frame-resolving consensus algorithm,"Kemal Eren, Ben Murrell",2017.0,
Pathway-structured predictive modeling for multi-level drug response in multiple myeloma,"Xinyan Zhang, Bingzong Li, Huiying Han, Sha Song, Hongxia Xu ...",2018.0,2.0
NGL viewer: web-based molecular graphics for large complexes,"Alexander S Rose, Anthony R Bradley, Yana Valasatava, Jose M Duarte, Andreas Prlić ...",2018.0,234.0
mEBT: multiple-matching evidence-based translator of murine genomic responses for human immunity studies,"Donghyun Tae, Junhee Seok",2018.0,
LncRNAnet: long non-coding RNA identification using deep learning,"Junghwan Baek, Byunghan Lee, Sunyoung Kwon, Sungroh Yoon",2018.0,44.0
TomoEED: fast edge-enhancing denoising of tomographic volumes,"J J Moreno, A Martínez-Sánchez, J A Martínez, E M Garzón, J J Fernández",2018.0,6.0
GateFinder: projection-based gating strategy optimization for flow and mass cytometry,"Nima Aghaeepour, Erin F Simonds, David J H F Knapp, Robert V Bruggner, Karen Sachs ...",2018.0,10.0
"Motif scraper: a cross-platform, open-source tool for identifying degenerate nucleotide motif matches in FASTA files",Elisha D O Roberson,2018.0,4.0
geck: trio-based comparative benchmarking of variant calls,"Péter Kómár, Deniz Kural",2018.0,6.0
Bio-knowledge-based filters improve residue–residue contact prediction accuracy,"P P Wozniak, J Pelc, M Skrzypecki, G Vriend, M Kotulska",2018.0,1.0
The size matters? A computational tool to design bivalent ligands,"Laura Pérez-Benito, Andrew Henry, Minos-Timotheos Matsoukas, Laura Lopez, Daniel Pulido ...",2018.0,9.0
PEA: an integrated R toolkit for plant epitranscriptome analysis,"Jingjing Zhai, Jie Song, Qian Cheng, Yunjia Tang, Chuang Ma",2018.0,9.0
EBIC: an evolutionary-based parallel biclustering algorithm for pattern discovery,"Patryk Orzechowski, Moshe Sipper, Xiuzhen Huang, Jason H Moore",2018.0,16.0
bcSeq: an R package for fast sequence mapping in high-throughput shRNA and CRISPR screens,"Jiaxing Lin, Jeremy Gresham, Tongrong Wang, So Young Kim, James Alvarez ...",2018.0,
Nextstrain: real-time tracking of pathogen evolution,"James Hadfield, Colin Megill, Sidney M Bell, John Huddleston, Barney Potter ...",2018.0,627.0
Using meshes for MeSH term enrichment and semantic analyses,Guangchuang Yu,2018.0,14.0
GSCALite: a web server for gene set cancer analysis,"Chun-Jie Liu, Fei-Fei Hu, Meng-Xuan Xia, Leng Han, Qiong Zhang ...",2018.0,66.0
SimExTargId: a comprehensive package for real-time LC-MS data acquisition and analysis,"William M B Edmands, Josie Hayes, Stephen M Rappaport",2018.0,3.0
YAMDA: thousandfold speedup of EM-based motif discovery using deep learning libraries and GPU,"Daniel Quang, Yuanfang Guan, Stephen C J Parker",2018.0,4.0
PANDA-view: an easy-to-use tool for statistical analysis and visualization of quantitative proteomics data,"Cheng Chang, Kaikun Xu, Chaoping Guo, Jinxia Wang, Qi Yan ...",2018.0,17.0
Exploring drug space with ChemMaps.com,"Alexandre Borrel, Nicole C Kleinstreuer, Denis Fourches",2018.0,6.0
Application of network smoothing to glycan LC-MS profiling,"Joshua Klein, Luis Carvalho, Joseph Zaia",2018.0,18.0
SoS Notebook: an interactive multi-language data analysis environment,"Bo Peng, Gao Wang, Jun Ma, Man Chong Leong, Chris Wakefield ...",2018.0,7.0
MASCOT: parameter and state inference under the marginal structured coalescent approximation,"Nicola F Müller, David Rasmussen, Tanja Stadler",2018.0,29.0
PyCoTools: a Python toolbox for COPASI,"Ciaran M Welsh, Nicola Fullard, Carole J Proctor, Alvaro Martinez-Guimera, Robert J Isfort ...",2019.0,
Combining probabilistic alignments with read pair information improves accuracy of split-alignments,"Anish M S Shrestha, Naruki Yoshikawa, Kiyoshi Asai",2018.0,
Palimpsest: an R package for studying mutational and structural variant signatures along clonal evolution in cancer,"Jayendra Shinde, Quentin Bayard, Sandrine Imbeaud, Théo Z Hirsch, Feng Liu ...",2018.0,23.0
AC-DIAMOND v1: accelerating large-scale DNA–protein alignment,"Huijun Mai, Yifan Zhang, Dinghua Li, Henry Chi-Ming Leung, Ruibang Luo ...",2018.0,2.0
Identification and characterization of moonlighting long non-coding RNAs based on RNA and protein interactome,"Lixin Cheng, Kwong-Sak Leung",2018.0,17.0
ConSpeciFix: classifying prokaryotic species based on gene flow,"Louis-Marie Bobay, Brian Shin-Hua Ellis, Howard Ochman",2018.0,6.0
Single cell clustering based on cell-pair differentiability correlation and variance analysis,"Hao Jiang, Lydia L Sohn, Haiyan Huang, Luonan Chen",2018.0,25.0
MRMAssayDB: an integrated resource for validated targeted proteomics assays,"Pallab Bhowmick, Yassene Mohammed, Christoph H Borchers",2018.0,10.0
"FlexiDot: highly customizable, ambiguity-aware dotplots for visual sequence analyses","Kathrin M Seibt, Thomas Schmidt, Tony Heitkam",2018.0,22.0
Lineage-associated underrepresented permutations (LAUPs) of mammalian genomic sequences based on a Jellyfish-based LAUPs analysis application (JBLA),"Le Zhang, Ming Xiao, Jingsong Zhou, Jun Yu",2018.0,17.0
"pyABC: distributed, likelihood-free inference","Emmanuel Klinger, Dennis Rickert, Jan Hasenauer",2017.0,9.0
Indexed variation graphs for efficient and accurate resistome profiling,"Will P M Rowe, Martyn D Winn",2018.0,24.0
RecPhyloXML: a format for reconciled gene trees,"Wandrille Duchemin, Guillaume Gence, Anne-Muriel Arigon Chifolleau, Lars Arvestad, Mukul S Bansal ...",2018.0,8.0
TimeXNet Web: identifying cellular response networks from diverse omics time-course data,"Phit Ling Tan, Yosvany López, Kenta Nakai, Ashwini Patil",2018.0,
Transform-MinER: transforming molecules in enzyme reactions,"Jonathan D Tyzack, Antonio J M Ribeiro, Neera Borkakoti, Janet M Thornton",2018.0,4.0
Minimap2: pairwise alignment for nucleotide sequences,Heng Li,2020.0,1.0
Development and evaluation of a deep learning model for protein–ligand binding affinity prediction,"Marta M Stepniewska-Dziubinska, Piotr Zielenkiewicz, Pawel Siedlecki",2018.0,94.0
Base-pair resolution detection of transcription factor binding site by deep deconvolutional network,"Sirajul Salekin, Jianqiu Michelle Zhang, Yufei Huang",2018.0,8.0
The revival of the Gini importance?,"Stefano Nembrini, Inke R König, Marvin N Wright",2020.0,1.0
ProteomeVis: a web app for exploration of protein properties from structure to sequence evolution across organisms’ proteomes,"Rostam M Razban, Amy I Gilson, Niamh Durfee, Hendrik Strobelt, Kasper Dinkla ...",2018.0,4.0
CAVER Analyst 2.0: analysis and visualization of channels and tunnels in protein structures and molecular dynamics trajectories,"Adam Jurcik, David Bednar, Jan Byska, Sergio M Marques, Katarina Furmanova ...",2018.0,80.0
Two C++ libraries for counting trees on a phylogenetic terrace,"R Biczok, P Bozsoky, P Eisenmann, J Ernst, T Ribizel ...",2018.0,11.0
Grouper: graph-based clustering and annotation for improved de novo transcriptome analysis,"Laraib Malik, Fatemeh Almodaresi, Rob Patro",2018.0,7.0
REGGAE: a novel approach for the identification of key transcriptional regulators,"Tim Kehl, Lara Schneider, Kathrin Kattler, Daniel Stöckel, Jenny Wegert ...",2018.0,8.0
LZW-Kernel: fast kernel utilizing variable length code blocks from LZW compressors for protein sequence classification,"Gleb Filatov, Bruno Bauwens, Attila Kertész-Farkas",2018.0,5.0
Jwalk and MNXL web server: model validation using restraints from crosslinking mass spectrometry,"Joshua M A Bullock, Konstantinos Thalassinos, Maya Topf",2018.0,17.0
PROBE: analysis and visualization of protein block-level evolution,"Arnaud Kress, Odile Lecompte, Olivier Poch, Julie D Thompson",2018.0,4.0
Edge-group sparse PCA for network-guided high dimensional data analysis,"Wenwen Min, Juan Liu, Shihua Zhang",2018.0,10.0
MICAN-SQ: a sequential protein structure alignment program that is applicable to monomers and all types of oligomers,"Shintaro Minami, Kengo Sawada, Motonori Ota, George Chikenji",2018.0,3.0
Generic accelerated sequence alignment in SeqAn using vectorization and multi-threading,"René Rahn, Stefan Budach, Pascal Costanza, Marcel Ehrhardt, Jonny Hancox ...",2018.0,13.0
NGScloud: RNA-seq analysis of non-model species using cloud computing,"Fernando Mora-Márquez, José Luis Vázquez-Poletti, Unai López de Heredia",2018.0,4.0
Recombinational DSBs-intersected genes converge on specific disease- and adaptability-related pathways,"Zhi-Kai Yang, Hao Luo, Yanming Zhang, Baijing Wang, Feng Gao",2018.0,
canvasDesigner: a versatile interactive high-resolution scientific multi-panel visualization toolkit,"Baohong Zhang, Shanrong Zhao, Isaac Neuhaus",2018.0,5.0
VarExp: estimating variance explained by genome-wide GxE summary statistics,"Vincent Laville, Amy R Bentley, Florian Privé, Xiaofeng Zhu, Jim Gauderman ...",2018.0,10.0
"Sorting cancer karyotypes using double-cut-and-joins, duplications and deletions","Ron Zeira, Ron Shamir",2018.0,5.0
MACARON: a python framework to identify and re-annotate multi-base affected codons in whole genome/exome sequence data,"Waqasuddin Khan, Ganapathi Varma Saripella, Thomas Ludwig, Tania Cuppens, Florian Thibord ...",2018.0,3.0
Improved enzyme annotation with EC-specific cutoffs using DETECT v2,"Nirvana Nursimulu, Leon L Xu, James D Wasmuth, Ivan Krukov, John Parkinson",2018.0,7.0
polymapR—linkage analysis and genetic map construction from F1 populations of outcrossing polyploids,"Peter M Bourke, Geert van Geest, Roeland E Voorrips, Johannes Jansen, Twan Kranenburg ...",2018.0,30.0
PBRpredict-Suite: a suite of models to predict peptide-recognition domain residues from protein sequence,"Sumaiya Iqbal, Md Tamjidul Hoque",2018.0,18.0
The UEA sRNA Workbench (version 4.4): a comprehensive suite of tools for analyzing miRNAs and sRNAs,"Matthew B Stocks, Irina Mohorianu, Matthew Beckers, Claudia Paicu, Simon Moxon ...",2018.0,17.0
Self-consistency test reveals systematic bias in programs for prediction change of stability upon mutation,"Dinara R Usmanova, Natalya S Bogatyreva, Joan Ariño Bernad, Aleksandra A Eremina, Anastasiya A Gorshkova ...",2018.0,22.0
Applying graph theory to protein structures: an Atlas of coiled coils,"Jack W Heal, Gail J Bartlett, Christopher W Wood, Andrew R Thomson, Derek N Woolfson",2018.0,6.0
Modeling one thousand intron length distributions with fitild,Osamu Gotoh,2018.0,4.0
Predicting RNA–protein binding sites and motifs through combining local and global deep convolutional neural networks,"Xiaoyong Pan, Hong-Bin Shen",2018.0,70.0
Knoto-ID: a tool to study the entanglement of open protein chains using the concept of knotoids,"Julien Dorier, Dimos Goundaroulis, Fabrizio Benedetti, Andrzej Stasiak",2018.0,18.0
"AlphaMate: a program for optimizing selection, maintenance of diversity and mate allocation in breeding programs","Gregor Gorjanc, John M Hickey",2018.0,10.0
Distinguishing prognostic and predictive biomarkers: an information theoretic approach,"Konstantinos Sechidis, Konstantinos Papangelou, Paul D Metcalfe, David Svensson, James Weatherall ...",2018.0,27.0
