title,year,citations
Metagene projection characterizes GEN2.2 and CAL-1 as relevant human plasmacytoid dendritic cell models,2017.0,9.0
HiDi: an efficient reverse engineering schema for large-scale dynamic regulatory network reconstruction using adaptive differentiation,2017.0,7.0
DelPhiForce web server: electrostatic forces and energy calculations and visualization,2017.0,19.0
MusiteDeep: a deep-learning framework for general and kinase-specific phosphorylation site prediction,2017.0,95.0
MFIB: a repository of protein complexes with mutual folding induced by binding,2017.0,35.0
ComplexViewer: visualization of curated macromolecular complexes,2017.0,
Motif independent identification of potential RNA G-quadruplexes by G4RNA screener,2017.0,34.0
"LRCstats, a tool for evaluating long reads correction methods",2017.0,11.0
fastNGSadmix: admixture proportions and principal component analysis of a single NGS sample,2017.0,16.0
BiobankUniverse: automatic matchmaking between datasets for biobank data discovery and integration,2017.0,2.0
RealityConvert: a tool for preparing 3D models of biochemical structures for augmented and virtual reality,2017.0,24.0
Reference genome assessment from a population scale perspective: an accurate profile of variability and noise,2017.0,1.0
Improved prediction of breast cancer outcome by identifying heterogeneous biomarkers,2017.0,22.0
FAF-Drugs4: free ADME-tox filtering computations for chemical biology and early stages drug discovery,2017.0,91.0
3DBIONOTES v2.0: a web server for the automatic annotation of macromolecular structures,2017.0,15.0
pgRNAFinder: a web-based tool to design distance independent paired-gRNA,2017.0,5.0
Predicting novel metabolic pathways through subgraph mining,2017.0,7.0
Sequence2Vec: a novel embedding approach for modeling transcription factor binding affinity landscape,2017.0,20.0
Cloud-based interactive analytics for terabytes of genomic variants data,2017.0,8.0
iDNA4mC: identifying DNA N4-methylcytosine sites based on nucleotide chemical properties,2017.0,169.0
Towards clinically more relevant dissection of patient heterogeneity via survival-based Bayesian clustering,2017.0,11.0
wft4galaxy: a workflow testing tool for galaxy,2017.0,
pLoc-mAnimal: predict subcellular localization of animal proteins with both single and multiple sites,2017.0,161.0
CrocoBLAST: Running BLAST efficiently in the age of next-generation sequencing,2017.0,3.0
Using uncertainty to link and rank evidence from biomedical literature for model curation,2017.0,22.0
SPRINT: an SNP-free toolkit for identifying RNA editing sites,2017.0,30.0
myVCF: a desktop application for high-throughput mutations data management,2017.0,7.0
PLACNETw: a web-based tool for plasmid reconstruction from bacterial genomes,2017.0,45.0
PySeqLab: an open source Python package for sequence labeling and segmentation,2017.0,2.0
Mechanisms to protect the privacy of families when using the transmission disequilibrium test in genome-wide association studies,2017.0,7.0
"Tissue-specific network-based genome wide study of amygdala imaging
          phenotypes to identify functional interaction modules",2017.0,16.0
Comparison of pre-processing methods for Infinium HumanMethylation450 BeadChip array,2017.0,6.0
Detect differentially methylated regions using non-homogeneous hidden Markov model for methylation array data,2017.0,7.0
FOLD: a method to optimize power in meta-analysis of genetic association studies with overlapping subjects,2017.0,
Phylotyper: in silico predictor of gene subtypes,2017.0,
SPATKIN: a simulator for rule-based modeling of biomolecular site dynamics on surfaces,2017.0,4.0
Prediction and modeling of pre-analytical sampling errors as a strategy to improve plasma NMR metabolomics data,2017.0,9.0
SVmine improves structural variation detection by integrative mining of predictions from multiple algorithms,2017.0,7.0
A robust DF-REML framework for variance components estimation in genetic studies,2017.0,7.0
ScanGEO: parallel mining of high-throughput gene expression data,2017.0,21.0
Standardizing biomass reactions and ensuring complete mass balance in genome-scale metabolic models,2017.0,47.0
proFIA: a data preprocessing workflow for flow injection analysis coupled to high-resolution mass spectrometry,2017.0,11.0
VariantTools: an extensible framework for developing and testing variant callers,2017.0,5.0
Cancer Hallmarks Analytics Tool (CHAT): a text mining approach to organize and evaluate scientific literature on cancer,2017.0,52.0
Analysis and prediction of protein folding energy changes upon mutation by element specific persistent homology,2017.0,48.0
WIsH: who is the host? Predicting prokaryotic hosts from metagenomic phage contigs,2017.0,64.0
GLASS: assisted and standardized assessment of gene variations from Sanger sequence trace data,2017.0,4.0
On expert curation and scalability: UniProtKB/Swiss-Prot as a case study,2017.0,47.0
cgHeliParm: analysis of dsDNA helical parameters for coarse-grained MARTINI molecular dynamics simulations,2017.0,1.0
Gating mass cytometry data by deep learning,2017.0,33.0
MethRaFo: MeDIP-seq methylation estimate using a Random Forest Regressor,2017.0,5.0
Identification of associations between genotypes and longitudinal phenotypes via temporally-constrained group sparse canonical correlation analysis,2017.0,21.0
"Estimation of time-varying growth, uptake and excretion rates from dynamic metabolomics data",2017.0,9.0
Discovery and genotyping of novel sequence insertions in many sequenced individuals,2017.0,20.0
Exploiting sequence-based features for predicting enhancer–promoter interactions,2017.0,37.0
Genomes as documents of evolutionary history: a probabilistic macrosynteny model for the reconstruction of ancestral genomes,2017.0,15.0
Improved data-driven likelihood factorizations for transcript abundance estimation,2017.0,16.0
Systematic identification of feature combinations for predicting drug response with Bayesian multi-view multi-task linear regression,2017.0,38.0
Efficient approximations of RNA kinetics landscape using non-redundant sampling,2017.0,18.0
Tumor phylogeny inference using tree-constrained importance sampling,2017.0,28.0
StereoGene: rapid estimation of genome-wide correlation of continuous or interval feature data,2017.0,19.0
Rectified factor networks for biclustering of omics data,2017.0,5.0
DextMP: deep dive into text for predicting moonlighting proteins,2017.0,7.0
Chromatin accessibility prediction via convolutional long short-term memory networks with k-mer embedding,2017.0,52.0
Modelling haplotypes with respect to reference cohort variation graphs,2017.0,7.0
Abundance estimation and differential testing on strain level in metagenomics data,2017.0,23.0
BIOSSES: a semantic sentence similarity estimation system for the biomedical domain,2017.0,56.0
Applying meta-analysis to genotype-tissue expression data from multiple tissues to identify eQTLs and increase the number of eGenes,2017.0,10.0
SnapDock—template-based docking by Geometric Hashing,2017.0,6.0
Improving the performance of minimizers and winnowing schemes,2017.0,
Incorporating interaction networks into the determination of functionally related hit genes in genomic experiments with Markov random fields,2017.0,5.0
Association testing of bisulfite-sequencing methylation data via a Laplace approximation,2017.0,6.0
A scalable moment-closure approximation for large-scale biochemical reaction networks,2017.0,
A new method to study the change of miRNA–mRNA interactions due to environmental exposures,2017.0,3.0
deBGR: an efficient and near-exact representation of the weighted de Bruijn graph,2017.0,20.0
miniMDS: 3D structural inference from high-resolution Hi-C data,2017.0,39.0
CATS (Coordinates of Atoms by Taylor Series): protein design with backbone flexibility in all locally feasible directions,2017.0,13.0
CircPro: an integrated tool for the identification of circRNAs with protein-coding potential,2017.0,39.0
Deep learning with word embeddings improves biomedical named entity recognition,2017.0,312.0
Orthologous Matrix (OMA) algorithm 2.0: more robust to asymmetric evolutionary rates and more scalable hierarchical orthologous group inference,2017.0,48.0
Deep learning-based subdivision approach for large scale macromolecules structure recovery from electron cryo tomograms,2017.0,25.0
HopLand: single-cell pseudotime recovery using continuous Hopfield network-based modeling of Waddington’s epigenetic landscape,2017.0,16.0
Large-scale structure prediction by improved contact predictions and model quality assessment,2017.0,23.0
Increasing the power of meta-analysis of genome-wide association studies to detect heterogeneous effects,2017.0,18.0
Denoising genome-wide histone ChIP-seq with convolutional neural networks,2017.0,34.0
TITER: predicting translation initiation sites by deep learning,2017.0,39.0
popFBA: tackling intratumour heterogeneity with Flux Balance Analysis,2017.0,12.0
Predicting multicellular function through multi-layer tissue networks,2017.0,204.0
"Efficient simulation of intrinsic, extrinsic and external noise in biochemical systems",2017.0,5.0
Image-based spatiotemporal causality inference for protein signaling networks,2017.0,1.0
Multiple network-constrained regressions expand insights into influenza vaccination responses,2017.0,8.0
"Predicting phenotypes from microarrays using amplified, initially marginal, eigenvector regression",2017.0,5.0
DeepBound: accurate identification of transcript boundaries via deep convolutional neural fields,2017.0,9.0
When loss-of-function is loss of function: assessing mutational signatures and impact of loss-of-function genetic variants,2017.0,25.0
ISMB/ECCB 2017 proceedings,2017.0,
nandb—number and brightness in R with a novel automatic detrending algorithm,2017.0,12.0
"Kollector: transcript-informed, targeted de novo assembly of gene loci",2017.0,11.0
powsimR: power analysis for bulk and single cell RNA-seq experiments,2017.0,60.0
TeachEnG: a Teaching Engine for Genomics,2017.0,
The value of prior knowledge in machine learning of complex network systems,2017.0,19.0
VICTOR: genome-based phylogeny and classification of prokaryotic viruses,2017.0,132.0
gVolante for standardizing completeness assessment of genome and transcriptome assemblies,2017.0,94.0
VCF-Explorer: filtering and analysing whole genome VCF files,2017.0,8.0
DynaPho: a web platform for inferring the dynamics of time-series phosphoproteomics,2017.0,9.0
AlloSigMA: allosteric signaling and mutation analysis server,2017.0,58.0
ISEScan: automated identification of insertion sequence elements in prokaryotic genomes,2017.0,
TITINdb—a computational tool to assess titin’s role as a disease gene,2017.0,22.0
pqsfinder: an exhaustive and imperfection-tolerant search tool for potential quadruplex-forming sequences in R,2017.0,45.0
Linking metabolic network features to phenotypes using sparse group lasso,2017.0,9.0
ProtDec-LTR2.0: an improved method for protein remote homology detection by combining pseudo protein and supervised Learning to Rank,2017.0,29.0
ClusterSignificance: a bioconductor package facilitating statistical analysis of class cluster separations in dimensionality reduced data,2017.0,5.0
Quark enables semi-reference-based compression of RNA-seq data,2017.0,5.0
CausalR: extracting mechanistic sense from genome scale data,2017.0,10.0
FALCON: a toolbox for the fast contextualization of logical networks,2017.0,8.0
modPhEA: model organism Phenotype Enrichment Analysis of eukaryotic gene sets,2017.0,
SpaceScanner: COPASI wrapper for automated management of global stochastic optimization experiments,2017.0,3.0
Inferring transcriptional logic from multiple dynamic experiments,2017.0,1.0
GPU-powered model analysis with PySB/cupSODA,2017.0,10.0
SVM-dependent pairwise HMM: an application to protein pairwise alignments,2017.0,7.0
ALTRE: workflow for defining ALTered regulatory elements using chromatin accessibility data,2017.0,1.0
TSIS: an R package to infer alternative splicing isoform switches for time-series data,2017.0,11.0
The KSEA App: a web-based tool for kinase activity inference from quantitative phosphoproteomics,2017.0,42.0
Forecasting residue–residue contact prediction accuracy,2017.0,5.0
HybridSim-VS: a web server for large-scale ligand-based virtual screening using hybrid similarity recognition techniques,2017.0,15.0
"CoreTracker: accurate codon reassignment prediction, applied to mitochondrial genomes",2017.0,5.0
Partitioned learning of deep Boltzmann machines for SNP data,2017.0,21.0
SCooP: an accurate and fast predictor of protein stability curves as a function of temperature,2017.0,27.0
A multi-scenario genome-wide medical population genetics simulation framework,2017.0,4.0
pulseR: Versatile computational analysis of RNA turnover from metabolic labeling experiments,2017.0,8.0
Identification of transcript regulatory patterns in cell differentiation,2017.0,
Spliceman2: a computational web server that predicts defects in pre-mRNA splicing,2017.0,
Multimodal mechanistic signatures for neurodegenerative diseases (NeuroMMSig): a web server for mechanism enrichment,2017.0,17.0
TSGSIS: a high-dimensional grouped variable selection approach for detection of whole-genome SNP–SNP interactions,2017.0,5.0
High-speed and high-ratio referential genome compression,2017.0,17.0
Panoptes: web-based exploration of large scale genome variation data,2017.0,4.0
GfaPy: a flexible and extensible software library for handling sequence graphs in Python,2017.0,3.0
UpSetR: an R package for the visualization of intersecting sets and their properties,2017.0,611.0
NucliTrack: an integrated nuclei tracking application,2017.0,
The International Society for Computational Biology and WikiProject Computational Biology: celebrating 10 years of collaboration towards open access,2017.0,1.0
BioQueue: a novel pipeline framework to accelerate bioinformatics analysis,2017.0,3.0
BPP: a sequence-based algorithm for branch point prediction,2017.0,12.0
SANDPUMA: ensemble predictions of nonribosomal peptide chemistry reveal biosynthetic diversity across Actinobacteria,2017.0,48.0
Probability Map Viewer: near real-time probability map generator of serial block electron microscopy collections,2017.0,
Matrix completion with side information and its applications in predicting the antigenicity of influenza viruses,2017.0,10.0
The interfacial character of antibody paratopes: analysis of antibody–antigen structures,2017.0,24.0
TIminer: NGS data mining pipeline for cancer immunology and immunotherapy,2017.0,46.0
kmerPyramid: an interactive visualization tool for nucleobase and k-mer frequencies,2017.0,
matter: an R package for rapid prototyping with larger-than-memory datasets on disk,2017.0,3.0
omiXcore: a web server for prediction of protein interactions with large RNA,2017.0,14.0
rqt: an R package for gene-level meta-analysis,2017.0,3.0
PhylOligo: a package to identify contaminant or untargeted organism sequences in genome assemblies,2017.0,15.0
Detecting and removing multiplicative spatial bias in high-throughput screening technologies,2017.0,4.0
Pheno4J: a gene to phenotype graph database,2017.0,
GraphSpace: stimulating interdisciplinary collaborations in network biology,2017.0,14.0
CloudNeo: a cloud pipeline for identifying patient-specific tumor neoantigens,2017.0,31.0
Message from the ISCB: 2017 ISCB Innovator Award Given to Aviv Regev,2017.0,
"CancerSubtypes: an R/Bioconductor package for molecular cancer subtype identification, validation and visualization",2017.0,60.0
Sparse redundancy analysis of high-dimensional genetic and genomic data,2017.0,9.0
Message from the ISCB: 2017 ISCB Accomplishment by a Senior Scientist Award Given to Pavel Pevzner,2017.0,
MoDMaps3D: an interactive webtool for the quantification and 3D visualization of interrelationships in a dataset of DNA sequences,2017.0,8.0
A spectral algorithm for fast de novo layout of uncorrected long nanopore reads,2017.0,8.0
Message from the ISCB: 2017 ISCB Overton Prize Awarded to Christoph Bock,2017.0,
Fast bootstrapping-based estimation of confidence intervals of expression levels and differential expression from RNA-Seq data,2017.0,30.0
EpiCompare: an online tool to define and explore genomic regions with tissue or cell type-specific epigenomic features,2017.0,11.0
"FQC Dashboard: integrates FastQC results into a web-based, interactive, and extensible FASTQ quality control tool",2017.0,172.0
runBNG: a software package for BioNano genomic analysis on the command line,2017.0,7.0
DEIsoM: a hierarchical Bayesian model for identifying differentially expressed isoforms using biological replicates,2017.0,
Phantom: investigating heterogeneous gene sets in time-course data,2017.0,1.0
FunGAP: Fungal Genome Annotation Pipeline using evidence-based gene model evaluation,2017.0,23.0
JDINAC: joint density-based non-parametric differential interaction network analysis and classification using high-dimensional sparse omics data,2017.0,16.0
Glycan Reader is improved to recognize most sugar types and chemical modifications in the Protein Data Bank,2017.0,33.0
HUGIn: Hi-C Unifying Genomic Interrogator,2017.0,
BreakPoint Surveyor: a pipeline for structural variant visualization,2017.0,5.0
Model-based branching point detection in single-cell data by K-branches clustering,2017.0,9.0
"ISAMBARD: an open-source computational environment for biomolecular analysis, modelling and design",2017.0,24.0
PASTASpark: multiple sequence alignment meets Big Data,2017.0,10.0
Integrative analysis of multiple genomic variables using a hierarchical Bayesian model,2017.0,5.0
GateKeeper: a new hardware architecture for accelerating pre-alignment in DNA short read mapping,2017.0,53.0
Hierarchical probabilistic models for multiple gene/variant associations based on next-generation sequencing data,2017.0,3.0
MD-TASK: a software suite for analyzing molecular dynamics trajectories,2017.0,58.0
DeepSite: protein-binding site predictor using 3D-convolutional neural networks,2017.0,138.0
Moran’s I quantifies spatio-temporal pattern formation in neural imaging data,2017.0,9.0
karyoploteR: an R/Bioconductor package to plot customizable genomes displaying arbitrary data,2017.0,131.0
Structurexplor: a platform for the exploration of structural features of RNA secondary structures,2017.0,3.0
Protein–Sol: a web tool for predicting protein solubility from sequence,2017.0,91.0
HEROD: a human ethnic and regional specific omics database,2017.0,1.0
Computational modeling of immune system of the fish for a more effective vaccination in aquaculture,2017.0,8.0
CWDPRNP: a tool for cervid prion sequence analysis in program R,2017.0,1.0
ASAP: a web-based platform for the analysis and interactive visualization of single-cell RNA-seq data,2017.0,58.0
M2Align: parallel multiple sequence alignment with a multi-objective metaheuristic,2017.0,12.0
DNA sequence+shape kernel enables alignment-free modeling of transcription factor binding,2017.0,13.0
GLANET: genomic loci annotation and enrichment tool,2017.0,9.0
Flexbar 3.0 – SIMD and multicore parallelization,2017.0,
CRISPRcloud: a secure cloud-based pipeline for CRISPR pooled screen deconvolution,2017.0,14.0
MetaSRA: normalized human sample-specific metadata for the Sequence Read Archive,2017.0,45.0
"Molecular heterogeneity at the network level: high-dimensional testing, clustering and a TCGA case study",2017.0,13.0
Predicting accurate contacts in thousands of Pfam domain families using PconsC3,2017.0,34.0
chimeraviz: a tool for visualizing chimeric RNA,2017.0,
PhyD3: a phylogenetic tree viewer with extended phyloXML support for functional genomics data visualization,2017.0,55.0
Accelerating high-dimensional clustering with lossless data reduction,2017.0,3.0
The neXtProt peptide uniqueness checker: a tool for the proteomics community,2017.0,35.0
PIXiE: an algorithm for automated ion mobility arrival time extraction and collision cross section calculation using global data association,2017.0,6.0
HTSvis: a web app for exploratory data analysis and visualization of arrayed high-throughput screens,2017.0,3.0
False discovery rate control incorporating phylogenetic tree increases detection power in microbiome-wide multiple testing,2017.0,35.0
Single-cell regulome data analysis by SCRAT,2017.0,21.0
DIRECTION: a machine learning framework for predicting and characterizing DNA methylation and hydroxymethylation in mammalian genomes,2017.0,13.0
OMTools: a software package for visualizing and processing optical mapping data,2017.0,14.0
PROXiMATE: a database of mutant protein–protein complex thermodynamics and kinetics,2017.0,25.0
MAGenTA: a Galaxy implemented tool for complete Tn-Seq analysis and data visualization,2017.0,18.0
IGESS: a statistical approach to integrating individual-level genotype data and summary statistics in genome-wide association studies,2017.0,6.0
E2FM: an encrypted and compressed full-text index for collections of genomic sequences,2017.0,
POSSUM: a bioinformatics toolkit for generating numerical sequence feature descriptors based on PSSM profiles,2017.0,90.0
BioMake: a GNU make-compatible utility for declarative workflow management,2017.0,4.0
RankProd 2.0: a refactored bioconductor package for detecting differentially expressed features in molecular profiling datasets,2017.0,42.0
Foldit Standalone: a video game-derived protein structure manipulation interface using Rosetta,2017.0,50.0
Application of the cghRA framework to the genomic characterization of Diffuse Large B-Cell Lymphoma,2017.0,1.0
rMFilter: acceleration of long read-based structure variation calling by chimeric read filtering,2017.0,
McPAS-TCR: a manually curated catalogue of pathology-associated T cell receptor sequences,2017.0,82.0
MarDRe: efficient MapReduce-based removal of duplicate DNA reads in the cloud,2017.0,9.0
Assembling draft genomes using contiBAIT,2017.0,
twoddpcr: an R/Bioconductor package and Shiny app for Droplet Digital PCR analysis,2017.0,10.0
An efficient graph kernel method for non-coding RNA functional prediction,2017.0,6.0
FlashPCA2: principal component analysis of Biobank-scale genotype datasets,2017.0,97.0
CMDR based differential evolution identifies the epistatic interaction in genome-wide association studies,2017.0,28.0
Annotating function to differentially expressed LincRNAs in myelodysplastic syndrome using a network-based method,2017.0,12.0
modlAMP: Python for antimicrobial peptides,2017.0,
SinCHet: a MATLAB toolbox for single cell heterogeneity analysis in cancer,2017.0,4.0
Differential privacy-based evaporative cooling feature selection and classification with relief-F and random forests,2017.0,12.0
"Accounting for tumor purity improves cancer subtype classification from DNA
          methylation data",2017.0,17.0
Exploring spatially adjacent TFBS-clustered regions with Hi-C data,2017.0,
Reliability of algorithmic somatic copy number alteration detection from targeted capture data,2017.0,8.0
The spike-and-slab lasso Cox model for survival prediction and associated genes detection,2017.0,21.0
PopFly: the Drosophila population genomics browser,2017.0,
KMC 3: counting and manipulating k-mer statistics,2017.0,
OMSim: a simulator for optical map data,2017.0,
EBT: a statistic test identifying moderate size of significant features with balanced power and precision for genome-wide rate comparisons,2017.0,6.0
A deep learning framework for improving long-range residue–residue contact prediction using a hierarchical strategy,2017.0,22.0
STOPGAP: a database for systematic target opportunity assessment by genetic association predictions,2017.0,23.0
Constructing linkage maps in the genomics era with MapDisto 2.0,2017.0,16.0
RIblast: an ultrafast RNA–RNA interaction prediction system based on a seed-and-extension approach,2017.0,35.0
SigSeeker: a peak-calling ensemble approach for constructing epigenetic signatures,2017.0,7.0
Neuro-symbolic representation learning on biological knowledge graphs,2017.0,76.0
RNAblueprint: flexible multiple target nucleic acid sequence design,2017.0,13.0
Multi-label classifier based on histogram of gradients for predicting the anatomical therapeutic chemical class/classes of a given compound,2017.0,11.0
modSaRa: a computationally efficient R package for CNV identification,2017.0,4.0
HLA class I binding prediction via convolutional neural networks,2017.0,53.0
Mapping genes for calcium signaling and their associated human genetic disorders,2017.0,9.0
A method for learning a sparse classifier in the presence of missing data for high-dimensional biological datasets,2017.0,8.0
MOST-visualization: software for producing automated textbook-style maps of genome-scale metabolic networks,2017.0,3.0
ClusPro PeptiDock: efficient global docking of peptide recognition motifs using FFT,2017.0,32.0
"Capturing non-local interactions by long short-term memory bidirectional recurrent neural networks for improving prediction of protein secondary structure, backbone angles, contact numbers and solvent accessibility",2017.0,153.0
Deep mining heterogeneous networks of biomedical linked data to predict novel drug–target associations,2017.0,83.0
A Bayesian group sparse multi-task regression model for imaging genetics,2017.0,31.0
EigenTHREADER: analogous protein fold recognition by efficient contact map threading,2017.0,30.0
SVMQA: support–vector-machine-based protein single-model quality assessment,2017.0,104.0
DMINDA 2.0: integrated and systematic views of regulatory DNA motif identification and analyses,2017.0,45.0
Removal of batch effects using distribution-matching residual networks,2017.0,75.0
Pattern fusion analysis by adaptive alignment of multiple heterogeneous omics data,2017.0,22.0
HaploMerger2: rebuilding both haploid sub-assemblies from high-heterozygosity diploid genome assembly,2017.0,72.0
BioCIDER: a Contextualisation InDEx for biological Resources discovery,2017.0,2.0
