title,year,citations
PanViz: interactive visualization of the structure of functionally annotated pangenomes,2017.0,12.0
RECKONER: read error corrector based on KMC,2017.0,10.0
pHMM-tree: phylogeny of profile hidden Markov models,2017.0,14.0
RImmPort: an R/Bioconductor package that enables ready-for-analysis immunology research data,2017.0,6.0
Cross-React: a new structural bioinformatics method for predicting allergen cross-reactivity,2017.0,20.0
A comprehensive benchmark of RNA–RNA interaction prediction tools for all domains of life,2017.0,32.0
Recon2Neo4j: applying graph database technologies for managing comprehensive genome-scale networks,2017.0,15.0
Context-sensitive network-based disease genetics prediction and its implications in drug discovery,2017.0,16.0
The structural bioinformatics library: modeling in biomolecular science and beyond,2017.0,31.0
"A new method for decontamination of de novo transcriptomes using a hierarchical 
clustering algorithm",2017.0,16.0
Image-based correction of continuous and discontinuous non-planar axial distortion in serial section microscopy,2017.0,16.0
VarMatch: robust matching of small variant datasets using flexible scoring schemes,2017.0,13.0
switchde: inference of switch-like differential expression along single-cell trajectories,2017.0,18.0
Wright–Fisher exact solver (WFES): scalable analysis of population genetic models without simulation or diffusion theory,2017.0,8.0
Algorithm sensitivity analysis and parameter tuning for tissue image segmentation pipelines,2017.0,20.0
ontologyX: a suite of R packages for working with ontological data,2017.0,33.0
Improved VCF normalization for accurate VCF comparison,2017.0,5.0
GppFst: genomic posterior predictive simulations of FST and dXY for identifying outlier loci from population genomic data,2017.0,11.0
"High-throughput interpretation of gene structure changes in human and nonhuman resequencing data, using ACE",2017.0,3.0
RENT+: an improved method for inferring local genealogical trees from haplotypes with recombination,2017.0,17.0
GE-mini: a mobile APP for large-scale gene expression visualization,2017.0,20.0
Using genotype array data to compare multi- and single-sample variant calls and improve variant call sets from deep coverage whole-genome sequencing data,2017.0,4.0
CAME: identification of chromatin accessibility from nucleosome occupancy and methylome sequencing,2017.0,4.0
TRFBA: an algorithm to integrate genome-scale metabolic and transcriptional regulatory networks with incorporation of expression data,2017.0,31.0
DeFCoM: analysis and modeling of transcription factor binding sites using a motif-centric genomic footprinter,2017.0,19.0
Inference of cellular level signaling networks using single-cell gene expression data in Caenorhabditis elegans reveals mechanisms of cell fate specification,2017.0,2.0
ACTG: novel peptide mapping onto gene models,2017.0,5.0
MetaDCN: meta-analysis framework for differential co-expression network detection with an application in breast cancer,2017.0,16.0
PhosD: inferring kinase–substrate interactions based on protein domains,2017.0,13.0
dAPE: a web server to detect homorepeats and follow their evolution,2017.0,9.0
Parameter estimation for dynamical systems with discrete events and logical operations,2017.0,27.0
Novel probabilistic models of spatial genetic ancestry with applications to stratification correction in genome-wide association studies,2017.0,8.0
Computational prediction of species-specific malonylation sites via enhanced characteristic strategy,2017.0,40.0
AltORFev facilitates the prediction of alternative open reading frames in eukaryotic mRNAs,2017.0,8.0
PBIT: Pipeline Builder for Identification of drug Targets for infectious diseases,2017.0,5.0
Analyzing user-generated online content for drug discovery: development and use of MedCrawler,2017.0,3.0
Structural insight to mutation effects uncover a common allosteric site in class C GPCRs,2017.0,9.0
An ensemble approach to protein fold classification by integration of template-based assignment and support vector machine classifier,2017.0,34.0
PRINCESS: Privacy-protecting Rare disease International Network Collaboration via Encryption through Software guard extensionS,2017.0,66.0
DACE: a scalable DP-means algorithm for clustering extremely large sequence data,2017.0,12.0
Improving flux predictions by integrating data from multiple strains,2017.0,7.0
bnstruct: an R package for Bayesian Network structure learning in the presence of missing data,2017.0,29.0
"T-BAS: Tree-Based Alignment Selector toolkit for phylogenetic-based placement, alignment downloads and metadata visualization: an example with the Pezizomycotina tree of life",2017.0,38.0
"Innovations and challenges in detecting long read overlaps: an evaluation 
of the state-of-the-art",2017.0,41.0
SNP interaction pattern identifier (SIPI): an intensive search for SNP–SNP interaction patterns,2017.0,9.0
RBPPred: predicting RNA-binding proteins from sequence using SVM,2017.0,33.0
Predict drug permeability to blood–brain-barrier from clinical phenotypes: drug side effects and drug indications,2017.0,22.0
A mass graph-based approach for the identification of modified proteoforms using top-down tandem mass spectra,2017.0,15.0
A general framework for association analysis of microbial communities on a taxonomic tree,2017.0,30.0
Defining the clonality of peripheral T cell lymphomas using RNA-seq,2017.0,12.0
GWAlpha: genome-wide estimation of additive effects (alpha) based on trait quantile distribution from pool-sequencing experiments,2017.0,1.0
MEGA-V: detection of variant gene sets in patient cohorts,2017.0,4.0
Hum-mPLoc 3.0: prediction enhancement of human protein subcellular localization through modeling the hidden correlations of gene ontology and functional domain features,2017.0,55.0
HiLive: real-time mapping of illumina reads while sequencing,2017.0,13.0
iRSpot-EL: identify recombination spots with an ensemble learning approach,2017.0,269.0
"SeqLib: a C ++ API for rapid BAM manipulation, sequence alignment and sequence assembly",2017.0,6.0
"The PPI3D web server for searching, analyzing and modeling protein–protein interactions in the context of 3D structures",2017.0,18.0
MRUniNovo: an efficient tool for de novo peptide sequencing utilizing the hadoop distributed computing framework,2017.0,15.0
CellSort: a support vector machine tool for optimizing fluorescence-activated cell sorting and reducing experimental effort,2017.0,8.0
cerebroViz: an R package for anatomical visualization of spatiotemporal brain data,2017.0,15.0
SarConfoCal: simultaneous sarcomere length and cytoplasmic calcium measurements for laser scanning confocal microscopy images,2017.0,4.0
"CymeR: cytometry analysis using KNIME, docker and R",2017.0,2.0
Agent-based re-engineering of ErbB signaling: a modeling pipeline for integrative systems biology,2017.0,4.0
Expanding the toolkit for membrane protein modeling in Rosetta,2017.0,18.0
A novel non-parametric method for uncertainty evaluation of correlation-based molecular signatures: its application on PAM50 algorithm,2017.0,15.0
FUEL-mLoc: feature-unified prediction and explanation of multi-localization of cellular proteins in multiple organisms,2017.0,20.0
A novel approach based on KATZ measure to predict associations of human microbiota with non-infectious diseases,2017.0,113.0
Falco: a quick and flexible single-cell RNA-seq processing framework on the cloud,2017.0,16.0
ESA-UbiSite: accurate prediction of human ubiquitination sites by identifying a set of effective negatives,2017.0,30.0
tranSMART-XNAT Connector tranSMART-XNAT connector—image selection based on clinical phenotypes and genetic profiles,2017.0,7.0
Calypso: a user-friendly web-server for mining and visualizing microbiome–environment interactions,2017.0,350.0
Robust parameter estimation for dynamical systems from outlier-corrupted data,2017.0,26.0
SINE_scan: an efficient tool to discover short interspersed nuclear elements (SINEs) in large-scale genomic datasets,2017.0,12.0
Statistical significance based on length and position of the local score in a model of i.i.d. sequences,2017.0,6.0
LEAP: constructing gene co-expression networks for single-cell RNA-sequencing data using pseudotime ordering,2017.0,42.0
Accelerating Bayesian inference for evolutionary biology models,2017.0,4.0
Network-based analysis of omics data: the LEAN method,2017.0,21.0
LRFragLib: an effective algorithm to identify fragments for de novo protein structure prediction,2017.0,8.0
MetaboSignal: a network-based approach for topological analysis of metabotype regulation via metabolic and signaling pathways,2017.0,18.0
Improving protein disorder prediction by deep bidirectional long short-term memory recurrent neural networks,2017.0,145.0
ALTRE: workflow for defining ALTered Regulatory Elements using chromatin accessibility data,2017.0,1.0
Controlling the joint local false discovery rate is more powerful than meta-analysis methods in joint analysis of summary statistics from multiple genome-wide association studies,2017.0,6.0
A pipeline for local assembly of minisatellite alleles from single-molecule sequencing data,2017.0,2.0
"PyBoolNet: a python package for the generation, analysis and visualization of boolean networks",2017.0,34.0
"Fast motif matching revisited: high-order PWMs, SNPs and indels",2017.0,19.0
ImpulseDE: detection of differentially expressed genes in time series data using impulse models,2017.0,19.0
"SPADEVizR: an R package for visualization, analysis and integration of SPADE results",2017.0,19.0
KODAMA: an R package for knowledge discovery and data mining,2017.0,18.0
GENIUS: web server to predict local gene networks and key genes for biological functions,2017.0,6.0
"Preprocessing, normalization and integration of the Illumina HumanMethylationEPIC array with minfi",2017.0,209.0
geneAttribution: trait agnostic identification of candidate genes associated with noncoding variation,2017.0,
InMoDe: tools for learning and visualizing intra-motif dependencies of DNA binding sites,2017.0,11.0
QAcon: single model quality assessment using protein structural and contact information with machine learning techniques,2017.0,64.0
seXY: a tool for sex inference from genotype arrays,2017.0,2.0
KAT: a K-mer analysis toolkit to quality control NGS datasets and genome assemblies,2017.0,147.0
Big Data Smart Socket (BDSS): a system that abstracts data transfer habits from end users,2017.0,7.0
Web-igloo: a web based platform for multivariate data visualization,2017.0,3.0
HYSYS: have you swapped your samples?,2017.0,3.0
BoostGAPFILL: improving the fidelity of metabolic network reconstructions through integrated constraint and pattern-based methods,2017.0,15.0
Recycler: an algorithm for detecting plasmids from de novo assembly graphs,2017.0,78.0
INTEGRATE-neo: a pipeline for personalized gene fusion neoantigen discovery,2017.0,59.0
caspo: a toolbox for automated reasoning on the response of logical signaling networks families,2017.0,9.0
Transfer learning across ontologies for phenome–genome association prediction,2017.0,24.0
ImageJ-MATLAB: a bidirectional framework for scientific image analysis interoperability,2017.0,12.0
Exploring the predictive power of polygenic scores derived from genome-wide association studies: a study of 10 complex traits,2017.0,27.0
node.dating: dating ancestors in phylogenetic trees in R,2017.0,8.0
Training alignment parameters for arbitrary sequencers with LAST-TRAIN,2017.0,38.0
FractBias: a graphical tool for assessing fractionation bias following polyploidy,2017.0,3.0
tcpl: the ToxCast pipeline for high-throughput screening data,2017.0,104.0
The Ark: a customizable web-based data management tool for health and medical research,2017.0,3.0
JADOPPT: java based AutoDock preparing and processing tool,2017.0,7.0
Cancer driver gene discovery through an integrative genomics approach in a non-parametric Bayesian framework,2017.0,15.0
Visualizing the geography of genetic variants,2017.0,25.0
MIToS.jl: mutual information tools for protein sequence analysis in the Julia language,2017.0,9.0
Optimizing ChIP-seq peak detectors using visual labels and supervised machine learning,2017.0,22.0
yMap: an automated method to map yeast variants to protein modifications and functional regions,2017.0,2.0
Imputing gene expression to maximize platform compatibility,2017.0,9.0
CLIP Tool Kit (CTK): a flexible and robust pipeline to analyze CLIP sequencing data,2017.0,64.0
ViSiBooL—visualization and simulation of Boolean networks with temporal constraints,2017.0,17.0
gsrc: an R package for genome structure rearrangement calling,2017.0,11.0
miRNAmeConverter: an R/bioconductor package for translating mature miRNA names to different miRBase versions,2017.0,25.0
RedNemo: topology-based PPI network reconstruction via repeated diffusion with neighborhood modifications,2017.0,7.0
Efficient detection of differentially methylated regions using DiMmeR,2017.0,5.0
stAIcalc: tRNA adaptation index calculator based on species-specific weights,2017.0,34.0
Isomorphic semantic mapping of variant call format (VCF2RDF),2017.0,2.0
Rabifier2: an improved bioinformatic classifier of Rab GTPases,2017.0,7.0
Uncertainty estimation of predictions of peptides’ chromatographic retention times in shotgun proteomics,2017.0,6.0
Improving cross-study prediction through addon batch effect adjustment or addon normalization,2017.0,13.0
SChloro: directing Viridiplantae proteins to six chloroplastic sub-compartments,2017.0,7.0
CloudPhylo: a fast and scalable tool for phylogeny reconstruction,2017.0,9.0
CIIPro: a new read-across portal to fill data gaps using public large-scale chemical and biological data,2017.0,19.0
simPATHy: a new method for simulating data from perturbed biological PATHways,2017.0,4.0
LDAP: a web server for lncRNA-disease association prediction,2017.0,92.0
"Assocplots: a Python package for static and interactive visualization of
          multiple-group GWAS results",2017.0,8.0
iATC-mISF: a multi-label classifier for predicting the classes of anatomical therapeutic chemicals,2017.0,203.0
PyMod 2.0: improvements in protein sequence-structure analysis and homology modeling within PyMOL,2017.0,91.0
ARResT/Interrogate: an interactive immunoprofiler for IG/TR NGS data,2017.0,34.0
Pathway Inspector: a pathway based web application for RNAseq analysis of model and non-model organisms,2017.0,7.0
Molecular mechanisms underlying COPD-muscle dysfunction unveiled through a systems medicine approach,2017.0,10.0
Simulation-based estimation of branching models for LTR retrotransposons,2017.0,1.0
The START App: a web-based RNAseq analysis and visualization resource,2017.0,51.0
QUBIC: a bioconductor package for qualitative biclustering analysis of gene co-expression data,2017.0,43.0
P3BSseq: parallel processing pipeline software for automatic analysis of bisulfite sequencing data,2017.0,13.0
State aggregation for fast likelihood computations in molecular evolution,2017.0,5.0
Granular clustering of de novo protein models,2017.0,2.0
Pro54DB: a database for experimentally verified sigma-54 promoters,2017.0,84.0
Comprehensive evaluation of de novo transcriptome assembly programs and their effects on differential gene expression analysis,2017.0,55.0
Combining multiple tools outperforms individual methods in gene set enrichment analyses,2017.0,80.0
OMBlast: alignment tool for optical mapping using a seed-and-extend approach,2017.0,33.0
bTSSfinder: a novel tool for the prediction of promoters in cyanobacteria and Escherichia coli,2017.0,39.0
SEQualyzer: interactive tool for quality control and exploratory analysis of high-throughput RNA structural profiling data,2017.0,9.0
Comparing co-evolution methods and their application to template-free protein structure prediction,2017.0,30.0
DEF: an automated dead-end filling approach based on quasi-endosymbiosis,2017.0,2.0
cMapper: gene-centric connectivity mapper for EBI-RDF platform,2017.0,3.0
LAMSA: fast split read alignment with long approximate matches,2017.0,18.0
Site of metabolism prediction for oxidation reactions mediated by oxidoreductases based on chemical bond,2017.0,12.0
AcCNET (Accessory Genome Constellation Network): comparative genomics software for accessory genome analysis using bipartite networks,2017.0,27.0
An accessibility-incorporated method for accurate prediction of RNA–RNA interactions from sequence data,2017.0,2.0
Robust classification of single-cell transcriptome data by nonnegative matrix factorization,2017.0,53.0
FastRFS: fast and accurate Robinson-Foulds Supertrees using constrained exact optimization,2017.0,30.0
FBB: a fast Bayesian-bound tool to calibrate RNA-seq aligners,2017.0,1.0
LD Hub: a centralized database and web interface to perform LD score regression that maximizes the potential of summary level GWAS data for SNP heritability and genetic correlation analysis,2017.0,540.0
FoldAtlas: a repository for genome-wide RNA structure probing data,2017.0,12.0
Biospark: scalable analysis of large numerical datasets from biological simulations and experiments using Hadoop and Spark,2017.0,23.0
Improved methods for multi-trait fine mapping of pleiotropic risk loci,2017.0,68.0
Evolutionary conservation of Ebola virus proteins predicts important functions at residue level,2017.0,3.0
PSSV: a novel pattern-based probabilistic approach for somatic structural variation identification,2017.0,7.0
GeneEvolve: a fast and memory efficient forward-time simulator of realistic whole-genome sequence and SNP data,2017.0,7.0
TwoPaCo: an efficient algorithm to build the compacted de Bruijn graph from many complete genomes,2017.0,51.0
PDB2CD: a web-based application for the generation of circular dichroism spectra from protein atomic coordinates,2017.0,38.0
Tissue-specific pathway association analysis using genome-wide association study summaries,2017.0,6.0
Reference point insensitive molecular data analysis,2017.0,27.0
"Verdant: automated annotation, alignment and phylogenetic analysis of whole chloroplast genomes",2017.0,45.0
IsotopicLabelling: an R package for the analysis of MS isotopic patterns of labelled analytes,2017.0,6.0
BOSS: a novel scaffolding algorithm based on an optimized scaffold graph,2017.0,23.0
Seeksv: an accurate tool for somatic structural variation and virus integration detection,2017.0,20.0
ImmuneDB: a system for the analysis and exploration of high-throughput adaptive immune receptor sequencing data,2017.0,18.0
D-VASim: an interactive virtual laboratory environment for the simulation and analysis of genetic circuits,2017.0,8.0
DM-BLD: differential methylation detection using a hierarchical Bayesian model exploiting local dependency,2017.0,5.0
The OGCleaner: filtering false-positive homology clusters,2017.0,8.0
Assessment of cancer and virus antigens for cross-reactivity in human tissues,2017.0,15.0
Nanocall: an open source basecaller for Oxford Nanopore sequencing data,2017.0,95.0
BeReTa: a systematic method for identifying target transcriptional regulators to enhance microbial production of chemicals,2017.0,7.0
TRI_tool: a web-tool for prediction of protein–protein interactions in human transcriptional regulation,2017.0,8.0
stringMLST: a fast k-mer based tool for multilocus sequence typing,2017.0,47.0
"A novel method for predicting activity of cis-regulatory modules, based on a diverse training set",2017.0,4.0
ReliableGenome: annotation of genomic regions with high/low variant calling concordance,2017.0,7.0
tHapMix: simulating tumour samples through haplotype mixtures,2017.0,7.0
DAPAR & ProStaR: software to perform statistical analyses in quantitative discovery proteomics,2017.0,83.0
LncVar: a database of genetic variation associated with long non-coding genes,2017.0,24.0
OntoBrowser: a collaborative tool for curation of ontologies by subject matter experts,2017.0,16.0
PHYLOViZ 2.0: providing scalable data integration and visualization for multiple phylogenetic inference methods,2017.0,150.0
Multivariate two-part statistics for analysis of correlated mass spectrometry data from multiple biological specimens,2017.0,2.0
Gene- and pathway-based association tests for multiple traits with GWAS summary statistics,2017.0,24.0
Rail-RNA: scalable analysis of RNA-seq splicing and coverage,2017.0,54.0
popSTR: population-scale detection of STR variants,2017.0,15.0
HAPRAP: a haplotype-based iterative method for statistical fine mapping using GWAS summary statistics,2017.0,6.0
Precrec: fast and accurate precision–recall and ROC curve calculations in R,2017.0,85.0
signeR: an empirical Bayesian approach to mutational signature discovery,2017.0,55.0
A likelihood ratio-based method to predict exact pedigrees for complex families from next-generation sequencing data,2017.0,7.0
PseKRAAC: a flexible web server for generating pseudo K-tuple reduced amino acids composition,2017.0,70.0
Cas-analyzer: an online tool for assessing genome editing results using NGS data,2017.0,149.0
LoFtool: a gene intolerance score based on loss-of-function variants in 60 706 individuals,2017.0,41.0
SiNVICT: ultra-sensitive detection of single nucleotide variants and indels in circulating tumour DNA,2017.0,35.0
Accurate self-correction of errors in long reads using de Bruijn graphs,2017.0,80.0
Designing robust watermark barcodes for multiplex long-read sequencing,2017.0,2.0
"COCACOLA: binning metagenomic contigs using sequence COmposition, read CoverAge, CO-alignment and paired-end read LinkAge",2017.0,89.0
WeSME: uncovering mutual exclusivity of cancer drivers and beyond,2017.0,42.0
ISCB’s initial reaction to New England Journal of Medicine editorial on data sharing,2017.0,12.0
Aligning dynamic networks with DynaWAVE,2017.0,
myTAI: evolutionary transcriptomics with R,2017.0,
Genome U-Plot: a whole genome visualization,2017.0,
Computational identification of micro-structural variations and their proteogenomic consequences in cancer,2017.0,
K2 and K2*: efficient alignment-free sequence similarity measurement based on Kendall statistics,2017.0,
ASAR: visual analysis of metagenomes in R,2017.0,
bioBakery: a meta’omic analysis environment,2017.0,
ThetaMater: Bayesian estimation of population size parameter θ from genomic data,2017.0,8.0
GDSCTools for mining pharmacogenomic interactions in cancer,2017.0,
QVZ: lossy compression of quality values,2017.0,
DISC: DISulfide linkage Characterization from tandem mass spectra,2017.0,3.0
PESTO: Parameter EStimation TOolbox,2017.0,
SAGE2: parallel human genome assembly,2017.0,
graphkernels: R and Python packages for graph comparison,2017.0,
DeepLoc: prediction of protein subcellular localization using deep learning,2017.0,321.0
A novel SCCA approach via truncated ℓ1-norm and truncated group lasso for brain imaging genetics,2017.0,
Comparison of methods for phylogenetic B-cell lineage inference using time-resolved antibody repertoire simulations (AbSim),2017.0,16.0
RUCS: rapid identification of PCR primers for unique core sequences,2017.0,11.0
Kmer-SSR: a fast and exhaustive SSR search algorithm,2017.0,10.0
An improved compound Poisson model for the number of motif hits in DNA sequences,2017.0,8.0
Efficient inference for sparse latent variable models of transcriptional regulation,2017.0,3.0
CESAR 2.0 substantially improves speed and accuracy of comparative gene annotation,2017.0,25.0
Enabling reproducible real-time quantitative PCR research: the RDML package,2017.0,6.0
PhyloGeoTool: interactively exploring large phylogenies in an epidemiological context,2017.0,12.0
FIRE: functional inference of genetic variants that regulate gene expression,2017.0,15.0
Real-time demultiplexing Nanopore barcoded sequencing data with npBarcode,2017.0,4.0
"clustComp, a bioconductor package for the comparison of clustering results",2017.0,
An introduction to deep learning on biological sequence data: examples and solutions,2017.0,78.0
Integrative structural and dynamical biology with PLUMED-ISDB,2017.0,36.0
MetaCache: context-aware classification of metagenomic reads using minhashing,2017.0,22.0
psygenet2r: a R/Bioconductor package for the analysis of psychiatric disease genes,2017.0,2.0
MIRMMR: binary classification of microsatellite instability using methylation and mutations,2017.0,11.0
ncDR: a comprehensive resource of non-coding RNAs involved in drug resistance,2017.0,17.0
Genome-wide association studies using a penalized moving-window regression,2017.0,3.0
Improving protein fold recognition by extracting fold-specific features from predicted residue–residue contacts,2017.0,19.0
Prediction of delayed retention of antibodies in hydrophobic interaction chromatography from sequence using machine learning,2017.0,14.0
Genome-scale regression analysis reveals a linear relationship for promoters and enhancers after combinatorial drug treatment,2017.0,3.0
LLR: a latent low-rank approach to colocalizing genetic risk variants in multiple GWAS,2017.0,4.0
PyLasso: a PyMOL plugin to identify lassos,2017.0,
"PiMP my metabolome: an integrated, web-based tool for LC-MS metabolomics data",2017.0,25.0
CRISPR-DAV: CRISPR NGS data analysis and visualization pipeline,2017.0,31.0
HaploForge: a comprehensive pedigree drawing and haplotype visualization web application,2017.0,2.0
ChAMP: updated methylation analysis pipeline for Illumina BeadChips,2017.0,134.0
"MAPseq: highly efficient k-mer search with confidence estimates, for rRNA sequence analysis",2017.0,38.0
"BSviewer: a genotype-preserving, nucleotide-level visualizer for bisulfite sequencing data",2017.0,4.0
Molecular signatures that can be transferred across different omics platforms,2017.0,16.0
"Holmes: a graphical tool for development, simulation and analysis of Petri net based models of complex biological systems",2017.0,10.0
EMHP: an accurate automated hole masking algorithm for single-particle cryo-EM image processing,2017.0,16.0
