title,year,citations
Chainy: an universal tool for standardized relative quantification in real-time PCR,2017.0,13.0
Incorporating prior information into differential network analysis using non-paranormal graphical models,2017.0,24.0
emMAW: computing minimal absent words in external memory,2017.0,10.0
miRCat2: accurate prediction of plant and animal microRNAs from next-generation sequencing datasets,2017.0,34.0
SubCons: a new ensemble method for improved human subcellular localization predictions,2017.0,20.0
Network module-based model in the differential expression analysis for RNA-seq,2017.0,3.0
MetCirc: navigating mass spectral similarity in high-resolution MS/MS metabolomics data,2017.0,17.0
StrandScript: evaluation of Illumina genotyping array design and strand correction,2017.0,4.0
EUPAN enables pan-genome studies of a large number of eukaryotic genomes,2017.0,17.0
SynergyFinder: a web application for analyzing drug combination dose–response matrix data,2017.0,191.0
PyGOLD: a python based API for docking based virtual screening workflow generation,2017.0,3.0
Systemic evaluation of cellular reprogramming processes exploiting a novel R-tool: eegc,2017.0,2.0
Machine learning in computational biology to accelerate high-throughput protein expression,2017.0,9.0
TIN-X: target importance and novelty explorer,2017.0,
FunChIP: an R/Bioconductor package for functional classification of ChIP-seq shapes,2017.0,3.0
GARN2: coarse-grained prediction of 3D structure of large RNA molecules by regret minimization,2017.0,6.0
MISA-web: a web server for microsatellite prediction,2017.0,240.0
RTK: efficient rarefaction analysis of large datasets,2017.0,23.0
ST Pipeline: an automated pipeline for spatial mapping of unique transcripts,2017.0,35.0
mzML2ISA & nmrML2ISA: generating enriched ISA-Tab metadata files from metabolomics XML data,2017.0,9.0
PreMosa: extracting 2D surfaces from 3D microscopy mosaics,2017.0,12.0
EzMap: a simple pipeline for reproducible analysis of the human virome,2017.0,3.0
ploidyNGS: visually exploring ploidy with Next Generation Sequencing data,2017.0,
Use of AAScatterPlot tool for monitoring the evolution of the hemagglutinin cleavage site in H9 avian influenza viruses,2017.0,4.0
SieveSifter: a web-based tool for visualizing the sieve analyses of HIV-1 vaccine efficacy trials,2017.0,6.0
Gracob: a novel graph-based constant-column biclustering method for mining growth phenotype data,2017.0,5.0
SCODE: an efficient regulatory network inference algorithm from single-cell RNA-Seq during differentiation,2017.0,92.0
A penalized regression approach to haplotype reconstruction of viral populations arising in early HIV/SIV infection,2017.0,9.0
SQC: secure quality control for meta-analysis of genome-wide association studies,2017.0,
TASIC: determining branching models from time series single cell data,2017.0,24.0
Kart: a divide-and-conquer algorithm for NGS read alignment,2017.0,28.0
BEESEM: estimation of binding energy models using HT-SELEX data,2017.0,21.0
Cpipe: a comprehensive computational platform for sequence and structure-based analyses of Cysteine residues,2017.0,
DeepEM3D: approaching human-level performance on 3D anisotropic EM image segmentation,2017.0,42.0
Trainable Weka Segmentation: a machine learning tool for microscopy pixel classification,2017.0,611.0
rMSI: an R package for MS imaging data handling and visualization,2017.0,13.0
PARTIE: a partition engine to separate metagenomic and amplicon projects in the Sequence Read Archive,2017.0,15.0
Mackinac: a bridge between ModelSEED and COBRApy to generate and analyze genome-scale metabolic models,2017.0,8.0
Spresso: an ultrafast compound pre-screening method based on compound decomposition,2017.0,2.0
cnAnalysis450k: an R package for comparative analysis of 450k/EPIC Illumina methylation array derived copy number data,2017.0,2.0
ViPTree: the viral proteomic tree server,2017.0,
BioContainers: an open-source and community-driven framework for software standardization,2017.0,111.0
DLTree: efficient and accurate phylogeny reconstruction using the dynamical language method,2017.0,4.0
biMM: efficient estimation of genetic variances and covariances for cohorts with high-dimensional phenotype measurements,2017.0,7.0
NeBcon: protein contact map prediction using neural network training coupled with naïve Bayes classifiers,2017.0,44.0
EthSEQ: ethnicity annotation from whole exome sequencing data,2017.0,11.0
Sequential computation of elementary modes and minimal cut sets in genome-scale metabolic networks using alternate integer linear programming,2017.0,9.0
A transition-based joint model for disease named entity recognition and normalization,2017.0,37.0
GenomeScope: fast reference-free genome profiling from short reads,2017.0,385.0
Entropy-based consensus clustering for patient stratification,2017.0,40.0
Mining heterogeneous causal effects for personalized cancer treatment,2017.0,26.0
Aozan: an automated post-sequencing data-processing pipeline,2017.0,2.0
Enhanced methods to detect haplotypic effects on gene expression,2017.0,3.0
The RNASeq-er API—a gateway to systematically updated analysis of public RNA-seq data,2017.0,11.0
ConKit: a python interface to contact predictions,2017.0,
GenoGAM: genome-wide generalized additive models for ChIP-Seq analysis,2017.0,6.0
HiC-spector: a matrix library for spectral and reproducibility analysis of Hi-C contact maps,2017.0,46.0
CImbinator: a web-based tool for drug synergy analysis in small- and large-scale datasets,2017.0,7.0
SynMap2 and SynMap3D: web-based whole-genome synteny browsers,2017.0,54.0
SeqArray—a storage-efficient high-performance data format for WGS variant calls,2017.0,55.0
SIApopr: a computational method to simulate evolutionary branching trees for analysis of tumor clonal evolution,2017.0,5.0
Tagging SNP-set selection with maximum information based on linkage disequilibrium structure in genome-wide association studies,2017.0,10.0
PathwayMapper: a collaborative visual web editor for cancer pathways and genomic data,2017.0,27.0
Phenopolis: an open platform for harmonization and analysis of genetic and phenotypic data,2017.0,31.0
Estimating error models for whole genome sequencing using mixtures of Dirichlet-multinomial distributions,2017.0,
ResistoMap—online visualization of human gut microbiota antibiotic resistome,2017.0,26.0
"Fast, clash-free RNA conformational morphing using molecular junctions",2017.0,4.0
A Zoom-Focus algorithm (ZFA) to locate the optimal testing region for rare variant association tests,2017.0,5.0
Meta-analytic framework for liquid association,2017.0,
MetCCS predictor: a web server for predicting collision cross-section values of metabolites in ion mobility-mass spectrometry based metabolomics,2017.0,41.0
Dynamix: dynamic visualization by automatic selection of informative tracks from hundreds of genomic datasets,2017.0,2.0
rMATS-DVR: rMATS discovery of differential variants in RNA,2017.0,10.0
"DNA Compass: a secure, client-side site for navigating personal genetic information",2017.0,4.0
QRank: a novel quantile regression tool for eQTL discovery,2017.0,4.0
HLA-MA: simple yet powerful matching of samples using HLA typing results,2017.0,
poRe GUIs for parallel and real-time processing of MinION sequence data,2017.0,7.0
SmartR: an open-source platform for interactive visual analytics for translational research data,2017.0,22.0
Quantifying circular RNA expression from RNA-seq data using model-based framework,2017.0,29.0
VCNet: vector-based gene co-expression network construction and its application to RNA-seq data,2017.0,7.0
ProtVista: visualization of protein sequence annotations,2017.0,
Stepwise inference of likely dynamic flux distributions from metabolic time series data,2017.0,4.0
A network model predicts the intensity of residue-protein thermal coupling,2017.0,4.0
Discriminating the reaction types of plant type III polyketide synthases,2017.0,5.0
Identification of genetic outliers due to sub-structure and cryptic relationships,2017.0,7.0
AQUA-DUCT: a ligands tracking tool,2017.0,
ctsGE—clustering subgroups of expression data,2017.0,
Systematic inference of functional phosphorylation events in yeast metabolism,2017.0,3.0
Morphologically constrained spectral unmixing by dictionary learning for multiplex fluorescence microscopy,2017.0,6.0
PeptideMapper: efficient and versatile amino acid sequence and tag mapping,2017.0,7.0
Computational modeling of in vivo and in vitro protein-DNA interactions by multiple instance learning,2017.0,9.0
Oncopression: gene expression compendium for cancer with matched normal tissues,2017.0,12.0
MaBoSS 2.0: an environment for stochastic Boolean modeling,2017.0,51.0
RNAscClust: clustering RNA sequences using structure conservation and graph based motifs,2017.0,21.0
swga: a primer design toolkit for selective whole genome amplification,2017.0,11.0
SVPV: a structural variant prediction viewer for paired-end sequencing datasets,2017.0,6.0
MotifMap-RNA: a genome-wide map of RBP binding sites,2017.0,10.0
fastER: a user-friendly tool for ultrafast and robust cell segmentation in large-scale microscopy,2017.0,32.0
RefBool: a reference-based algorithm for discretizing gene expression data,2017.0,5.0
DeepBlueR: large-scale epigenomic analysis in R,2017.0,
FUNNEL-GSEA: FUNctioNal ELastic-net regression in time-course gene set enrichment analysis,2017.0,14.0
Pseudoalignment for metagenomic read assignment,2017.0,
BioJava-ModFinder: identification of protein modifications in 3D structures from the Protein Data Bank,2017.0,8.0
BiRen: predicting enhancers with a deep-learning-based model using the DNA sequence alone,2017.0,52.0
MapReduce for accurate error correction of next-generation sequencing data,2017.0,12.0
BCFtools/csq: haplotype-aware variant consequences,2017.0,80.0
MBV: a method to solve sample mislabeling and detect technical bias in large combined genotype and sequencing assay datasets,2017.0,8.0
GARLIC: Genomic Autozygosity Regions Likelihood-based Inference and Classification,2017.0,22.0
Pln24NT: a web resource for plant 24-nt siRNA producing loci,2017.0,10.0
Changes associated with Ebola virus adaptation to novel species,2017.0,3.0
A multi-scale convolutional neural network for phenotyping high-content cellular images,2017.0,69.0
Empirical comparison of web-based antimicrobial peptide prediction tools,2017.0,41.0
An approach to infer putative disease-specific mechanisms using neighboring gene networks,2017.0,8.0
Glimma: interactive graphics for gene expression analysis,2017.0,
Threshold-seq: a tool for determining the threshold in short RNA-seq datasets,2017.0,9.0
LASER server: ancestry tracing with genotypes or sequence reads,2017.0,11.0
Integrative analysis identifies co-dependent gene expression regulation of BRG1 and CHD7 at distal regulatory sites in embryonic stem cells,2017.0,12.0
AptRank: an adaptive PageRank model for protein function prediction on   bi-relational graphs,2017.0,22.0
Abstracting the dynamics of biological pathways using information theory: a case study of apoptosis pathway,2017.0,13.0
IRaPPA: information retrieval based integration of biophysical models for protein assembly selection,2017.0,15.0
Genome-wide genetic heterogeneity discovery with categorical covariates,2017.0,16.0
SANA: simulated annealing far outperforms many other search algorithms for biological network alignment,2017.0,50.0
nala: text mining natural language mutation mentions,2017.0,5.0
Adaptive MCMC in Bayesian phylogenetics: an application to analyzing partitioned data in BEAST,2017.0,25.0
PMAnalyzer: a new web interface for bacterial growth curve analysis,2017.0,9.0
Statistical database analysis of the role of loop dynamics for protein–protein complex formation and allostery,2017.0,3.0
Benchmarking substrate-based kinase activity inference using phosphoproteomic data,2017.0,27.0
sfinx: an R package for the elimination of false positives from affinity purification–mass spectrometry datasets,2017.0,3.0
STELLS2: fast and accurate coalescent-based maximum likelihood inference of species trees from gene tree topologies,2017.0,9.0
FELLS: fast estimator of latent local structure,2017.0,40.0
PhosphoPICK-SNP: quantifying the effect of amino acid variants on protein phosphorylation,2017.0,5.0
VALORATE: fast and accurate log-rank test in balanced and unbalanced comparisons of survival curves and cancer genomics,2017.0,6.0
Binning_refiner: improving genome bins through the combination of different binning programs,2017.0,32.0
Simulome: a genome sequence and variant simulator,2017.0,
DiagnoProt: a tool for discovery of new molecules by mass spectrometry,2017.0,5.0
MotifNet: a web-server for network motif analysis,2017.0,16.0
An efficient concordant integrative analysis of multiple large-scale two-sample expression data sets,2017.0,4.0
cooccurNet: an R package for co-occurrence network construction and analysis,2017.0,3.0
Phyx: phylogenetic tools for unix,2017.0,
GLINT: a user-friendly toolset for the analysis of high-throughput DNA-methylation array data,2017.0,22.0
PatternMarkers & GWCoGAPS for novel data-driven biomarkers via whole transcriptome NMF,2017.0,22.0
CPSS 2.0: a computational platform update for the analysis of small RNA sequencing data,2017.0,16.0
Genotyping inversions and tandem duplications,2017.0,
annoPeak: a web application to annotate and visualize peaks from ChIP-seq/ChIP-exo-seq,2017.0,2.0
"cyvcf2: fast, flexible variant analysis with Python",2017.0,22.0
RelExplain—integrating data and networks to explain biological processes,2017.0,1.0
pETM: a penalized Exponential Tilt Model for analysis of correlated high-dimensional DNA methylation data,2017.0,10.0
IntegratedMRF: random forest-based framework for integrating prediction from different data types,2017.0,38.0
MetaPlotR: a Perl/R pipeline for plotting metagenes of nucleotide modifications and other transcriptomic sites,2017.0,37.0
FIT: statistical modeling tool for transcriptome dynamics under fluctuating field conditions,2017.0,5.0
CHRR: coordinate hit-and-run with rounding for uniform sampling of constraint-based models,2017.0,39.0
"Edlib: a C/C ++ library for fast, exact sequence alignment using edit distance",2017.0,89.0
Large-scale 16S gene assembly using metagenomics shotgun sequences,2017.0,7.0
LIQUID: an-open source software for identifying lipids in LC-MS/MS-based lipidomics data,2017.0,54.0
Riborex: fast and flexible identification of differential translation from Ribo-seq data,2017.0,49.0
NSSRF: global network similarity search with subgraph signatures and its applications,2017.0,2.0
Automated cell type discovery and classification through knowledge transfer,2017.0,26.0
PALADIN: protein alignment for functional profiling whole metagenome shotgun data,2017.0,26.0
Supporting precision medicine by data mining across multi-disciplines: an integrative approach for generating comprehensive linkages between single nucleotide variants (SNVs) and drug-binding sites,2017.0,6.0
admixturegraph: an R package for admixture graph manipulation and fitting,2017.0,32.0
Efficient computation of transfer free energies of amino acids in beta-barrel membrane proteins,2017.0,4.0
Accurate prediction of human essential genes using only nucleotide composition and association information,2017.0,29.0
Image-based surrogate biomarkers for molecular subtypes of colorectal cancer,2017.0,4.0
‘COV’COP’ allows to detect CNVs responsible for inherited diseases among amplicons sequencing data,2017.0,10.0
Dscam1 web server: online prediction of Dscam1 self- and hetero-affinity,2017.0,1.0
Sparse network modeling and metscape-based visualization methods for the analysis of large-scale metabolomics data,2017.0,55.0
HIPred: an integrative approach to predicting haploinsufficient genes,2017.0,14.0
fastMitoCalc: an ultra-fast program to estimate mitochondrial DNA copy number from whole-genome sequences,2017.0,9.0
Classification of RNA structure change by ‘gazing’ at experimental data,2017.0,16.0
Ligandbook: an online repository for small and drug-like molecule force field parameters,2017.0,10.0
Genome-wide analysis of DNA methylation profiles in a senescence-accelerated mouse prone 8 brain using whole-genome bisulfite sequencing,2017.0,21.0
Evolutionary design of multiple genes encoding the same protein,2017.0,5.0
Identification of protein complexes by integrating multiple alignment of protein interaction networks,2017.0,31.0
MetaShot: an accurate workflow for taxon classification of host-associated microbiome from shotgun metagenomic data,2017.0,11.0
A comprehensive quality control workflow for paired tumor-normal NGS experiments,2017.0,6.0
Unrealistic phylogenetic trees may improve phylogenetic footprinting,2017.0,1.0
Extracting morphologies from third harmonic generation images of structurally normal human brain tissue,2017.0,8.0
ANAQUIN: a software toolkit for the analysis of spike-in controls for next generation sequencing,2017.0,9.0
H(O)TA: estimation of DNA methylation and hydroxylation levels and efficiencies from time course data,2017.0,7.0
BioPAXViz: a cytoscape application for the visual exploration of metabolic pathway evolution,2017.0,5.0
ISPRED4: interaction sites PREDiction in protein structures with a refining grammar model,2017.0,15.0
LOCUST: a custom sequence locus typer for classifying microbial isolates,2017.0,14.0
QCEWAS: automated quality control of results of epigenome-wide association studies,2017.0,6.0
miRmine: a database of human miRNA expression profiles,2017.0,119.0
NetLand: quantitative modeling and visualization of Waddington’s epigenetic landscape using probabilistic potential,2017.0,12.0
"aRNApipe: a balanced, efficient and distributed pipeline for processing RNA-seq data in high-performance computing environments",2017.0,18.0
Quantification of fibrous spatial point patterns from single-molecule localization microscopy (SMLM) data,2017.0,7.0
Better diagnostic signatures from RNAseq data through use of auxiliary co-data,2017.0,10.0
chainCleaner improves genome alignment specificity and sensitivity,2017.0,13.0
Multi-rate Poisson tree processes for single-locus species delimitation under maximum likelihood and Markov chain Monte Carlo,2017.0,285.0
Introducing COCOS: codon consequence scanner for annotating reading frame changes induced by stop-lost and frame shift variants,2017.0,1.0
PhenoCurve: capturing dynamic phenotype-environment relationships using phenomics data,2017.0,8.0
Linearity of network proximity measures: implications for set-based queries and significance testing,2017.0,10.0
Correlated mutations select misfolded from properly folded proteins,2017.0,5.0
MAPPI-DAT: data management and analysis for protein–protein interaction data from the high-throughput MAPPIT cell microarray platform,2017.0,2.0
TimesVector: a vectorized clustering approach to the analysis of time series transcriptome data from multiple phenotypes,2017.0,15.0
Improved orthology inference with Hieranoid 2,2017.0,
myGenomeBrowser: building and sharing your own genome browser,2017.0,7.0
LRSSL: predict and interpret drug–disease associations based on data integration using sparse subspace learning,2017.0,48.0
"Fast admixture analysis and population tree estimation for SNP and NGS
          data",2017.0,19.0
Development and application of an algorithm to compute weighted multiple glycan alignments,2017.0,9.0
VCF-kit: assorted utilities for the variant call format,2017.0,40.0
The genetic map comparator: a user-friendly application to display and compare genetic maps,2017.0,7.0
Sphinx: merging knowledge-based and ab initio approaches to improve protein loop prediction,2017.0,32.0
"DistributedFBA.jl: high-level, high-performance flux balance analysis in Julia",2017.0,24.0
Protein multiple sequence alignment benchmarking through secondary structure prediction,2017.0,37.0
DeuteRater: a tool for quantifying peptide isotope precision and kinetic proteomics,2017.0,28.0
FASTdoop: a versatile and efficient library for the input of FASTA and FASTQ files for MapReduce Hadoop bioinformatics applications,2017.0,21.0
MobiDB-lite: fast and highly specific consensus prediction of intrinsic disorder in proteins,2017.0,76.0
The super-n-motifs model: a novel alignment-free approach for representing and comparing RNA secondary structures,2017.0,9.0
"Scater: pre-processing, quality control, normalization and visualization of single-cell RNA-seq data in R",2017.0,509.0
H-BLAST: a fast protein sequence alignment toolkit on heterogeneous computers with GPUs,2017.0,10.0
AnglerFish: a webserver for defining the geometry of α-helices in membrane proteins,2017.0,
Seeing the trees through the forest: sequence-based homo- and heteromeric protein-protein interaction sites prediction using random forest,2017.0,16.0
A DNA intercalation methodology for an efficient prediction of ligand binding pose and energetics,2017.0,19.0
RADER: a RApid DEcoy Retriever to facilitate decoy based assessment of virtual screening,2017.0,9.0
"SED-ML web tools: generate, modify and export standard-compliant simulation studies",2017.0,10.0
KNIME4NGS: a comprehensive toolbox for next generation sequencing analysis,2017.0,7.0
SigMod: an exact and efficient method to identify a strongly interconnected disease-associated module in a gene network,2017.0,14.0
Advanced Boolean modeling of biological networks applied to systems pharmacology,2017.0,19.0
Rebuttal to the Letter to the Editor in response to the paper: proper evaluation of alignment-free network comparison methods,2017.0,1.0
ORCAN—a web-based meta-server for real-time detection and functional annotation of orthologs,2017.0,10.0
AFS: identification and quantification of species composition by metagenomic sequencing,2017.0,7.0
ntCard: a streaming algorithm for cardinality estimation in genomics data,2017.0,38.0
CircosVCF: circos visualization of whole-genome sequence variations stored in VCF files,2017.0,9.0
VEXOR: an integrative environment for prioritization of functional variants in fine-mapping analysis,2017.0,2.0
Modeling gene-wise dependencies improves the identification of drug response biomarkers in cancer studies,2017.0,7.0
An informative approach on differential abundance analysis for time-course metagenomic sequencing data,2017.0,13.0
SPOT-ligand 2: improving structure-based virtual screening by binding-homology search on an expanded structural template library,2017.0,14.0
AFRESh: an adaptive framework for compression of reads and assembled sequences with random access functionality,2017.0,3.0
Feature selection using a one dimensional naïve Bayes’ classifier increases the accuracy of support vector machine classification of CDR3 repertoires,2017.0,38.0
"Resolution and reconciliation of non-binary gene trees with transfers, duplications 
and losses",2017.0,9.0
GDISC: a web portal for integrative analysis of gene–drug interaction for survival in cancer,2017.0,5.0
Automated neuron tracing using probability hypothesis density filtering,2017.0,24.0
MetaSpark: a spark-based distributed processing tool to recruit metagenomic reads to reference genomes,2017.0,26.0
Fast and accurate phylogeny reconstruction using filtered spaced-word matches,2017.0,43.0
Lineage-specific mutational clustering in protein structures predicts evolutionary shifts in function,2017.0,11.0
Planning bioinformatics workflows using an expert system,2017.0,16.0
ProQ3D: improved model quality assessments using deep learning,2017.0,86.0
Primerize-2D: automated primer design for RNA multidimensional chemical mapping,2017.0,7.0
LncRNA/DNA binding analysis reveals losses and gains and lineage specificity of genomic imprinting in mammals,2017.0,18.0
Statistical inference of protein structural alignments using information and compression,2017.0,8.0
SVScore: an impact prediction tool for structural variation,2017.0,20.0
A descriptive marker gene approach to single-cell pseudotime inference,2017.0,850.0
RIFRAF: a frame-resolving consensus algorithm,2017.0,
"pyABC: distributed, likelihood-free inference",2017.0,9.0
LIMES: a tool for comparing species partition,2017.0,63.0
How well do RNA-Seq differential gene expression tools perform in a complex eukaryote? A case study in Arabidopsis thaliana,2017.0,6.0
GalaxyCloudRunner: enhancing scalable computing for Galaxy,2017.0,17.0
A pseudotemporal causality approach to identifying miRNA–mRNA interactions during biological processes,2017.0,54.0
Unpaired data empowers association tests,2017.0,54.0
Inferring cancer progression from Single-Cell Sequencing while allowing mutation losses,2017.0,66.0
TranspoScope: interactive visualization of retrotransposon insertions,2017.0,
ConfID: an analytical method for conformational characterization of small molecules using molecular dynamics trajectories,2017.0,143.0
