title,authors,year,citations
RaCaT: An open source and easy to use radiomics calculator tool,"Elisabeth Pfaehler, Alex Zwanenburg, Johan R. de Jong, Ronald Boellaard",2019,12
Correction: Whole genome sequencing of extreme phenotypes identifies variants in CD101 and UBE2V1 associated with increased risk of sexually acquired HIV-1,"Romel D. Mackelprang, Michael J. Bamshad, Jessica X. Chong, Xuanlin Hou, Kati J. Buckingham, Kathryn Shively, Guy deBruyn, Nelly R. Mugo, James I. Mullins, M. Juliana McElrath, Jared M. Baeten, Connie Celum, Mary J. Emond, Jairam R. Lingappa, for the Partners in Prevention HSV/HIV Transmission Study and the Partners PrEP Study Teams",2019,0
Avian haemosporidians in the cattle egret (Bubulcus ibis) from central-western and southern Africa: High diversity and prevalence,"Cynthia M. Villar Couto, Graeme S. Cumming, Gustavo A. Lacorte, Carlos Congrains, Rafael Izbicki, Erika Martins Braga, Cristiano D. Rocha, Emmanuel Moralez-Silva, Dominic A. W. Henry, Shiiwua A. Manu, Jacinta Abalaka, Aissa Regalla, Alfredo Simão da Silva, Moussa S. Diop, Silvia N. Del Lama",2019,1
The successful containment of a hospital outbreak caused by NDM-1-producing Klebsiella pneumoniae ST307 using active surveillance,"Paola Bocanegra-Ibarias, Elvira Garza-González, Magaly Padilla-Orozco, Soraya Mendoza-Olazarán, Eduardo Pérez-Alba, Samantha Flores-Treviño, Ulises Garza-Ramos, Jesus Silva-Sánchez, Adrián Camacho-Ortiz",2019,5
Long-acting injectable antipsychotics: Six-month follow-up of new outpatient treatments in Bologna Community Mental Health Centres,"Lorenzo Berardi, Ippazio Cosimo Antonazzo, Carlo Piccinni, Emanuel Raschi, Emanuele Forcesi, Angelo Fioritti, Domenico Berardi, Fabrizio De Ponti, Antonella Piazza, Elisabetta Poluzzi",2019,1
Training set optimization of genomic prediction by means of EthAcc,"Brigitte Mangin, Renaud Rincent, Charles-Elie Rabier, Laurence Moreau, Ellen Goudemand-Dugue",2019,4
Coding of low-level position and orientation information in human naturalistic vision,"Jeppe H. Christensen, Peter J. Bex, József Fiser",2019,0
Machine learning analysis of gene expression data reveals novel diagnostic and prognostic biomarkers and identifies therapeutic targets for soft tissue sarcomas,"David G. P. van IJzendoorn, Karoly Szuhai, Inge H. Briaire-de Bruijn, Marie Kostine, Marieke L. Kuijjer, Judith V. M. G. Bovée",2019,9
Mandarin Chinese modality exclusivity norms,"I-Hsuan Chen, Qingqing Zhao, Yunfei Long, Qin Lu, Chu-Ren Huang",2019,10
A model based on intensity of medical care may improve outcomes for internal medicine patients in Italy,"Emanuele Torri, Marta Rigoni, Stefania Dorigoni, Dimitri Peterlana, Susanna Cozzio, Giandomenico Nollo, Walter Spagnolli",2019,2
Identifying developmental trajectories of worldwide road traffic accident death rates using a latent growth mixture modeling approach,"Masoud Salehi, Tofigh Mobaderi, Mohammadreza Mehmandar, Afsaneh Dehnad",2019,0
Tenogenic differentiation protocol in xenogenic-free media enhances tendon-related marker expression in ASCs,"Deborah Stanco, Christian Caprara, Gianluca Ciardelli, Luca Mariotta, Mauro Gola, Greta Minonzio, Gianni Soldati",2019,6
Incorporating environmental costs of ecosystem service loss in political decision making: A synthesis of monetary values for Germany,"Johannes Förster, Stefan Schmidt, Bartosz Bartkowski, Nele Lienhoop, Christian Albert, Heidi Wittmer",2019,5
"The availability, prices and affordability of essential medicines in Malawi: A cross-sectional study","Felix Khuluza, Christine Haefele-Abah",2019,11
Impact of clearcutting on radiocesium export from a Japanese forested catchment following the Fukushima nuclear accident,"Tatsuhiro Nishikiori, Seiji Hayashi, Mirai Watanabe, Tetsuo Yasutaka",2019,1
A natural history model for planning prostate cancer testing: Calibration and validation using Swedish registry data,"Andreas Karlsson, Alexandra Jauhiainen, Roman Gulati, Martin Eklund, Henrik Grönberg, Ruth Etzioni, Mark Clements",2019,2
The role of TLR9 on Leishmania amazonensis infection and its influence on intranasal LaAg vaccine efficacy,"Juliana Elena Silveira Pratti, Alessandra Marcia da Fonseca Martins, Juliana Paiva da Silva, Tadeu Diniz Ramos, Joyce Carvalho Pereira, Luan Firmino-Cruz, Diogo Oliveira-Maciel, Thiago Soares de Souza Vieira, Leandra Linhares Lacerda, Andre Macedo Vale, Celio G. Freire-de-Lima, Daniel C. Oliveira Gomes, Elvira M. Saraiva, Bartira Rossi-Bergmann, Herbert Leonel de Matos Guedes",2019,2
Healthcare resource utilisation and costs of agitation in people with dementia living in care homes in England - The Managing Agitation and Raising QUality of LifE in Dementia (MARQUE) study,"Monica Panca, Gill Livingston, Julie Barber, Claudia Cooper, Francesca La Frenais, Louise Marston, Sian Cousins, Rachael M. Hunter",2019,3
Transcription factor Sp4 is required for hyperalgesic state persistence,"Kayla Sheehan, Jessica Lee, Jillian Chong, Kathryn Zavala, Manohar Sharma, Sjaak Philipsen, Tomoyuki Maruyama, Zheyun Xu, Zhonghui Guan, Helge Eilers, Tomoyuki Kawamata, Mark Schumacher",2019,1
A DNA repair protein and histone methyltransferase interact to promote genome stability in the Caenorhabditis elegans germ line,"Bing Yang, Xia Xu, Logan Russell, Matthew T. Sullenberger, Judith L. Yanowitz, Eleanor M. Maine",2019,7
"Resolution of grammatical tense into actual time, and its application in Time Perspective study in the tweet space","Sabyasachi Kamila, Mohammad Hasanuzzaman, Asif Ekbal, Pushpak Bhattacharyya",2019,1
"Association of metformin, sulfonylurea and insulin use with brain structure and function and risk of dementia and Alzheimer’s disease: Pooled analysis from 5 cohorts","Galit Weinstein, Kendra L. Davis-Plourde, Sarah Conner, Jayandra J. Himali, Alexa S. Beiser, Anne Lee, Andreea M. Rawlings, Sanaz Sedaghat, Jie Ding, Erin Moshier, Cornelia M. van Duijn, Michal S. Beeri, Elizabeth Selvin, M. Arfan Ikram, Lenore J. Launer, Mary N. Haan, Sudha Seshadri",2019,17
Regurgitation and pulmonary aspiration during cardio-pulmonary resuscitation (CPR) with a laryngeal tube: A pilot crossover human cadaver study,"Kurt Ruetzler, Steve Leung, Mark Chmiela, Eva Rivas, Lukasz Szarpak, Sandeep Khanna, Guangmei Mao, Richard L. Drake, Daniel I. Sessler, Alparslan Turan",2019,2
Factors affecting feeding 6–23 months age children according to minimum acceptable diet in Ethiopia: A multilevel analysis of the Ethiopian Demographic Health Survey,"Aberash Abay Tassew, Dejen Yemane Tekle, Abate Bekele Belachew, Beyene Meressa Adhena",2019,4
Correction: The burden of dyslipidaemia and factors associated with lipid levels among adults in rural northern Ghana: An AWI-Gen sub-study,"Jiabao Lin, Xuan Cui, Xiaoying Dai, Yajue Chen, Lei Mo",2019,1
"Retraction: A Functional Nuclear Epidermal Growth Factor Receptor, Src and Stat3 Heteromeric Complex in Pancreatic Cancer Cells",The PLOS ONE Editors,2019,0
"HIV Disclosure: HIV-positive status disclosure to sexual partners among individuals receiving HIV care in Addis Ababa, Ethiopia","Noah G. Dessalegn, Rahel G. Hailemichael, Aster Shewa-amare, Shailendra Sawleshwarkar, Bereket Lodebo, Alemayehu Amberbir, Richard J. Hillman",2019,6
Online testing for sexually transmitted infections: A whole systems approach to predicting value,"Katy M. E. Turner, Katharine J. Looker, Jonathan Syred, Adam Zienkiewicz, Paula Baraitser",2019,5
Genetic heterogeneity and diversity of North American golden retrievers using a low density STR marker panel,"Eric S. Ontiveros, Shayne Hughes, Maria Cecilia T. Penedo, Robert A. Grahn, Joshua A. Stern",2019,1
Correction: Involvement of C-terminal truncation mutation of kinesin-5 in resistance to kinesin-5 inhibitor,"Eri Saeki, Shinji Yasuhira, Masahiko Shibazaki, Hiroshi Tada, Minoru Doita, Tomoyuki Masuda, Chihaya Maesawa",2019,0
Efficacy of liposomal amphotericin B and anidulafungin using an antifungal lock technique (ALT) for catheter-related Candida albicans and Candida glabrata infections in an experimental model,"Jana Basas, Marta Palau, Xavier Gomis, Benito Almirante, Joan Gavaldà",2019,4
Dendritic cells pulsed with placental gp96 promote tumor-reactive immune responses,"Huaguo Zheng, Lanlan Liu, Han Zhang, Fangming Kan, Shuo Wang, Yang Li, Huaqin Tian, Songdong Meng",2019,2
"Association between migration and physical activity among medical students from a university located in Lima, Peru","Alejandro Zevallos-Morales, Leslie Luna-Porta, Henry Medina-Salazar, María Yauri, Alvaro Taype-Rondan",2019,1
Comparative analysis of mutational robustness of the intrinsically disordered viral protein VPg and of its interactor eIF4E,"Jocelyne Walter, Justine Charon, Yihua Hu, Joy Lachat, Thomas Leger, Guillaume Lafforgue, Amandine Barra, Thierry Michon",2019,5
Advances in geometric techniques for analyzing blebbing in chemotaxing Dictyostelium cells,"Zully Santiago, John Loustau, David Meretzky, Devarshi Rawal, Derrick Brazill",2019,1
Integrative systematic review of psychodrama psychotherapy research: Trends and methodological implications,"Hod Orkibi, Rinat Feniger-Schaal",2019,11
Scrutinizing assortative mating in birds,"Daiping Wang, Wolfgang Forstmeier, Mihai Valcu, Niels J. Dingemanse, Martin Bulla, Christiaan Both, Renée A. Duckworth, Lynna Marie Kiere, Patrik Karell, Tomáš Albrecht, Bart Kempenaers",2019,2
Pathology and molecular epidemiology of Mycobacterium pinnipedii tuberculosis in native New Zealand marine mammals,"Wendi D. Roe, Baukje Lenting, Anna Kokosinska, Stuart Hunter, Padraig J. Duignan, Brett Gartrell, Lynn Rogers, Desmond M. Collins, Geoffrey W. de Lisle, Kristene Gedye, Marian Price-Carter",2019,5
"Genetic diversity and relationship between cultivated, weedy and wild rye species as revealed by chloroplast and mitochondrial DNA non-coding regions analysis","Verónica Gómez-Gil, Marta Rodríguez, Francisca García-Moreno Nisa, Bárbara Pérez-Köhler, Gemma Pascual",2019,3
Independent working memory resources for egocentric and allocentric spatial information,"David Aagten-Murphy, Paul M. Bays",2019,2
Correction: TOR-autophagy branch signaling via Imp1 dictates plant-microbe biotrophic interface longevity,"Guangchao Sun, Christian Elowsky, Gang Li, Richard A. Wilson",2019,0
Primary HIV prevention in pregnant and lactating Ugandan women: A randomized trial,"Jaco Homsy, Rachel King, Femke Bannink, Zikulah Namukwaya, Eric Vittinghof, Alexander Amone, Francis Ojok, Gordon Rukundo, Sharon Amama, Juliane Etima, Joyce Matovu, Fitti Weissglas, Lawrence Ojom, Pamela Atim, Lynae Darbes, Josaphat Byamugisha, George Rutherford, Elly Katabira, Mary Glenn Fowler, the PRIMAL Study Team",2019,2
No need to discontinue hepatitis C virus therapy at the time of liver transplantation,"Catarina Skoglund, Martin Lagging, Maria Castedal",2019,0
Cardiopulmonary responses to maximal aerobic exercise in patients with cystic fibrosis,"Craig A. Williams, Kyle C. A. Wedgwood, Hossein Mohammadi, Katie Prouse, Owen W. Tomlinson, Krasimira Tsaneva-Atanasova",2019,1
Structured reporting of prostate magnetic resonance imaging has the potential to improve interdisciplinary communication,"C. Wetterauer, D. J. Winkel, J. R. Federer-Gsponer, A. Halla, S. Subotic, A. Deckart, H. H. Seifert, D. T. Boll, J. Ebbing",2019,8
Development and validation of Yatt Suicide Attitude Scale (YSAS) in Malaysia,"Norhayati Ibrahim, Normah Che Din, Noh Amit, Shazli Ezzat Ghazali, Aisyah Mohd Safien",2019,1
"Cyclical adaptation of measles virus quasispecies to epithelial and lymphocytic cells: To V, or not to V","Ryan C. Donohue, Christian K. Pfaller, Roberto Cattaneo",2019,8
Serum amyloid A and Janus kinase 2 in a mouse model of diabetic kidney disease,"Brad P. Dieter, Rick L. Meek, Robert J. Anderberg, Sheryl K. Cooney, Jen L. Bergin, Hongyu Zhang, Viji Nair, Matthias Kretzler, Frank C. Brosius, Katherine R. Tuttle",2019,7
An mHealth pilot designed to increase the reach of prevention of mother-to-child transmission of HIV (PMTCT) across the treatment cascade in a resource-constrained setting in Tanzania,"Deborah S. K. Thomas, Sheana Bull, Elias C. Nyanza, Karen Hampanda, Michael Liedtke, Sospatro E. Ngallaba",2019,1
Apparent speed of motion concomitant with action alters with delay,"Yasunaga Monno, Rumi Hisakata, Hirohiko Kaneko",2019,0
Public finances and tobacco taxation with product variety: Theory and application to Senegal and Nigeria,"Théophile T. Azomahou, Racky Baldé, Abdoulaye Diagne, Pape Yona Mané, Ibrahima Sory Kaba",2019,0
Infectious complications and NK cell depletion following daratumumab treatment of Multiple Myeloma,"Hareth Nahi, Michael Chrobok, Charlotte Gran, Johan Lund, Astrid Gruber, Gösta Gahrton, Per Ljungman, Arnika Kathleen Wagner, Evren Alici",2019,21
"A new African Titanosaurian Sauropod Dinosaur from the middle Cretaceous Galula Formation (Mtuka Member), Rukwa Rift Basin, Southwestern Tanzania","Eric Gorscak, Patrick M. O’Connor",2019,9
Comparison of efficiency and specificity of CRISPR-associated (Cas) nucleases in plants: An expanded toolkit for precision genome engineering,"Oleg Raitskin, Christian Schudoma, Anthony West, Nicola J. Patron",2019,10
Myoinhibitory peptide signaling modulates aversive gustatory learning in Caenorhabditis elegans,"Katleen Peymen, Jan Watteyne, Charline Borghgraef, Elien Van Sinay, Isabel Beets, Liliane Schoofs",2019,5
Issue framing in online voting advice applications: The effect of left-wing and right-wing headers on reported attitudes,"Naomi Kamoen, Jasper van de Pol, André Krouwel, Claes de Vreese, Bregje Holleman",2019,0
Cash transfers and HIV/HSV-2 prevalence: A replication of a cluster randomized trial in Malawi,"Lynette M. Smith, Nicholas A. Hein, Danstan Bagenda",2019,2
"Match-play movement and metabolic power demands of elite youth, sub-elite and elite senior Australian footballers","Stephen J. Kelly, Mark L. Watsford, Michael J. Rennie, Rob W. Spurrs, Damien Austin, Matthew J. Pine",2019,1
Cross-comparative analysis of evacuation behavior after earthquakes using mobile phone data,"Takahiro Yabe, Yoshihide Sekimoto, Kota Tsubouchi, Satoshi Ikemoto",2019,10
Clinical indicators of adrenal insufficiency following discontinuation of oral glucocorticoid therapy: A Danish population-based self-controlled case series analysis,"Kristina Laugesen, Irene Petersen, Henrik Toft Sørensen, Jens Otto Lunde Jørgensen",2019,1
Correction: The HER3 pathway as a potential target for inhibition in patients with biliary tract cancers,The PLOS ONE Staff,2019,0
An attention based deep learning model of clinical events in the intensive care unit,"Deepak A. Kaji, John R. Zech, Jun S. Kim, Samuel K. Cho, Neha S. Dangayach, Anthony B. Costa, Eric K. Oermann",2019,16
On the influence of cannabinoids on cell morphology and motility of glioblastoma cells,"Tim Hohmann, Kerstin Feese, Chalid Ghadban, Faramarz Dehghani, Urszula Grabiec",2019,3
Italian norms and naming latencies for 357 high quality color images,"Eduardo Navarrete, Giorgio Arcara, Sara Mondini, Barbara Penolazzi",2019,3
Assessing effects of germline exposure to environmental toxicants by high-throughput screening in C. elegans,"Nara Shin, Luciann Cuenca, Rajendiran Karthikraj, Kurunthachalam Kannan, Monica P. Colaiácovo",2019,14
Detection of circulating tumor cells in drainage venous blood from colorectal cancer patients using a new filtration and cytology-based automated platform,"Masayuki Tsutsuyama, Hayao Nakanishi, Mayumi Yoshimura, Taihei Oshiro, Takashi Kinoshita, Koji Komori, Yasuhiro Shimizu, Yoshiyuki Ichinosawa, Seichin Kinuta, Kentaro Wajima, Yasufumi Sakakibara, Yasushi Yatabe, Seiji Ito, Yasuhiro Kodera",2019,6
Environmental DNA metabarcoding for fish community analysis in backwater lakes: A comparison of capture methods,"Kazuya Fujii, Hideyuki Doi, Shunsuke Matsuoka, Mariko Nagano, Hirotoshi Sato, Hiroki Yamanaka",2019,14
Biophysical and structural characterization of a zinc-responsive repressor of the MarR superfamily,"Paloma Fernández Varela, Christophe Velours, Magali Aumont-Niçaise, Blandine Pineau, Pierre Legrand, Isabelle Poquet",2019,1
Associations between use of macrolide antibiotics during pregnancy and adverse child outcomes: A systematic review and meta-analysis,"Heng Fan, Leah Li, Linda Wijlaars, Ruth E. Gilbert",2019,9
Kaposi’s sarcoma-associated herpesvirus ORF57 protein protects viral transcripts from specific nuclear RNA decay pathways by preventing hMTR4 recruitment,"Julio C. Ruiz, Olga V. Hunter, Nicholas K. Conrad",2019,6
Noninvasive vagus nerve stimulation alters neural response and physiological autonomic tone to noxious thermal challenge,"Imanuel Lerman, Bryan Davis, Mingxiong Huang, Charles Huang, Linda Sorkin, James Proudfoot, Edward Zhong, Donald Kimball, Ramesh Rao, Bruce Simon, Andrea Spadoni, Irina Strigo, Dewleen G. Baker, Alan N. Simmons",2019,10
Methods for calculating credible intervals for ratios of beta distributions with application to relative risks of death during the second plague pandemic,"Maria Bekker-Nielsen Dunbar, Thomas J. R. Finnie, Barney Sloane, Ian M. Hall",2019,0
Plasmodium male gametocyte development and transmission are critically regulated by the two putative deadenylases of the CAF1/CCR4/NOT complex,"Kevin J. Hart, Jenna Oberstaller, Michael P. Walker, Allen M. Minns, Mark F. Kennedy, Ian Padykula, John H. Adams, Scott E. Lindner",2019,3
Individual response to mTOR inhibition in delaying replicative senescence of mesenchymal stromal cells,"Eliane Antonioli, Natália Torres, Mario Ferretti, Carla de Azevedo Piccinato, Andrea Laurato Sertie",2019,7
Deer browsing alters sound propagation in temperate deciduous forests,"Timothy J. Boycott, Jingyi Gao, Megan D. Gall",2019,1
Use of medicine pricing and reimbursement policies for universal health coverage in Indonesia,"Riswandy Wasir, Sylvi Irawati, Amr Makady, Maarten Postma, Wim Goettsch, Erik Buskens, Talitha Feenstra",2019,5
"Involvement of gliadin, a component of wheat gluten, in increased intestinal permeability leading to non-steroidal anti-inflammatory drug-induced small-intestinal damage","Sunao Shimada, Tetsuya Tanigawa, Toshio Watanabe, Akinobu Nakata, Naoki Sugimura, Shigehiro Itani, Akira Higashimori, Yuji Nadatani, Koji Otani, Koichi Taira, Shuhei Hosomi, Yasuaki Nagami, Fumio Tanaka, Noriko Kamata, Hirokazu Yamagami, Masatsugu Shiba, Yasuhiro Fujiwara",2019,5
Potential risk of Batrachochytrium salamandrivorans in Mexico,"M. Delia Basanta, Eria A. Rebollar, Gabriela Parra-Olea",2019,5
Interventions to improve the quality of bystander cardiopulmonary resuscitation: A systematic review,"Kuan-Yu Chen, Ying-Chih Ko, Ming-Ju Hsieh, Wen-Chu Chiang, Matthew Huei-Ming Ma",2019,9
PLOS Pathogens 2018 Reviewer and Editorial Board Thank You,"Fang Zhang, Deguang Liang, Xiaoxi Lin, Zhe Zou, Rui Sun, Xing Wang, Xiaozhen Liang, Kenneth M. Kaye, Ke Lan",2019,0
SLC39A8 missense variant is associated with Crohn's disease but does not have a major impact on gut microbiome composition in healthy subjects,"Valerie Collij, Floris Imhann, Arnau Vich Vila, Jingyuan Fu, Gerard Dijkstra, Eleonora A. M. Festen, Michiel D. Voskuil, Mark J. Daly, Ramnik J. Xavier, Cisca Wijmenga, Alexandra Zhernakova, Rinse K. Weersma",2019,3
Correction: Assessing the probability of introduction and spread of avian influenza (AI) virus in commercial Australian poultry operations using an expert opinion elicitation,"Mini Singh, Jenny-Ann Toribio, Angela Bullanday Scott, Peter Groves, Belinda Barnes, Kathryn Glass, Barbara Moloney, Amanda Black, Marta Hernandez-Jover",2019,0
Do professional facial image comparison training courses work?,"Alice Towler, Richard I. Kemp, A. Mike Burton, James D. Dunn, Tanya Wayne, Reuben Moreton, David White",2019,15
Soleus muscle weakness in cerebral palsy: Muscle architecture revealed with Diffusion Tensor Imaging,"Annika S. Sahrmann, Ngaire Susan Stott, Thor F. Besier, Justin W. Fernandez, Geoffrey G. Handsfield",2019,5
A comparison between wireless CROS/BiCROS and soft-band BAHA for patients with unilateral hearing loss,"Ji Eun Choi, Sun Mi Ma, Heesung Park, Yang-Sun Cho, Sung Hwa Hong, Il Joon Moon",2019,1
Correction: Correlation between image characteristics and pathologic findings in non small cell lung cancer patients after anatomic resection,"Jui-Ying Fu, Yung-Liang Wan, Tzu-Yen Huang, Ching-Feng Wu, Yun-Hen Liu, Ming-Ju Hsieh, Yi-Cheng Wu, Ching-Yang Wu",2019,1
"Do health beliefs, personality traits, and interpersonal concerns predict TB prevention behavior among Japanese adults?","Naomi Yoshitake, Mika Omori, Masumi Sugawara, Kiko Akishinonomiya, Sachiko Shimada",2019,2
Multimerization of Homo sapiens TRPA1 ion channel cytoplasmic domains,"Gilbert Q. Martinez, Sharona E. Gordon",2019,1
Using natural language processing and machine learning to classify health literacy from secure messages: The ECLIPPSE study,"Renu Balyan, Scott A. Crossley, William Brown III, Andrew J. Karter, Danielle S. McNamara, Jennifer Y. Liu, Courtney R. Lyles, Dean Schillinger",2019,4
PLOS Genetics 2018 Reviewer and Editorial Board Thank You,"Karen Camargo-Sosa, Sarah Colanesi, Jeanette Müller, Stefan Schulte-Merker, Derek Stemple, E. Elizabeth Patton, Robert N. Kelsh",2019,0
On the influence of low-level visual features in film classification,"Federico Álvarez, Faustino Sánchez, Gustavo Hernández-Peñaloza, David Jiménez, José Manuel Menéndez, Guillermo Cisneros",2019,4
A pilot study of metabolic fitness effects of weight-supported walking in women with obesity,"Ellen M. Godwin, Anthony D. Uglialoro, Andaleeb Ali, Leah Yearwood, Mary Ann Banerji, John G. Kral",2019,0
Long-term effectiveness of a gambling intervention program among children in central Illinois,"Jinma Ren, Kirk Moberg, Heidi Scuffham, Dongming Guan, Carl V. Asche",2019,0
Plant begomoviruses subvert ubiquitination to suppress plant defenses against insect vectors,"Ping Li, Chao Liu, Wen-Hao Deng, Dan-Mei Yao, Li-Long Pan, Yun-Qin Li, Yin-Quan Liu, Yan Liang, Xue-Ping Zhou, Xiao-Wei Wang",2019,13
Involvement of premacular mast cells in the pathogenesis of macular diseases,"Takaki Sato, Seita Morishita, Taeko Horie, Masanori Fukumoto, Teruyo Kida, Hidehiro Oku, Kimitoshi Nakamura, Shinji Takai, Denan Jin, Tsunehiko Ikeda",2019,1
Trend and projection of mortality rate due to non-communicable diseases in Iran: A modeling study,"Fatemeh Khosravi Shadmani, Farshad Farzadfar, Bagher Larijani, Moghadameh Mirzaei, Ali Akbar Haghdoost",2019,7
"The similarity of the effect of carbohydrase or prebiotic supplementation in broilers aged 21 days, fed mixed cereal diets and challenged with coccidiosis infection","Allison D. Craig, Farina Khattak, Peter Hastie, Mike R. Bedford, Oluyinka A. Olukosi",2020,0
A stochastic model for simulating ribosome kinetics in vivo,Eric Charles Dykeman,2020,1
Correction: Fast and accurate quantification of insertion-site specific transgene levels from raw seed samples using solid-state nanopore technology,The PLOS ONE Staff,2020,0
Single-cell glycolytic activity regulates membrane tension and HIV-1 fusion,"Charles A. Coomer, Irene Carlon-Andres, Maro Iliopoulou, Michael L. Dustin, Ewoud B. Compeer, Alex A. Compton, Sergi Padilla-Parra",2020,7
Lack of the MHC class II chaperone H2-O causes susceptibility to autoimmune diseases,"Robin A. Welsh, Nianbin Song, Catherine A. Foss, Tatiana Boronina, Robert N. Cole, Scheherazade Sadegh-Nasseri",2020,2
"Interdependence between confirmed and discarded cases of dengue, chikungunya and Zika viruses in Brazil: A multivariate time-series analysis","Juliane F. Oliveira, Moreno S. Rodrigues, Lacita M. Skalinski, Aline E. S. Santos, Larissa C. Costa, Luciana L. Cardim, Enny S. Paixão, Maria da Conceição N. Costa, Wanderson K. Oliveira, Maurício L. Barreto, Maria Glória Teixeira, Roberto F. S. Andrade",2020,1
Prognostic value of the myocardial salvage index measured by T2-weighted and T1-weighted late gadolinium enhancement magnetic resonance imaging after ST-segment elevation myocardial infarction: A systematic review and meta-regression analysis,"Benjamin Kendziora, Marc Dewey",2020,0
Ovine prenatal growth-restriction and sex influence fetal adipose tissue phenotype and impact postnatal lipid metabolism and adiposity in vivo from birth until adulthood,"Jacqueline M. Wallace, John S. Milne, Beth W. Aitken, Raymond P. Aitken, Clare L. Adam",2020,3
Circulating HPV cDNA in the blood as a reliable biomarker for cervical cancer: A meta-analysis,"Yulan Gu, Chuandan Wan, Jiaming Qiu, Yanhong Cui, Tingwang Jiang, Zhixiang Zhuang",2020,8
B cells infected with Type 2 Epstein-Barr virus (EBV) have increased NFATc1/NFATc2 activity and enhanced lytic gene expression in comparison to Type 1 EBV infection,"James C. Romero-Masters, Shane M. Huebner, Makoto Ohashi, Jillian A. Bristol, Bayleigh E. Benner, Elizabeth A. Barlow, Gail L. Turk, Scott E. Nelson, Dana C. Baiu, Nicholas Van Sciver, Erik A. Ranheim, Jenny Gumperz, Nathan M. Sherer, Paul J. Farrell, Eric C. Johannsen, Shannon C. Kenney",2020,2
"“Buruli ulcer and leprosy, they are intertwined”: Patient experiences of integrated case management of skin neglected tropical diseases in Liberia","Mateo Prochazka, Joseph Timothy, Rachel Pullan, Karsor Kollie, Emerson Rogers, Abednego Wright, Jennifer Palmer",2020,1
Antifungal susceptibility of Candida species to copper oxide nanoparticles on polycaprolactone fibers (PCL-CuONPs),"Antonio Muñoz-Escobar, Simón Yobanny Reyes-López",2020,1
Exogenous melatonin promotes seed germination and osmotic regulation under salt stress in cotton (Gossypium hirsutum L.),"Li Chen, Liantao Liu, Bin Lu, Tongtong Ma, Dan Jiang, Jin Li, Ke Zhang, Hongchun Sun, Yongjiang Zhang, Zhiying Bai, Cundong Li",2020,4
Participatory urban governance: Multilevel study,"Piotr Zientara, Anna Zamojska, Giuseppe T. Cirella",2020,0
