title,authors,year,citations
High prevalence of S. Stercoralis infection among patients with Chagas disease: A retrospective case-control study,"Pedro Puerta-Alcalde, Joan Gomez-Junyent, Ana Requena-Mendez, Maria Jesús Pinazo, Miriam José Álvarez-Martínez, Natalia Rodríguez, Joaquim Gascon, Jose Muñoz",2018,7
"Low prevalence of HCV infection with predominance of genotype 4 among HIV patients living in Libreville, Gabon","Angélique Ndjoyi-Mbiguino, Arnaud John Kombe Kombe, Berthold Bivigou-Mboumba, Samira Zoa-Assoumou, Falone Larissa Akombi, Francis Nzengui Nzengui, Hervé M’boyis Kamdem, Sandrine François-Souquière",2018,0
Genome-wide identification and role of MKK and MPK gene families in clubroot resistance of Brassica rapa,"Yinglan Piao, Kaining Jin, Ying He, Jiaxiu Liu, Shuang Liu, Xiaonan Li, Zhongyun Piao",2018,3
In vitro mouse spermatogenesis with an organ culture method in chemically defined medium,"Hiroyuki Sanjo, Mitsuru Komeya, Takuya Sato, Takeru Abe, Kumiko Katagiri, Hiroyuki Yamanaka, Yoko Ino, Noriaki Arakawa, Hisashi Hirano, Tatsuma Yao, Yuta Asayama, Akio Matsuhisa, Masahiro Yao, Takehiko Ogawa",2018,19
Molecular adaptations to phosphorus deprivation and comparison with nitrogen deprivation responses in the diatom Phaeodactylum tricornutum,"Leila Alipanah, Per Winge, Jens Rohloff, Javad Najafi, Tore Brembu, Atle M. Bones",2018,20
Functional imaging of the interaction between gut microbiota and the human host: A proof-of-concept clinical study evaluating novel use for 18F-FDG PET-CT,"Ben Boursi, Thomas J. Werner, Saeid Gholami, Sina Houshmand, Ronac Mamtani, James D. Lewis, Gary D. Wu, Abass Alavi, Yu-Xiao Yang",2018,9
Technical feasibility study for production of tailored multielectrode arrays and patterning of arranged neuronal networks,"Matthias Schürmann, Norman Shepheard, Natalie Frese, Kevin Geishendorf, Holger Sudhoff, Armin Gölzhäuser, Ulrich Rückert, Christian Kaltschmidt, Barbara Kaltschmidt, Andy Thomas",2018,0
"Pre- and post-diagnosis physical activity, television viewing, and mortality among hematologic cancer survivors","Daniela Schmid, Gundula Behrens, Hannah Arem, Christina Hart, Wolfgang Herr, Carmen Jochem, Charles E. Matthews, Michael F. Leitzmann",2018,5
Silica exposure increases the risk of stroke but not myocardial infarction—A retrospective cohort study,"Chenjing Fan, Pål Graff, Per Vihlborg, Ing-Liss Bryngelsson, Lena Andersson",2018,11
Influence of diabetes mellitus duration on the efficacy of ischemic preconditioning in a Zucker diabetic fatty rat model,"Marie Vognstoft Hjortbak, Johanne Hjort, Jonas Agerlund Povlsen, Rebekka Vibjerg Jensen, Nicolaj Brejnholdt Støttrup, Mia R. Laursen, Nichlas Riise Jespersen, Bo Løfgren, Hans Erik Bøtker",2018,13
Hemostatic findings of pleural fluid in dogs and the association between pleural effusions and primary hyperfibrino(geno)lysis: A cohort study of 99 dogs,"Andrea Zoia, Michele Drigo, Christine J. Piek, Paolo Simioni, Marco Caldin",2018,2
Likelihood ratios of quantitative laboratory results in medical diagnosis: The application of Bézier curves in ROC analysis,Walter Fierz,2018,7
"Design, monitoring and evaluation of a direct payments approach for an ecotourism strategy to reduce illegal hunting and trade of wildlife in Lao PDR","Paul Frederick Eshoo, Arlyne Johnson, Sivilay Duangdala, Troy Hansel",2018,9
Prolonging herd immunity to cholera via vaccination: Accounting for human mobility and waning vaccine effects,"Corey M. Peak, Amanda L. Reilly, Andrew S. Azman, Caroline O. Buckee",2018,4
MicroRNA profiling in plasma samples using qPCR arrays: Recommendations for correct analysis and interpretation,"Andreas B. Gevaert, Isabel Witvrouwen, Christiaan J. Vrints, Hein Heidbuchel, Emeline M. Van Craenenbroeck, Steven J. Van Laere, Amaryllis H. Van Craenenbroeck",2018,19
The more the merrier? Increasing group size may be detrimental to decision-making performance in nominal groups,"Ofra Amir, Dor Amir, Yuval Shahar, Yuval Hart, Kobi Gal",2018,1
Early cessation of ceramic production for ancestral Polynesian society in Tonga,"David V. Burley, Sean P. Connaughton, Geoffrey Clark",2018,4
Increasing influenza vaccination rates via low cost messaging interventions,Ernest Baskin,2018,3
Poverty concentration in an affluent city: Geographic variation and correlates of neighborhood poverty rates in Hong Kong,"Yingqi Guo, Shu-Sen Chang, Feng Sha, Paul S. F. Yip",2018,6
The role of the folate pathway in pancreatic cancer risk,"Shirisha Chittiboyina, Zhongxue Chen, E. Gabriela Chiorean, Lisa M. Kamendulis, Barbara A. Hocevar",2018,9
"Combination COX-2 inhibitor and metformin attenuate rate of joint replacement in osteoarthritis with diabetes: A nationwide, retrospective, matched-cohort study in Taiwan","Chieh-Hua Lu, Chi-Hsiang Chung, Chien-Hsing Lee, Chang-Hsun Hsieh, Yi-Jen Hung, Fu-Huang Lin, Chang-Huei Tsao, Po-Shiuan Hsieh, Wu-Chien Chien",2018,12
Children's peer violence perpetration and victimization: Prevalence and associated factors among school children in Afghanistan,"Julienne Corboz, Osman Hemat, Wahid Siddiq, Rachel Jewkes",2018,8
Variability in metagenomic samples from the Puget Sound: Relationship to temporal and anthropogenic impacts,"James C. Wallace, Jessica E. Youngblood, Jesse A. Port, Alison C. Cullen, Marissa N. Smith, Tomomi Workman, Elaine M. Faustman",2018,6
Sociability between invasive guppies and native topminnows,"Morelia Camacho-Cervantes, Alfredo F. Ojanguren, Omar Domínguez-Domínguez, Anne E. Magurran",2018,4
Reproducibility of preclinical animal research improves with heterogeneity of study samples,"Bernhard Voelkl, Lucile Vogt, Emily S. Sena, Hanno Würbel",2018,62
Restoration of services in disrupted infrastructure systems: A network science approach,"Aybike Ulusan, Ozlem Ergun",2018,10
Applying the multi-threat framework of stereotype threat in the context of digital gaming,"Charlotte R. Pennington, Linda K. Kaye, Joseph J. McCann",2018,4
Expression of Yin Yang 1 in cervical cancer and its correlation with E-cadherin expression and HPV16 E6,"Wanxue Wang, Zhenni Yue, Zhengping Tian, Yiran Xie, Jiamiao Zhang, Yuanping She, Bing Yang, Yuan Ye, Yihua Yang",2018,7
Historical trends in modifiable indicators of cardiovascular health and self-rated health among older adults: Cohort differences over 20 years between the Berlin Aging Study (BASE) and the Berlin Aging Study II (BASE-II),"Maximilian König, Johanna Drewelies, Kristina Norman, Dominik Spira, Nikolaus Buchmann, Gizem Hülür, Peter Eibich, Gert G. Wagner, Ulman Lindenberger, Elisabeth Steinhagen-Thiessen, Denis Gerstorf, Ilja Demuth",2018,10
Long-term effects of conservative treatment of Milwaukee brace on body image and mental health of patients with idiopathic scoliosis,"Ewa Misterska, Jakub Głowacki, Maciej Głowacki, Adam Okręt",2018,4
Continuous positive airway pressure improves gait control in severe obstructive sleep apnoea: A prospective study,"Sébastien Baillieul, Bernard Wuyam, Jean-Louis Pépin, Mathieu Marillier, Renaud Tamisier, Dominic Pérennou, Samuel Verges",2018,4
A new data assimilation method for high-dimensional models,"Guangjie Wang, Xiaoqun Cao, Xun Cai, Jingzhe Sun, Xiaoyong Li, Heng Wang",2018,1
Immature platelet fraction and thrombopoietin in patients with liver cirrhosis: A cohort study,"Philip Rauber, Frank Lammert, Katharina Grotemeyer, Beate Appenrodt",2018,7
Molecular action of isoflavone genistein in the human epithelial cell line HaCaT,"Elwira Smolińska, Marta Moskot, Joanna Jakóbkiewicz-Banecka, Grzegorz Węgrzyn, Bogdan Banecki, Aneta Szczerkowska-Dobosz, Dorota Purzycka-Bohdan, Magdalena Gabig-Cimińska",2018,9
Quantitative proteome profile of water deficit stress responses in eastern cottonwood (Populus deltoides) leaves,"Paul E. Abraham, Benjamin J. Garcia, Lee E. Gunter, Sara S. Jawdy, Nancy Engle, Xiaohan Yang, Daniel A. Jacobson, Robert L. Hettich, Gerald A. Tuskan, Timothy J. Tschaplinski",2018,8
The pregnane X receptor (PXR) and the nuclear receptor corepressor 2 (NCoR2) modulate cell growth in head and neck squamous cell carcinoma,"Juan Pablo Rigalli, Matthias Reichel, Tasmin Reuter, Guillermo Nicolás Tocchetti, Gerhard Dyckhoff, Christel Herold-Mende, Dirk Theile, Johanna Weiss",2018,3
Epidemiology and risk factors of extensively drug-resistant Pseudomonas aeruginosa infections,"Nattawan Palavutitotai, Anupop Jitmuang, Sasima Tongsai, Pattarachai Kiratisin, Nasikarn Angkasekwinai",2018,22
Increased survival of honeybees in the laboratory after simultaneous exposure to low doses of pesticides and bacteria,"Franziska Dickel, Daniel Münch, Gro Vang Amdam, Johanna Mappes, Dalial Freitak",2018,11
"Insulin resistance in lean and overweight non-diabetic Caucasian adults: Study of its relationship with liver triglyceride content, waist circumference and BMI","Jorge Gonzalez-Cantero, Jose Luis Martin-Rodriguez, Alvaro Gonzalez-Cantero, Juan Pedro Arrebola, Jorge Luis Gonzalez-Calvin",2018,13
Tricks of the trade: Mechanism of brood theft in an ant,"Bishwarup Paul, Sumana Annagiri",2018,2
"Reduced cognitive function, increased blood-brain-barrier transport and inflammatory responses, and altered brain metabolites in LDLr -/-and C57BL/6 mice fed a western diet","Jennifer M. Rutkowsky, Linda L. Lee, Michelle Puchowicz, Mari S. Golub, Douglas E. Befroy, Dennis W. Wilson, Steven Anderson, Gary Cline, Jason Bini, Kamil Borkowski, Trina A. Knotts, John C. Rutledge, on behalf of the Mouse Metabolic Phenotyping Center Imaging Working Group",2018,12
"Cuticular hydrocarbons correlate with queen reproductive status in native and invasive Argentine ants (Linepithema humile, Mayr)","Sílvia Abril, Mireia Diaz, Alain Lenoir, Carolina Ivon Paris, Raphaël Boulay, Crisanto Gómez",2018,6
Seasonality in trauma admissions – Are daylight and weather variables better predictors than general cyclic effects?,"Jo Røislien, Signe Søvik, Torsten Eken",2018,9
Validity and reliability of an accelerometer-based player tracking device,"Daniel P. Nicolella, Lorena Torres-Ronda, Kase J. Saylor, Xavi Schelling",2018,27
"The effects of intensified training on resting metabolic rate (RMR), body composition and performance in trained cyclists","Amy L. Woods, Anthony J. Rice, Laura A. Garvican-Lewis, Alice M. Wallett, Bronwen Lundy, Margot A. Rogers, Marijke Welvaert, Shona Halson, Andrew McKune, Kevin G. Thompson",2018,18
Two way controls of apoptotic regulators consign DmArgonaute-1 a better clasp on it,"Tanmoy Mondal, Indira Bag, Pushpavalli SNCVL, Koteswara Rao Garikapati, Utpal Bhadra, Manika Pal Bhadra",2018,2
Stigma gets in my way: Factors affecting client-provider communication regarding childbearing among people living with HIV in Uganda,"Jolly Beyeza-Kashesya, Rhoda K. Wanyenze, Kathy Goggin, Sarah Finocchario-Kessler, Mahlet Atakilt Woldetsadik, Deborah Mindry, Josephine Birungi, Glenn J. Wagner",2018,8
The novel antibiotic rhodomyrtone traps membrane proteins in vesicles with increased fluidity,"Dennapa Saeloh, Varomyalin Tipmanee, Kin Ki Jim, Marien P. Dekker, Wilbert Bitter, Supayang P. Voravuthikunchai, Michaela Wenzel, Leendert W. Hamoen",2018,18
Researchers’ participation in and motivations for engaging with research information management systems,"Besiki Stvilia, Shuheng Wu, Dong Joon Lee",2018,5
Neutralization of cholera toxin with nanoparticle decoys for treatment of cholera,"Soumita Das, Pavimol Angsantikul, Christine Le, Denny Bao, Yukiko Miyamoto, Weiwei Gao, Liangfang Zhang, Lars Eckmann",2018,9
Qualitative thematic analysis of the phenomenology of near-death experiences,"Helena Cassol, Benoît Pétré, Sophie Degrange, Charlotte Martial, Vanessa Charland-Verville, François Lallier, Isabelle Bragard, Michèle Guillaume, Steven Laureys",2018,22
Protein S-glutathionylation lowers superoxide/hydrogen peroxide release from skeletal muscle mitochondria through modification of complex I and inhibition of pyruvate uptake,"Robert M. Gill, Marisa O’Brien, Adrian Young, Danielle Gardiner, Ryan J. Mailloux",2018,17
The characteristic of asthma control among nasal diseases population: Results from a cross-sectional study,"Jiangtao Lin, Jie Gao, Kefang Lai, Xin Zhou, Bei He, Jianying Zhou, Changzheng Wang",2018,2
Role of Su(Hw) zinc finger 10 and interaction with CP190 and Mod(mdg4) proteins in recruiting the Su(Hw) complex to chromatin sites in Drosophila,"Larisa Melnikova, Margarita Kostyuchenko, Alexander Parshikov, Pavel Georgiev, Anton Golovnin",2018,4
Evaluation of Proctophyllodes huitzilopochtlii on feathers from Anna’s (Calypte anna) and Black-chinned (Archilochus alexandri) Hummingbirds: Prevalence assessment and imaging analysis using light and tabletop scanning electron microscopy,"Youki K. Yamasaki, Emily E. Graves, Robin S. Houston, Barry M. OConnor, Patricia E. Kysar, Mary H. Straub, Janet E. Foley, Lisa A. Tell",2018,4
Correction: Distinct temporal roles for the promyelocytic leukaemia (PML) protein in the sequential regulation of intracellular host immunity to HSV-1 infection,"Thamir Alandijany, Ashley P. E. Roberts, Kristen L. Conn, Colin Loney, Steven McFarlane, Anne Orr, Chris Boutell",2018,2
Ligand-induced perturbation of the HIF-2α:ARNT dimer dynamics,"Stefano Motta, Claudia Minici, Dario Corrada, Laura Bonati, Alessandro Pandini",2018,7
A tale of two mixotrophic chrysophytes: Insights into the metabolisms of two Ochromonas species (Chrysophyceae) through a comparison of gene expression,"Alle A. Y. Lie, Zhenfeng Liu, Ramon Terrado, Avery O. Tatters, Karla B. Heidelberg, David A. Caron",2018,12
Risk factors control for primary prevention of cardiovascular disease in men: Evidence from the Aragon Workers Health Study (AWHS),"Isabel Aguilar-Palacio, Sara Malo, Cristina Feja, MªJesús Lallana, Montserrat León-Latre, José Antonio Casasnovas, MªJosé Rabanaque, Eliseo Guallar",2018,6
Macro and micro plastics sorb and desorb metals and act as a point source of trace metals to coastal ecosystems,"B. Munier, L. I. Bendell",2018,44
Different physiological stages and breeding systems related to the variability of meat quality of indigenous Pantaneiro sheep,"Jéssica de Oliveira Monteschio, Poliana Campos Burin, Ariadne Patricia Leonardo, Daiane Aparecido Fausto, Adrielly Lais Alves da Silva, Hélio de Almeida Ricardo, Marcelo Corrêa da Silva, Márcio Rodrigues de Souza, Fernando Miranda de Vargas Junior",2018,4
Prevalence of diagnosed temporomandibular disorders: A cross-sectional study in Brazilian adolescents,"Fernanda Mara de Paiva Bertoli, Carolina Dea Bruzamolin, Eduardo Pizzatto, Estela Maris Losso, João Armando Brancher, Juliana Feltrin de Souza",2018,29
PuLSE: Quality control and quantification of peptide sequences explored by phage display libraries,"Steven Shave, Stefan Mann, Joanna Koszela, Alastair Kerr, Manfred Auer",2018,1
Difference between beta1-adrenoceptor autoantibodies of human and animal origin—Limitations detecting beta1-adrenoceptor autoantibodies using peptide based ELISA technology,"Katrin Wenzel, Sarah Schulze-Rothe, Johannes Müller, Gerd Wallukat, Annekathrin Haberland",2018,8
Effect of park prescriptions with and without group visits to parks on stress reduction in low-income parents: SHINE randomized trial,"Nooshin Razani, Saam Morshed, Michael A. Kohn, Nancy M. Wells, Doug Thompson, Maoya Alqassari, Amaka Agodi, George W. Rutherford",2018,23
Carotenoid coloration and health status of urban Eurasian kestrels (Falco tinnunculus),"Petra Sumasgutner, Marius Adrion, Anita Gamauf",2018,8
S100B as an antagonist to block the interaction between S100A1 and the RAGE V domain,"Md. Imran Khan, Yu-Kai Su, Jinhao Zou, Lee-Wei Yang, Ruey-Hwang Chou, Chin Yu",2018,8
"Reversals and limitations on high-intensity, life-sustaining treatments","Gustavo Chavez, Ilana B. Richman, Rajani Kaimal, Jason Bentley, Lee Ann Yasukawa, Russ B. Altman, Vyjeyanthi S. Periyakoil, Jonathan H. Chen",2018,2
Phalangeal joints kinematics in ostrich (Struthio camelus) locomotion on sand,"Rui Zhang, Qiaoli Ji, Dianlei Han, Haijin Wan, Xiujuan Li, Gang Luo, Shuliang Xue, Songsong Ma, Mingming Yang, Jianqiao Li",2018,3
Perfluoroalkyl substances and changes in body weight and resting metabolic rate in response to weight-loss diets: A prospective study,"Gang Liu, Klodian Dhana, Jeremy D. Furtado, Jennifer Rood, Geng Zong, Liming Liang, Lu Qi, George A. Bray, Lilian DeJonge, Brent Coull, Philippe Grandjean, Qi Sun",2018,49
Release of transcriptional repression through the HCR promoter region confers uniform expression of HWP1 on surfaces of Candida albicans germ tubes,"Samin Kim, Quoc Bao Nguyen, Michael J. Wolyniak, Gregory Frechette, Christian R. Lehman, Brandon K. Fox, Paula Sundstrom",2018,6
Exploration of avocado by-products as natural sources of bioactive compounds,"Maria Augusta Tremocoldi, Pedro Luiz Rosalen, Marcelo Franchin, Adna Prado Massarioli, Carina Denny, Érica Regina Daiuto, Jonas Augusto Rizzato Paschoal, Priscilla Siqueira Melo, Severino Matias de Alencar",2018,36
Flow patterns through vascular graft models with and without cuffs,"Chia Min Leong, Gary B. Nackman, Timothy Wei",2018,1
Development of a recombinase polymerase amplification assay for rapid detection of Francisella noatunensis subsp. orientalis,"Khalid Shahin, Jose Gustavo Ramirez-Paredes, Graham Harold, Benjamin Lopez-Jimena, Alexandra Adams, Manfred Weidmann",2018,11
Novel flowcytometry-based approach of malignant cell detection in body fluids using an automated hematology analyzer,"Tomohiko Ai, Yoko Tabe, Hiroyuki Takemura, Konobu Kimura, Toshihiro Takahashi, Haeun Yang, Koji Tsuchiya, Aya Konishi, Kinya Uchihashi, Takashi Horii, Akimichi Ohsaka",2018,8
"Getting to FP2020: Harnessing the private sector to increase modern contraceptive access and choice in Ethiopia, Nigeria, and DRC","Christina Riley, Danielle Garfinkel, Katherine Thanel, Keith Esch, Endale Workalemahu, Jennifer Anyanti, Godéfroid Mpanya, Arsène Binanga, Jen Pope, Kim Longfield, Jane Bertrand, Bryan Shaw, on behalf of the FPwatch Group",2018,8
Single cell on-chip whole genome amplification via micropillar arrays for reduced amplification bias,"Harvey C. Tian, Jaime J. Benitez, Harold G. Craighead",2018,5
"Association between temporomandibular disorders, chronic diseases, and ophthalmologic and otolaryngologic disorders in Korean adults: A cross-sectional study","Hyun-Seop Song, Joon-Shik Shin, Jinho Lee, Yoon Jae Lee, Me-riong Kim, Jae-Heung Cho, Koh-Woon Kim, Yeoncheol Park, Hyun Jin Song, Sun-Young Park, Seoyoun Kim, Mia Kim, In-Hyuk Ha",2018,9
Switching and loss of cellular cytokine producing capacity characterize in vivo viral infection and malignant transformation in human T- lymphotropic virus type 1 infection,"Huseini Kagdi, Maria Antonietta Demontis, Juan Carlos Ramos, Graham P. Taylor",2018,7
Private healthcare provider experiences with social health insurance schemes: Findings from a qualitative study in Ghana and Kenya,"Maia Sieverding, Cynthia Onyango, Lauren Suchman",2018,14
"A new high-performance liquid chromatography-tandem mass spectrometry method for the determination of paclitaxel and 6α-hydroxy-paclitaxel in human plasma: Development, validation and application in a clinical pharmacokinetic study","Bianca Posocco, Mauro Buzzo, Andrea Follegot, Luciana Giodini, Roberto Sorio, Elena Marangon, Giuseppe Toffoli",2018,5
Seeing through rose-colored glasses: How optimistic expectancies guide visual attention,"Laura Kress, Mirko Bristle, Tatjana Aue",2018,9
Imaging cellular pharmacokinetics of 18F-FDG and 6-NBDG uptake by inflammatory and stem cells,"Raiyan T. Zaman, Silvan Tuerkcan, Morteza Mahmoudi, Toshinobu Saito, Phillip C. Yang, Frederick T. Chin, Michael V. McConnell, Lei Xing",2018,0
Beyond monetary benefits of restoring sight in Vietnam: Evaluating well-being gains from cataract surgery,"Simon Feeny, Alberto Posso, Lachlan McDonald, Truong Thi Kim Chuyen, Son Thanh Tung",2018,4
Detection of mitochondrial DNA with 4977 bp deletion in leukocytes of patients with ischemic stroke,"Yu-hua Huang, Chiung-Mei Chen, Yun-Shien Lee, Kuo-Hsuan Chang, Huei-Wen Chen, Yi-Chun Chen",2018,7
Sexing of chicken eggs by fluorescence and Raman spectroscopy through the shell membrane,"Roberta Galli, Grit Preusse, Christian Schnabel, Thomas Bartels, Kerstin Cramer, Maria-Elisabeth Krautwald-Junghanns, Edmund Koch, Gerald Steiner",2018,10
"Pettiness: Conceptualization, measurement and cross-cultural differences","Reuben Ng, Becca Levy",2018,2
Microbial diversity and component variation in Xiaguan Tuo Tea during pile fermentation,"Haizhou Li, Min Li, Xinrui Yang, Xin Gui, Guofeng Chen, Jiuyun Chu, Xingwang He, Weitao Wang, Feng Han, Ping Li",2018,4
Knockdown of L1CAM significantly reduces metastasis in a xenograft model of human melanoma: L1CAM is a potential target for anti-melanoma therapy,"Ann-Kathrin Ernst, Annika Putscher, Timur R. Samatov, Anna Suling, Vladimir V. Galatenko, Maxim Yu Shkurnikov, Evgeny N. Knyazev, Alexander G. Tonevitsky, Thomas Haalck, Tobias Lange, Hanna Maar, Jennifer Schröder- Schwarz, Kristoffer Riecken, Udo Schumacher, Daniel Wicklein",2018,6
Phytoforensics: Trees as bioindicators of potential indoor exposure via vapor intrusion,"Jordan L. Wilson, V. A. Samaranayake, Matt A. Limmer, Joel G. Burken",2018,1
"Correction: Hospitalizations due to unintentional transport injuries among Aboriginal population of British Columbia, Canada: Incidence, changes over time and ecological analysis of risk markers","Mariana Brussoni, M. Anne George, Andrew Jin, Ofer Amram, Rod McCormick, Christopher E. Lalonde",2018,0
Early intervention for subthreshold panic disorder in the Netherlands: A model-based economic evaluation from a societal perspective,"Robbin H. Ophuis, Joran Lokkerbol, Mickaël Hiligsmann, Silvia M. A. A. Evers",2018,4
A robust technique based on VLM and Frangi filter for retinal vessel extraction and denoising,"Khan Bahadar Khan, Amir. A. Khaliq, Abdul Jalil, Muhammad Shahid",2018,15
A thioredoxin-dependent peroxiredoxin Q from Corynebacterium glutamicum plays an important role in defense against oxidative stress,"Tao Su, Meiru Si, Yunfeng Zhao, Yan Liu, Shumin Yao, Chengchuan Che, Can Chen",2018,14
"Peak oxygen uptake in Paralympic sitting sports: A systematic literature review, meta- and pooled-data analysis","Julia Kathrin Baumgart, Berit Brurok, Øyvind Sandbakk",2018,15
Comparison between influenza coded primary care consultations and national influenza incidence obtained by the General Practitioners Sentinel Network in Portugal from 2012 to 2017,"Rosália Páscoa, Ana Paula Rodrigues, Susana Silva, Baltazar Nunes, Carlos Martins",2018,5
Modelling human hard palate shape with Bézier curves,"Rick Janssen, Scott R. Moisik, Dan Dediu",2018,3
Rapid purification of giant lipid vesicles by microfiltration,"Dimitri Fayolle, Michele Fiore, Pasquale Stano, Peter Strazewski",2018,6
Correction: Sensitivity of self-reported opioid use in case-control studies: Healthy individuals versus hospitalized patients,"Hamideh Rashidian, Maryam Hadji, Maryam Marzban, Mahin Gholipour, Afarin Rahimi-Movaghar, Farin Kamangar, Reza Malekzadeh, Elisabete Weiderpass, Abbas Rezaianzadeh, Abdolvahab Moradi, Nima Babhadi-Ashar, Reza Ghiasvand, Hossein Khavari-Daneshvar, Ali Akbar Haghdoost, Kazem Zendehdel",2018,1
Effects of voluntary running exercise on bone histology in type 2 diabetic rats,"Yuri Takamine, Noriko Ichinoseki-Sekine, Takamasa Tsuzuki, Toshinori Yoshihara, Hisashi Naito",2018,0
"Correction: Acoustic differentiation and behavioral response reveals cryptic species within Buergeria treefrogs (Anura, Rhacophoridae) from Taiwan","Ying-Han Wang, Yu-Wei Hsiao, Ko-Huan Lee, Hui-Yun Tseng, Yen-Po Lin, Shohei Komaki, Si-Min Lin",2018,1
An inconclusive study comparing the effect of concrete and abstract descriptions of belief-inconsistent information,"Katherine A. Collins, Richard Clément",2018,2
Proteomics analysis identified peroxiredoxin 2 involved in early-phase left ventricular impairment in hamsters with cardiomyopathy,"Kentaro Kuzuya, Sahoko Ichihara, Yuka Suzuki, Chisa Inoue, Gaku Ichihara, Syota Kurimoto, Shinji Oikawa",2018,3
Joint ancestry and association test indicate two distinct pathogenic pathways involved in classical dengue fever and dengue shock syndrome,"Marisa Oliveira, Worachart Lert-itthiporn, Bruno Cavadas, Verónica Fernandes, Ampaiwan Chuansumrit, Orlando Anunciação, Isabelle Casademont, Fanny Koeth, Marina Penova, Kanchana Tangnararatchakit, Chiea Chuen Khor, Richard Paul, Prida Malasit, Fumihiko Matsuda, Etienne Simon-Lorière, Prapat Suriyaphol, Luisa Pereira, Anavaj Sakuntabhai",2018,9
Histamine as an emergent indoor contaminant: Accumulation and persistence in bed bug infested homes,"Zachary C. DeVries, Richard G. Santangelo, Alexis M. Barbarin, Coby Schal",2018,8
Notch signaling inhibitor DAPT provides protection against acute craniocerebral injury,"Hong-Mei Zhang, Pei Liu, Cheng Jiang, Xiao-Qing Jin, Rui-Ning Liu, Shun-Qing Li, Yan Zhao",2018,15
Transcriptome analysis in different developmental stages of Batocera horsfieldi (Coleoptera: Cerambycidae) and comparison of candidate olfactory genes,"Hua Yang, Yan Cai, Zhihang Zhuo, Wei Yang, Chunping Yang, Jin Zhang, Yang Yang, Baoxin Wang, Fengrong Guan",2018,12
Thymic B cell development is controlled by the B potential of progenitors via both hematopoietic-intrinsic and thymic microenvironment-intrinsic regulatory mechanisms,"Shiyun Xiao, Wen Zhang, Nancy R. Manley",2018,0
"Cost-effectiveness of prenatal food and micronutrient interventions on under-five mortality and stunting: Analysis of data from the MINIMat randomized trial, Bangladesh","Pernilla Svefors, Katarina Ekholm Selling, Rubina Shaheen, Ashraful Islam Khan, Lars-Åke Persson, Lars Lindholm",2018,6
