title,authors,year,citations
High throughput deep degradome sequencing reveals microRNAs and their targets in response to drought stress in mulberry (Morus alba),"Ruixue Li, Dandan Chen, Taichu Wang, Yizhen Wan, Rongfang Li, Rongjun Fang, Yuting Wang, Fei Hu, Hong Zhou, Long Li, Weiguo Zhao",2017,12
Structural Determinants of Health among Im/Migrants in the Indoor Sex Industry: Experiences of Workers and Managers/Owners in Metropolitan Vancouver,"Shira M. Goldenberg, Andrea Krüsi, Emma Zhang, Jill Chettiar, Kate Shannon",2017,14
Carbapenem-resistance and pathogenicity of bovine Acinetobacter indicus-like isolates,"Peter Klotz, Stephan Göttig, Ursula Leidner, Torsten Semmler, Sandra Scheufen, Christa Ewers",2017,10
Influence of nitrogen and phosphorous on the growth and root morphology of Acer mono,"Muhammad Razaq, Peng Zhang, Hai-long Shen, Salahuddin",2017,64
"Perioperative onset of acquired von Willebrand syndrome: Comparison between HVAD, HeartMate II and on-pump coronary bypass surgery","Christina Feldmann, Rashad Zayat, Andreas Goetzenich, Ali Aljalloud, Eva Woelke, Judith Maas, Lachmandath Tewarie, Thomas Schmitz-Rode, Ruediger Autschbach, Ulrich Steinseifer, Ajay Moza",2017,7
The association between human endogenous retroviruses and multiple sclerosis: A systematic review and meta-analysis,"Elena Morandi, Radu Tanasescu, Rachael E. Tarlinton, Cris S. Constantinescu, Weiya Zhang, Christopher Tench, Bruno Gran",2017,39
The increasing toll of adolescent cancer incidence in the US,"Jessica Burkhamer, David Kriebel, Richard Clapp",2017,11
The value of resting-state functional magnetic resonance imaging for detecting epileptogenic zones in patients with focal epilepsy,"Zhijuan Chen, Yang An, Bofeng Zhao, Weidong Yang, Qing Yu, Li Cai, Hongyan Ni, Jianzhong Yin",2017,5
Mated Drosophila melanogaster females consume more amino acids during the dark phase,"Shun Uchizono, Yumi Tabuki, Natsumi Kawaguchi, Teiichi Tanimura, Taichi Q. Itoh",2017,8
Mulberry-extract improves glucose tolerance and decreases insulin concentrations in normoglycaemic adults: Results of a randomised double-blind placebo-controlled study,"Mark Lown, Richard Fuller, Helen Lightowler, Ann Fraser, Andrew Gallagher, Beth Stuart, Christopher Byrne, George Lewith",2017,11
Linear mixed-effects models to describe length-weight relationships for yellow croaker (Larimichthys Polyactis) along the north coast of China,"Qiuyun Ma, Yan Jiao, Yiping Ren",2017,13
Distinct antibody responses of patients with mild and severe leptospirosis determined by whole proteome microarray analysis,"Carolina Lessa-Aquino, Janet C. Lindow, Arlo Randall, Elsio Wunder, Jozelyn Pablo, Rie Nakajima, Algis Jasinskas, Jaqueline S. Cruz, Alcineia O. Damião, Nívison Nery, Guilherme S. Ribeiro, Federico Costa, José E. Hagan, Mitermayer Galvão Reis, Albert I. Ko, Marco Alberto Medeiros, Philip L. Felgner",2017,12
Correction: Identification of Optimal Insertion Site in Recombinant Newcastle Disease Virus (rNDV) Vector Expressing Foreign Gene to Enhance Its Anti-Tumor Effect,"Ziye Pan, Jinjiao He, Lubna M. Rasoul, Yunye Liu, Ruixiang Che, Yun Ding, Xiaocheng Guo, Jiarui Yang, Dehua Zou, Hua Zhang, Deshan Li, Hongwei Cao",2017,0
Identification of age-dependent motor and neuropsychological behavioural abnormalities in a mouse model of Mucopolysaccharidosis Type II,"Hélène F. E. Gleitz, Claire O’Leary, Rebecca J. Holley, Brian W. Bigger",2017,12
"PnLRR-RLK27, a novel leucine-rich repeats receptor-like protein kinase from the Antarctic moss Pohlia nutans, positively regulates salinity and oxidation-stress tolerance","Jing Wang, Shenghao Liu, Chengcheng Li, Tailin Wang, Pengying Zhang, Kaoshan Chen",2017,18
"Ovine Mesenchymal Stromal Cells: Morphologic, Phenotypic and Functional Characterization for Osteochondral Tissue Engineering","Clara Sanjurjo-Rodríguez, Rocío Castro-Viñuelas, Tamara Hermida-Gómez, Tania Fernández-Vázquez, Isaac Manuel Fuentes-Boquete, Francisco Javier de Toro-Santos, Silvia María Díaz-Prado, Francisco Javier Blanco-García",2017,15
Dengue virus antibody database: Systematically linking serotype-specificity with epitope mapping in dengue virus,"Sidhartha Chaudhury, Gregory D. Gromowski, Daniel R. Ripoll, Ilja V. Khavrutskii, Valmik Desai, Anders Wallqvist",2017,11
Multi-scale spatio-temporal analysis of human mobility,"Laura Alessandretti, Piotr Sapiezynski, Sune Lehmann, Andrea Baronchelli",2017,25
The role of short-term memory and visuo-spatial skills in numerical magnitude processing: Evidence from Turner syndrome,"Lucie Attout, Marie-Pascale Noël, Marie-Cécile Nassogne, Laurence Rousselle",2017,4
Fewer acute respiratory infection episodes among patients receiving treatment for gastroesophageal reflux disease,"Herng-Ching Lin, Sudha Xirasagar, Shiu-Dong Chung, Chung-Chien Huang, Ming-Chieh Tsai, Chao-Hung Chen",2017,2
First-line antiretroviral drug discontinuations in children,"Melony Fortuin-de Smidt, Reneé de Waal, Karen Cohen, Karl-Günter Technau, Kathryn Stinson, Gary Maartens, Andrew Boulle, Ehimario U. Igumbor, Mary-Ann Davies",2017,4
"The One Health approach to identify knowledge, attitudes and practices that affect community involvement in the control of Rift Valley fever outbreaks","Osama Ahmed Hassan, Hippolyte Affognon, Joacim Rocklöv, Peter Mburu, Rosemary Sang, Clas Ahlm, Magnus Evander",2017,14
Reproducibility and comparison of oxygen-enhanced T1 quantification in COPD and asthma patients,"Simon M. F. Triphan, Bertram J. Jobst, Angela Anjorin, Oliver Sedlaczek, Ursula Wolf, Maxim Terekhov, Christian Hoffmann, Sebastian Ley, Christoph Düber, Jürgen Biederer, Hans-Ulrich Kauczor, Peter M. Jakob, Mark O. Wielpütz",2017,11
Defining Abnormal Fetal Growth and Perinatal Risk: Population or Customized Standards?,"Sarah J. Stock, Jenny Myers",2017,5
Non-melanoma skin cancer and risk of Alzheimer’s disease and all-cause dementia,"Sigrun A. J. Schmidt, Anne G. Ording, Erzsébet Horváth-Puhó, Henrik T. Sørensen, Victor W. Henderson",2017,11
Oral administration of Lactobacillus paracasei L9 attenuates PM2.5-induced enhancement of airway hyperresponsiveness and allergic airway response in murine model of asthma,"Xifan Wang, Yan Hui, Liang Zhao, Yanling Hao, Huiyuan Guo, Fazheng Ren",2017,25
Human interest meets biodiversity hotspots: A new systematic approach for urban ecosystem conservation,"Minoru Kasada, Misako Matsuba, Tadashi Miyashita",2017,4
Prevalence of maternal HIV infection and knowledge on mother–to–child transmission of HIV and its prevention among antenatal care attendees in a rural area in northwest Cameroon,"Carlson-Babila Sama, Vitalis F. Feteh, Maxime Tindong, John T. Tanyi, Nestor Mbinkar Bihle, Fru F. Angwafo III",2017,10
Best anthropometric discriminators of incident type 2 diabetes among white and black adults: A longitudinal ARIC study,"Dale S. Hardy, Devita T. Stallings, Jane T. Garvin, Hongyan Xu, Susan B. Racette",2017,12
Altered renal sodium handling and risk of incident hypertension: Results of the Olivetti Heart Study,"Lanfranco D’Elia, Francesco P. Cappuccio, Roberto Iacone, Ornella Russo, Ferruccio Galletti, Pasquale Strazzullo",2017,3
Structural changes on a molecular basis of canola meal by conditioning temperature and time during pelleting process in relation to physiochemical (energy and protein) properties relevant to ruminants,"Xuewei Huang, Huihua Zhang, Peiqiang Yu",2017,9
Correction: Psychotic Experiences and Overhasty Inferences Are Related to Maladaptive Learning,"Heiner Stuke, Hannes Stuke, Veith Andreas Weilnhammer, Katharina Schmack",2017,1
Factors influencing feeding practices of extreme poor infants and young children in families of working mothers in Dhaka slums: A qualitative study,"Ashraful Kabir, Mathilde Rose Louise Maitrot",2017,11
CacyBP/SIP promotes the proliferation of colon cancer cells,"Huihong Zhai, Yongquan Shi, Xiong Chen, Jun Wang, Yuanyuan Lu, Faming Zhang, Zhengxiong Liu, Ting Lei, Daiming Fan",2017,7
Aptamers provide superior stainings of cellular receptors studied under super-resolution microscopy,"Maria Angela Gomes de Castro, Claudia Höbartner, Felipe Opazo",2017,22
The presence of the gadolinium-based contrast agent depositions in the brain and symptoms of gadolinium neurotoxicity - A systematic review,"Cyprian Olchowy, Kamil Cebulski, Mateusz Łasecki, Radosław Chaber, Anna Olchowy, Krzysztof Kałwak, Urszula Zaleska-Dorobisz",2017,88
Correction: Literary Fiction Influences Attitudes Toward Animal Welfare,The PLOS ONE Staff,2017,0
Coevolutionary dynamics of phenotypic diversity and contingent cooperation,"Te Wu, Long Wang, Feng Fu",2017,15
Prevalence of minimal hearing loss in South Korea,"Ji Eun Choi, Jungmin Ahn, Hyun Woo Park, Sun-Young Baek, Seonwoo Kim, Il Joon Moon",2017,6
SF-6D utility values for the better- and worse-seeing eye for health states based on the Snellen equivalent in patients with age-related macular degeneration,"Martijn S. Visser, Sankha Amarakoon, Tom Missotten, Reinier Timman, Jan J. Busschbach",2017,2
Retinopathy of prematurity: A comprehensive risk analysis for prevention and prediction of disease,"Leah A. Owen, Margaux A. Morrison, Robert O. Hoffman, Bradley A. Yoder, Margaret M. DeAngelis",2017,16
Does metabolite channeling accelerate enzyme-catalyzed cascade reactions?,"Liubov Poshyvailo, Eric von Lieres, Svyatoslav Kondrat",2017,20
Establishing a reliable framework for harnessing the creative power of the scientific crowd,"Adrian J. Carter, Amy Donner, Wen Hwa Lee, Chas Bountra",2017,7
The light-makeup advantage in facial processing: Evidence from event-related potentials,"Keiko Tagai, Hitomi Shimakura, Hiroko Isobe, Hiroshi Nittono",2017,2
RNA-Seq analysis of chikungunya virus infection and identification of granzyme A as a major promoter of arthritic inflammation,"Jane A. C. Wilson, Natalie A. Prow, Wayne A. Schroder, Jonathan J. Ellis, Helen E. Cumming, Linden J. Gearing, Yee Suan Poo, Adam Taylor, Paul J. Hertzog, Francesca Di Giallonardo, Linda Hueston, Roger Le Grand, Bing Tang, Thuy T. Le, Joy Gardner, Suresh Mahalingam, Pierre Roques, Phillip I. Bird, Andreas Suhrbier",2017,36
Semi-quantitative proteomics of mammalian cells upon short-term exposure to non-ionizing electromagnetic fields,"Arnold Kuzniar, Charlie Laffeber, Berina Eppink, Karel Bezstarosti, Dick Dekkers, Henri Woelders, A. Peter M. Zwamborn, Jeroen Demmers, Joyce H. G. Lebbink, Roland Kanaar",2017,6
Climate Change Across Seasons Experiment (CCASE): A new method for simulating future climate in seasonally snow-covered ecosystems,"Pamela H. Templer, Andrew B. Reinmann, Rebecca Sanders-DeMott, Patrick O. Sorensen, Stephanie M. Juice, Francis Bowles, Laura E. Sofen, Jamie L. Harrison, Ian Halm, Lindsey Rustad, Mary E. Martin, Nicholas Grant",2017,17
Prevalence of diabetes and unrecognized diabetes in hypertensive patients aged 40 to 79 years in southwest China,"Xiao-bo Huang, Wei-wei Tang, Ya Liu, Rong Hu, Ling-yun Ouyang, Jian-xiong Liu, Xiu-jun Li, Yan-jing Yi, Tzung-Dau Wang, Shui-ping Zhao",2017,8
Correction: Discrimination of Deletion and Duplication Subtypes of the Deleted in Azoospermia Gene Family in the Context of Frequent Interloci Gene Conversion,The PLOS ONE Staff,2017,0
Assessment of Non-Response Bias in Estimates of Alcohol Consumption: Applying the Continuum of Resistance Model in a General Population Survey in England,"Sadie Boniface, Shaun Scholes, Nicola Shelton, Jennie Connor",2017,14
The presence of the putative Gardnerella vaginalis sialidase A gene in vaginal specimens is associated with bacterial vaginosis biofilm,"Liselotte Hardy, Vicky Jespers, Magelien Van den Bulck, Jozefien Buyze, Lambert Mwambarangwe, Viateur Musengamana, Mario Vaneechoutte, Tania Crucitti",2017,31
"Coagulation profile in patients undergoing video-assisted thoracoscopic lobectomy: A randomized, controlled trial","Thomas Decker Christensen, Henrik Vad, Søren Pedersen, Kåre Hornbech, Nora Elisabeth Zois, Peter B. Licht, Mads Nybo, Anne-Mette Hvas",2017,14
Anti-predator meshing may provide greater protection for sea turtle nests than predator removal,"Julie M. O’Connor, Colin J. Limpus, Kate M. Hofmeister, Benjamin L. Allen, Scott E. Burnett",2017,5
Affordability of medicines in the European Union,"Tomasz Zaprutko, Dorota Kopciuch, Krzysztof Kus, Piotr Merks, Monika Nowicka, Izabela Augustyniak, Elżbieta Nowakowska",2017,17
Perceived risk of diabetes seriously underestimates actual diabetes risk: The KORA FF4 study,"Bernd Kowall, Wolfgang Rathmann, Andreas Stang, Brenda Bongaerts, Oliver Kuss, Christian Herder, Michael Roden, Anne Quante, Rolf Holle, Cornelia Huth, Annette Peters, Christa Meisinger",2017,24
The p53 isoform delta133p53ß regulates cancer cell apoptosis in a RhoB-dependent manner,"Nikola Arsic, Alexandre Ho-Pun-Cheung, Crapez Evelyne, Eric Assenat, Marta Jarlier, Christelle Anguille, Manon Colard, Mikaël Pezet, Pierre Roux, Gilles Gadea",2017,13
Genetic polymorphisms and plasma levels of BCL11A contribute to the development of laryngeal squamous cell carcinoma,"Jian Zhou, Yue Yang, Duo Zhang, Liang Zhou, Lei Tao, Li-Ming Lu",2017,7
Cerebrospinal fluid biomarkers of infantile congenital hydrocephalus,"David D. Limbrick Jr., Brandon Baksh, Clinton D. Morgan, Gakwaya Habiyaremye, James P. McAllister II, Terrie E. Inder, Deanna Mercer, David M. Holtzman, Jennifer Strahle, Michael J. Wallendorf, Diego M. Morales",2017,10
A novel visual facial anxiety scale for assessing preoperative anxiety,"Xuezhao Cao, Roya Yumul, Ofelia Loani Elvir Lazo, Jeremy Friedman, Omar Durra, Xiao Zhang, Paul F. White",2017,2
Correction: Systemic Administration of Allogeneic Mesenchymal Stem Cells Does Not Halt Osteoporotic Bone Loss in Ovariectomized Rats,"Shuo Huang, Liangliang Xu, Yuxin Sun, Sien Lin, Weidong Gu, Yamei Liu, Jinfang Zhang, Lin Chen, Gang Li",2017,1
A high-throughput genetic screen identifies previously uncharacterized Borrelia burgdorferi genes important for resistance against reactive oxygen and nitrogen species,"Meghan E. Ramsey, Jenny A. Hyde, Diana N. Medina-Perez, Tao Lin, Lihui Gao, Maureen E. Lundt, Xin Li, Steven J. Norris, Jon T. Skare, Linden T. Hu",2017,16
"Efficiency of a clinical prediction model for selective rapid testing in children with pharyngitis: A prospective, multicenter study","Jérémie F. Cohen, Robert Cohen, Philippe Bidet, Annie Elbez, Corinne Levy, Patrick M. Bossuyt, Martin Chalumeau",2017,2
The burden of typhoid fever in low- and middle-income countries: A meta-regression approach,"Marina Antillón, Joshua L. Warren, Forrest W. Crawford, Daniel M. Weinberger, Esra Kürüm, Gi Deok Pak, Florian Marks, Virginia E. Pitzer",2017,97
Comparison of microbiological diagnosis of urinary tract infection in young children by routine health service laboratories and a research laboratory: Diagnostic cohort study,"Kate Birnie, Alastair D. Hay, Mandy Wootton, Robin Howe, Alasdair MacGowan, Penny Whiting, Michael Lawton, Brendan Delaney, Harriet Downing, Jan Dudley, William Hollingworth, Catherine Lisles, Paul Little, Kathryn O’Brien, Timothy Pickles, Kate Rumsby, Emma Thomas-Jones, Judith Van der Voort, Cherry-Ann Waldron, Kim Harman, Kerenza Hood, Christopher C. Butler, Jonathan A. C. Sterne",2017,4
Correction: A Source Area Approach Demonstrates Moderate Predictive Ability but Pronounced Variability of Invasive Species Traits,"Günther Klonner, Stefan Fischer, Franz Essl, Stefan Dullinger",2017,0
A comparison of Ki-67 counting methods in luminal Breast Cancer: The Average Method vs. the Hot Spot Method,"Min Hye Jang, Hyun Jung Kim, Yul Ri Chung, Yangkyu Lee, So Yeon Park",2017,23
Hospital discharge abstracts have limited accuracy in identifying occurrence of Clostridium difficile infections among hospitalized individuals with inflammatory bowel disease: A population-based study,"Harminder Singh, Zoann Nugent, B. Nancy Yu, Lisa M. Lix, Laura Targownik, Charles Bernstein",2017,8
A new explanation for unexpected evolution in body size,Loeske E. B. Kruuk,2017,5
E6 and E7 Gene Polymorphisms in Human Papillomavirus Types-58 and 33 Identified in Southwest China,"Zuyi Chen, Yaling Jing, Qiang Wen, Xianping Ding, Tao Wang, Xuemei Mu, Yuwei Chenzhang, Man Cao",2017,10
B7-H3 Augments Inflammatory Responses and Exacerbates Brain Damage via Amplifying NF-κB p65 and MAPK p38 Activation during Experimental Pneumococcal Meningitis,"Xuqin Chen, Yan Li, Siobhan Blankson, Min Liu, Danping Huang, H. Paul Redmond, Jing Huang, Jiang Huai Wang, Jian Wang",2017,8
Changes in plasma protein levels as an early indication of a bloodstream infection,"Pentti Kuusela, Mayank Saraswat, Sakari Joenväärä, Johanna Kaartinen, Asko Järvinen, Risto Renkonen",2017,13
A statistical model for monitoring shell disease in inshore lobster fisheries: A case study in Long Island Sound,"Kisei R. Tanaka, Samuel L. Belknap, Jared J. Homola, Yong Chen",2017,7
"Validation of band counts in eyestalks for the determination of age of Antarctic krill, Euphausia superba","Raouf Kilada, Christian S. Reiss, So Kawaguchi, Robert A. King, Tsuyoshi Matsuda, Taro Ichii",2017,15
SlMAPK3 enhances tolerance to tomato yellow leaf curl virus (TYLCV) by regulating salicylic acid and jasmonic acid signaling in tomato (Solanum lycopersicum),"Yunzhou Li, Lei Qin, Jingjing Zhao, Tayeb Muhammad, Hehe Cao, Hailiang Li, Yan Zhang, Yan Liang",2017,24
Can treefrog phylogeographical clades and species’ phylogenetic topologies be recovered by bioacoustical analyses?,"Lucas Rodriguez Forti, Rodrigo Lingnau, Lais Carvalho Encarnação, Jaime Bertoluci, Luís Felipe Toledo",2017,13
Optimality principles reveal a complex interplay of intermediate toxicity and kinetic efficiency in the regulation of prokaryotic metabolism,"Jan Ewald, Martin Bartl, Thomas Dandekar, Christoph Kaleta",2017,7
Designing coastal conservation to deliver ecosystem and human well-being benefits,"Gust M. Annis, Douglas R. Pearsall, Katherine J. Kahl, Erika L. Washburn, Christopher A. May, Rachael Franks Taylor, James B. Cole, David N. Ewert, Edward T. Game, Patrick J. Doran",2017,10
Barriers to early presentation and diagnosis of breast cancer among African women living in sub-Saharan Africa,"Cynthia Pomaa Akuoko, Ernestina Armah, Theresa Sarpong, Dan Yedu Quansah, Isaac Amankwaa, Daniel Boateng",2017,43
"Ecto-5' -Nucleotidase CD73 (NT5E), vitamin D receptor and FGF23 gene polymorphisms may play a role in the development of calcific uremic arteriolopathy in dialysis patients – Data from the German Calciphylaxis Registry","Hansjörg Rothe, Vincent Brandenburg, Margot Haun, Barbara Kollerits, Florian Kronenberg, Markus Ketteler, Christoph Wanner",2017,9
"Maternal psychological stress-induced developmental disability, neonatal mortality and stillbirth in the offspring of Wistar albino rats","Sakthivel Govindaraj, Annadurai Shanmuganathan, Ravindran Rajan",2017,9
Naturally-occurring changes in social-cognitive factors modify change in physical activity during early adolescence,"Rod K. Dishman, Marsha Dowda, Kerry L. McIver, Ruth P. Saunders, Russell R. Pate",2017,13
"Impact of levels of total digestible nutrients on microbiome, enzyme profile and degradation of feeds in buffalo rumen","Anju Kala, D. N. Kamra, Avinash Kumar, Neeta Agarwal, L. C. Chaudhary, C. G. Joshi",2017,16
In vivo images of the epidural space with two- and three-dimensional optical coherence tomography in a porcine model,"Wen-Chuan Kuo, Meng-Chun Kao, Mei-Yung Tsou, Chien-Kun Ting",2017,6
Synergistic interactions between phenolic compounds identified in grape pomace extract with antibiotics of different classes against Staphylococcus aureus and Escherichia coli,"Loreto Sanhueza, Ricardo Melo, Ruth Montero, Kevin Maisey, Leonora Mendoza, Marcela Wilkens",2017,46
Precision oncology: Charting a path forward to broader deployment of genomic profiling,"Alison M. Schram, Michael F. Berger, David M. Hyman",2017,10
"Cancer prevalence, incidence and mortality in people who experience incarceration in Ontario, Canada: A population-based retrospective cohort study","Fiona G. Kouyoumdjian, Lucie Pivnick, Kathryn E. McIsaac, Andrew S. Wilton, Aisha Lofters, Stephen W. Hwang",2017,6
Organ dysfunction during continuous veno-venous high cut-off hemodialysis in patients with septic acute kidney injury: A prospective observational study,"Gianluca Villa, Cosimo Chelazzi, Elena Morettini, Lucia Zamidei, Serafina Valente, A. Lucia Caldini, Giovanni Zagli, A. Raffaele De Gaudio, Stefano Romagnoli",2017,20
Correction: ATP6V1H Deficiency Impairs Bone Development through Activation of MMP9 and MMP13,"Yihan Zhang, Haigen Huang, Gexin Zhao, Tadafumi Yokoyama, Hugo Vega, Yan Huang, Raman Sood, Kevin Bishop, Valerie Maduro, John Accardi, Camilo Toro, Cornelius F. Boerkoel, Karen Lyons, William A. Gahl, Xiaohong Duan, May Christine V. Malicdan, Shuo Lin",2017,0
Resilience through adaptation,"Guus A. ten Broeke, George A. K. van Voorn, Arend Ligtenberg, Jaap Molenaar",2017,8
Mammalian enamel maturation: Crystallographic changes prior to tooth eruption,"Anna Kallistová, Ivan Horáček, Miroslav Šlouf, Roman Skála, Michaela Fridrichová",2017,8
Absence of genotoxic effects of the chalcone (E)-1-(2-hydroxyphenyl)-3-(4-methylphenyl)-prop-2-en-1-one) and its potential chemoprevention against DNA damage using in vitro and in vivo assays,"Débora Cristina da Silva Lima, Camila Regina do Vale, Jefferson Hollanda Véras, Aline Bernardes, Caridad Noda Pérez, Lee Chen-Chen",2017,5
An improved synchronous reference frame current control strategy for a photovoltaic grid-connected inverter under unbalanced and nonlinear load conditions,"Amirreza Naderipour, Abdullah Asuhaimi Mohd Zin, Mohd Hafiz Bin Habibuddin, Mohammad Reza Miveh, Josep M. Guerrero",2017,17
Use of heterologous immunoassays for quantification of serum proteins: The case of canine C-reactive protein,"Alberto Muñoz-Prieto, Asta Tvarijonaviciute, Damián Escribano, Silvia Martínez-Subiela, José J. Cerón",2017,18
"Co-emergence of multi-scale cortical activities of irregular firing, oscillations and avalanches achieves cost-efficient information capacity","Dong-Ping Yang, Hai-Jun Zhou, Changsong Zhou",2017,11
Multibacillary leprosy by population groups in Brazil: Lessons from an observational study,"Mauricio Lisboa Nobre, Ximena Illarramendi, Kathryn Margaret Dupnik, Mariana de Andrea Hacker, José Augusto da Costa Nery, Selma Maria Bezerra Jerônimo, Euzenir Nunes Sarno",2017,19
Clinical profiles of adverse drug reactions spontaneously reported at a single Korean hospital dedicated to children with complex chronic conditions,"Bomi Kim, Sunwha Zara Kim, Jin Lee, Ae Hee Jung, Sun-Hoi Jung, Hyeon-Joo Hahn, Hye Ryun Kang, Dong In Suh",2017,1
Anchorage performance of a high-pressure pre-tightening resin anchor with a compressed grouting body,"Jiansheng Tian, Li Hu",2017,0
Blastocystis subtyping and its association with intestinal parasites in children from different geographical regions of Colombia,"Juan David Ramírez, Carolina Flórez, Mario Olivera, María Consuelo Bernal, Julio Cesar Giraldo",2017,33
Mapping cerebral pulse pressure and arterial compliance over the adult lifespan with optical imaging,"Chin Hong Tan, Kathy A. Low, Tania Kong, Mark A. Fletcher, Benjamin Zimmerman, Edward L. Maclin, Antonio M. Chiarelli, Gabriele Gratton, Monica Fabiani",2017,11
The role of the two splice variants and extranuclear pathway on Ki-67 regulation in non-cancer and cancer cells,"Luca Chierico, Loris Rizzello, Lijuan Guan, Adrian Steve Joseph, Andrew Lewis, Giuseppe Battaglia",2017,10
Reliability of cortical lesion detection on double inversion recovery MRI applying the MAGNIMS-Criteria in multiple sclerosis patients within a 16-months period,"Tobias Djamsched Faizy, Christian Thaler, Tim Ceyrowski, Gabriel Broocks, Natascha Treffler, Jan Sedlacik, Klarissa Stürner, Jan-Patrick Stellmann, Christoph Heesen, Jens Fiehler, Susanne Siemonsen",2017,6
Analysis of Mycobacterium ulcerans-specific T-cell cytokines for diagnosis of Buruli ulcer disease and as potential indicator for disease progression,"Norman Nausch, Daniel Antwi-Berko, Yusif Mubarik, Kabiru Mohammed Abass, Wellington Owusu, Ellis Owusu-Dabo, Linda Batsa Debrah, Alexander Yaw Debrah, Marc Jacobsen, Richard O. Phillips",2017,6
Pathogen cross-transmission via building sanitary plumbing systems in a full scale pilot test-rig,"Michael Gormley, Thomas J. Aspray, David A. Kelly, Cristina Rodriguez-Gil",2017,17
Self-organised criticality in the evolution of a thermodynamic model of rodent thermoregulatory huddling,Stuart P. Wilson,2017,4
LuxCDE-luxAB-based promoter reporter system to monitor the Yersinia enterocolitica O:3 gene expression in vivo,"Elif Bozcal, Melih Dagdeviren, Atac Uzel, Mikael Skurnik",2017,7
Keas Perform Similarly to Chimpanzees and Elephants when Solving Collaborative Tasks,"Megan Heaney, Russell D. Gray, Alex H. Taylor",2017,17
Rational design of DKK3 structure-based small peptides as antagonists of Wnt signaling pathway and in silico evaluation of their efficiency,"Mansour Poorebrahim, Solmaz Sadeghi, Hamzeh Rahimi, Morteza Karimipoor, Kayhan Azadmanesh, Mohammad Ali Mazlomi, Ladan Teimoori-Toolabi",2017,9
The surrounding landscape influences the diversity of leaf-litter ants in riparian cloud forest remnants,"Miguel Á. García-Martínez, Jorge E. Valenzuela-González, Federico Escobar-Sarria, Fabiola López-Barrera, Gabriela Castaño-Meneses",2017,10
Mitochondrial DNA analysis of eneolithic trypillians from Ukraine reveals neolithic farming genetic roots,"Alexey G. Nikitin, Inna Potekhina, Nadin Rohland, Swapan Mallick, David Reich, Malcolm Lillie",2017,11
