title,year,citations
Rhesus macaques form preferences for brand logos through sex and social status based advertising,2018,3
A generic HTS assay for kinase screening: Validation for the isolation of an engineered malate kinase,2018,1
Physician referral patterns and racial disparities in total hip replacement: A network analysis approach,2018,11
"Enhancing healthcare accessibility measurements using GIS: A case study in Seoul, Korea",2018,8
Lung cancer and socioeconomic status in a pooled analysis of case-control studies,2018,28
Robson 10-groups classification system to access C-section in two public hospitals of the Federal District/Brazil,2018,6
A flocking algorithm for multi-agent systems with connectivity preservation under hybrid metric-topological interactions,2018,1
"Thromboelastometry profile in critically ill patients: A single-center, retrospective, observational study",2018,8
Modulation of the colon cancer cell phenotype by pro-inflammatory macrophages: A preclinical model of surgery-associated inflammation and tumor recurrence,2018,5
"Lipoproteins comprise at least 10 different classes in rats, each of which contains a unique set of proteins as the primary component",2018,2
"Preferences for HIV test characteristics among young, Black Men Who Have Sex With Men (MSM) and transgender women: Implications for consistent HIV testing",2018,10
Vasomotor and physical menopausal symptoms are associated with sleep quality,2018,10
Factors associated with occasional and recurrent falls in Mexican community-dwelling older people,2018,5
Characteristics and predictors for gastrointestinal hemorrhage among adult patients with dengue virus infection: Emphasizing the impact of existing comorbid disease(s),2018,3
"Docosahexaenoic acid for reading, working memory and behavior in UK children aged 7-9: A randomized controlled trial for replication (the DOLAB II study)",2018,5
Stigma gets in my way: Factors affecting client-provider communication regarding childbearing among people living with HIV in Uganda,2018,8
"Exposure to 1.8 GHz electromagnetic fields affects morphology, DNA-related Raman spectra and mitochondrial functions in human lympho-monocytes",2018,5
A mouse model study of toxicity and biodistribution of a replication defective adenovirus serotype 5 virus with its genome engineered to contain a decoy hyper binding site to sequester and suppress oncogenic HMGA1 as a new cancer treatment therapy,2018,6
"Karyotype evolution in Phalaris (Poaceae): The role of reductional dysploidy, polyploidy and chromosome alteration in a wide-spread and diverse genus",2018,8
Improving stability of prediction models based on correlated omics data by using network approaches,2018,1
Understanding N timing in corn yield and fertilizer N recovery: An insight from an isotopic labeled-N determination,2018,13
Functional characterization and genomic studies of a novel murine submandibular gland epithelial cell line,2018,4
Identifying potential maternal genes of Bombyx mori using digital gene expression profiling,2018,5
"Lack of infrastructure, social and cultural factors limit physical activity among patients with type 2 diabetes in rural Sri Lanka, a qualitative study",2018,4
Effect of cataract surgery on cognitive function in elderly: Results of Fujiwara-kyo Eye Study,2018,6
Imaging cellular pharmacokinetics of 18F-FDG and 6-NBDG uptake by inflammatory and stem cells,2018,0
Trend of estimated glomerular filtration rate during ombistasvir/paritaprevir/ritonavir plus dasabuvir ± ribavirin in HIV/HCV co-infected patients,2018,3
Mitochondrial DNA variants of Podolian cattle breeds testify for a dual maternal origin,2018,14
Spatial analysis of ecosystem service relationships to improve targeting of payments for hydrological services,2018,6
Outcome of Enterococcus faecalis infective endocarditis according to the length of antibiotic therapy: Preliminary data from a cohort of 78 patients,2018,11
Hemostatic findings of pleural fluid in dogs and the association between pleural effusions and primary hyperfibrino(geno)lysis: A cohort study of 99 dogs,2018,2
Phylogeography and DNA-based species delimitation provide insight into the taxonomy of the polymorphic rose chafer Protaetia (Potosia) cuprea species complex (Coleoptera: Scarabaeidae: Cetoniinae) in the Western Palearctic,2018,6
A prophylactic multivalent vaccine against different filovirus species is immunogenic and provides protection from lethal infections with Ebolavirus and Marburgvirus species in non-human primates,2018,20
Rifampicin versus streptomycin for brucellosis treatment in humans: A meta-analysis of randomized controlled trials,2018,4
Patient navigators for people with chronic disease: A systematic review,2018,45
Oncologic emergencies in a cancer center emergency department and in general emergency departments countywide and nationwide,2018,8
A phytosociological analysis and description of wetland vegetation and ecological factors associated with locations of high mortality for the 2010-11 Rift Valley fever outbreak in South Africa,2018,5
A hybrid gene selection approach to create the S1500+ targeted gene sets for use in high-throughput transcriptomics,2018,32
Videourodynamic findings of lower urinary tract dysfunctions in men with persistent storage lower urinary tract symptoms after medical treatment,2018,9
Microbial diversity and component variation in Xiaguan Tuo Tea during pile fermentation,2018,4
DNA methylation profiling of genomic DNA isolated from urine in diabetic chronic kidney disease: A pilot study,2018,5
The premammillary nucleus of the hypothalamus is not necessary for photoperiodic timekeeping in female turkeys (Meleagris gallopavo),2018,3
Perceptions on evaluative and formative functions of external supervision of Rwandan primary healthcare facilities: A qualitative study,2018,3
Prescriptive variability of drugs by general practitioners,2018,2
"Distance, accessibility and costs. Decision-making during childbirth in rural Sierra Leone: A qualitative study",2018,20
"Clinical characteristics and epidemiology of intestinal tapeworm infections over the last decade in Tokyo, Japan: A retrospective review",2018,7
Prospective evaluation of accuracy and clinical utility of the Dual Path Platform (DPP) assay for the point-of-care diagnosis of leptospirosis in hospitalized patients,2018,10
"An insight into the salivary gland and fat body transcriptome of Panstrongylus lignarius (Hemiptera: Heteroptera), the main vector of Chagas disease in Peru",2018,7
Host plant forensics and olfactory-based detection in Afro-tropical mosquito disease vectors,2018,14
Accomplishing the genotype-specific serodiagnosis of single and dual Trypanosoma cruzi infections by flow cytometry Chagas-Flow ATE-IgG2a,2018,3
The 2014–2015 Ebola virus disease outbreak and primary healthcare delivery in Liberia: Time-series analyses for 2010–2016,2018,17
Risk and surrogate benefit for pediatric Phase I trials in oncology: A systematic review with meta-analysis,2018,17
The COP9 Signalosome regulates seed germination by facilitating protein degradation of RGL2 and ABI5,2018,15
DNA damage as a consequence of NLR activation,2018,4
RNF8 and SCML2 cooperate to regulate ubiquitination and H3K27 acetylation for escape gene activation on the sex chromosomes,2018,13
The Mediator co-activator complex regulates Ty1 retromobility by controlling the balance between Ty1i and Ty1 promoters,2018,2
The INO80 chromatin remodeler sustains metabolic stability by promoting TOR signaling and regulating histone acetylation,2018,10
Exploiting the geometry of the solution space to reduce sensitivity to neuromotor noise,2018,6
"The self-organization of plant microtubules inside the cell volume yields their cortical localization, stable alignment, and sensitivity to external cues",2018,31
Prediction of infectious disease epidemics via weighted density ensembles,2018,28
Design of synthetic bacterial communities for predictable plant phenotypes,2018,56
Vocal development through morphological computation,2018,9
The novel antibiotic rhodomyrtone traps membrane proteins in vesicles with increased fluidity,2018,18
Correction: Measuring 3D Hand and Finger Kinematics—A Comparison between Inertial Sensing and an Opto-Electronic Marker System,2018,1
"Correction: Effects of Low Dose Metformin on Metabolic Traits in Clozapine-Treated Schizophrenia Patients: An Exploratory Twelve-Week Randomized, Double-Blind, Placebo-Controlled Study",2018,1
Phytoforensics: Trees as bioindicators of potential indoor exposure via vapor intrusion,2018,1
Cooperation enhanced by the coevolution of teaching activity in evolutionary prisoner's dilemma games with voluntary participation,2018,12
Late effects awareness website for pediatric survivors of acute lymphocytic leukemia,2018,0
Cas9-mediated excision of proximal DNaseI/H3K4me3 signatures confers robust silencing of microRNA and long non-coding RNA genes,2018,9
An upstream sequence modulates phenazine production at the level of transcription and translation in the biological control strain Pseudomonas chlororaphis 30-84,2018,7
Brain changes due to hypoxia during light anaesthesia can be prevented by deepening anaesthesia; a study in rats,2018,3
The effectiveness of non-surgical intervention (Foot Orthoses) for paediatric flexible pes planus: A systematic review: Update,2018,10
Expression of cell cycle regulators and frequency of TP53 mutations in high risk gastrointestinal stromal tumors prior to adjuvant imatinib treatment,2018,7
Stability lies in flowers: Plant diversification mediating shifts in arthropod food webs,2018,7
Carbon stock of Moso bamboo (Phyllostachys pubescens) forests along a latitude gradient in the subtropical region of China,2018,6
Synchronic historical patterns of species diversification in seasonal aplocheiloid killifishes of the semi-arid Brazilian Caatinga,2018,5
An artificial miRNA system reveals that relative contribution of translational inhibition to miRNA-mediated regulation depends on environmental and developmental factors in Arabidopsis thaliana,2018,6
Identification of the S-transferase like superfamily bacillithiol transferases encoded by Bacillus subtilis,2018,2
Rapid purification of giant lipid vesicles by microfiltration,2018,6
Timber isoscapes. A case study in a mountain area in the Italian Alps,2018,6
Manipulation of the rhizosphere microbial community through application of a new bio-organic fertilizer improves watermelon quality and health,2018,16
Identifying classifier input signals to predict a cross-slope during transtibial amputee walking,2018,1
To what extent do potential conservation donors value community-aspects of conservation projects in low income countries?,2018,3
Otoacoustic emissions from ears with spontaneous activity behave differently to those without: Stronger responses to tone bursts as well as to clicks,2018,2
Perceived behavioral control as a potential precursor of walking three times a week: Patient's perspectives,2018,0
The impact of “Option B” on HIV transmission from mother to child in Rwanda: An interrupted time series analysis,2018,3
"The ARID1A, p53 and ß-Catenin statuses are strong prognosticators in clear cell and endometrioid carcinoma of the ovary and the endometrium",2018,18
Awareness and attitude of the public toward personalized medicine in Korea,2018,2
Ecogeography of teosinte,2018,13
Selective identification of somatic mutations in pancreatic cancer cells through a combination of next-generation sequencing of plasma DNA using molecular barcodes and a bioinformatic variant filter,2018,5
De novo transcriptomic analysis of leaf and fruit tissue of Cornus officinalis using Illumina platform,2018,5
"Apolipoprotein E genotype does not moderate the associations of depressive symptoms, neuroticism and allostatic load with cognitive ability and cognitive aging in the Lothian Birth Cohort 1936",2018,3
Differences in neural responses to ipsilateral stimuli in wide-view fields between face- and house-selective areas,2018,1
Effects of patterned peripheral nerve stimulation on soleus spinal motor neuron excitability,2018,5
Comparative genomic analysis of the multispecies probiotic-marketed product VSL#3,2018,15
Management of post abortion complications in Botswana -The need for a standardized approach,2018,2
"Assessing site formation and assemblage integrity through stone tool refitting at Gruta da Oliveira (Almonda karst system, Torres Novas, Portugal): A Middle Paleolithic case study",2018,11
"Linkage to HIV care following diagnosis in the WHO European Region: A systematic review and meta-analysis, 2006-2017",2018,11
Environmental heterogeneity blurs the signature of dispersal syndromes on spatial patterns of woody species in a moist tropical forest,2018,3
The fruit and vegetable import pathway for potential invasive pest arrivals,2018,3
"Repeated stimulation, inter-stimulus interval and inter-electrode distance alters muscle contractile properties as measured by Tensiomyography",2018,12
Vegetative compatibility groups partition variation in the virulence of Verticillium dahliae on strawberry,2018,10
Influence of hyperbaric oxygen on biomechanics and structural bone matrix in type 1 diabetes mellitus rats,2018,7
"Association of an intact E2 gene with higher HPV viral load, higher viral oncogene expression, and improved clinical outcome in HPV16 positive head and neck squamous cell carcinoma",2018,9
Evaluating diagnostic indicators of urogenital Schistosoma haematobium infection in young women: A cross sectional study in rural South Africa,2018,6
Long-term efficacy and safety of rilpivirine plus abacavir and lamivudine in HIV-1 infected patients with undetectable viral load,2018,1
Which preferences associate with school performance?—Lessons from an exploratory study with university students,2018,4
Hypomyelinating disorders in China: The clinical and genetic heterogeneity in 119 patients,2018,8
"Population-based coverage survey results following the mass drug administration of azithromycin for the treatment of trachoma in Amhara, Ethiopia",2018,10
"Dengue knowledge, attitudes and practices and their impact on community-based vector control in rural Cambodia",2018,17
Detection of Bartonella spp. in fleas by MALDI-TOF MS,2018,13
Control fast or control smart: When should invading pathogens be controlled?,2018,17
Metabolic enzyme cost explains variable trade-offs between microbial growth rate and yield,2018,19
Trade-off between synergy and efficacy in combinations of HIV-1 latency-reversing agents,2018,6
In silico analysis of antibiotic-induced Clostridium difficile infection: Remediation techniques and biological adaptations,2018,3
A stochastic and dynamical view of pluripotency in mouse embryonic stem cells,2018,13
Integrating linear optimization with structural modeling to increase HIV neutralization breadth,2018,3
A damped oscillator imposes temporal order on posterior gap gene expression in Drosophila,2018,23
Addition of m6A to SV40 late mRNAs enhances viral structural gene expression and replication,2018,44
Murine cytomegalovirus degrades MHC class II to colonize the salivary glands,2018,11
A paralogous pair of mammalian host restriction factors form a critical host barrier against poxvirus infection,2018,13
Ebselen alleviates testicular pathology in mice with Zika virus infection and prevents its sexual transmission,2018,23
Dynamic remodeling of lipids coincides with dengue virus replication in the midgut of Aedes aegypti mosquitoes,2018,32
Regulatory T cells in retroviral infections,2018,17
"Influenza interaction with cocirculating pathogens and its impact on surveillance, pathogenesis, and epidemic profile: A key role for mathematical modelling",2018,18
Tricked or trapped—Two decoy mechanisms in host–pathogen interactions,2018,4
Correction: Generation of G protein-coupled receptor antibodies differentially sensitive to conformational states,2018,0
Correction: Perimenopause and emergence of an Alzheimer's bioenergetic phenotype in brain and periphery,2018,5
Correction: Viable adhered Staphylococcus aureus highly reduced on novel antimicrobial sutures using chlorhexidine and octenidine to avoid surgical site infection (SSI),2018,0
Correction: Hong Kong Hospital Authority resource efficiency evaluation: Via a novel DEA-Malmquist model and Tobit regression model,2018,1
Correction: Gait parameters are differently affected by concurrent smartphone-based activities with scaled levels of cognitive effort,2018,0
"Correction: Hospitalizations due to unintentional transport injuries among Aboriginal population of British Columbia, Canada: Incidence, changes over time and ecological analysis of risk markers",2018,0
Practice makes the deficiency of global motion detection in people with pattern-related visual stress more apparent,2018,1
"Climate change and the northern elephant seal (Mirounga angustirostris) population in Baja California, Mexico",2018,2
Modeling nearshore-offshore exchange in Lake Superior,2018,5
Correlates of self-harm and suicide attempts in justice-involved young people,2018,4
"Esophageal squamous cell carcinoma with low mitochondrial copy number has mesenchymal and stem-like characteristics, and contributes to poor prognosis",2018,7
Circulating small non-coding RNAs reflect IFN status and B cell hyperactivity in patients with primary Sjögren’s syndrome,2018,4
A neonatal murine model for evaluation of enterovirus E HY12 virus infection and pathogenicity,2018,4
Strain-specific quantification of root colonization by plant growth promoting rhizobacteria Bacillus firmus I-1582 and Bacillus amyloliquefaciens QST713 in non-sterile soil and field conditions,2018,34
Peptidic inhibitors of insulin-degrading enzyme with potential for dermatological applications discovered via phage display,2018,6
Modulation of neural circuits underlying temporal production by facial expressions of pain,2018,7
"Molecular epidemiology and drug sensitivity pattern of Mycobacterium tuberculosis strains isolated from pulmonary tuberculosis patients in and around Ambo Town, Central Ethiopia",2018,8
Health literacy of hospital patients using a linguistically validated Croatian version of the Newest Vital Sign screening test (NVS-HR),2018,0
Effects of voluntary running exercise on bone histology in type 2 diabetic rats,2018,0
Engineered resistance to Nosema bombycis by in vitro expression of a single-chain antibody in Sf9-III cells,2018,8
"Reduced translucency and the addition of black patterns increase the catch of the greenhouse whitefly, Trialeurodes vaporariorum, on yellow sticky traps",2018,2
Mesenchymal stem cell-derived exosomes have altered microRNA profiles and induce osteogenic differentiation depending on the stage of differentiation,2018,51
"Parents’ knowledge, beliefs, and acceptance of the HPV vaccination in relation to their socio-demographics and religious beliefs: A cross-sectional study in Thailand",2018,10
"An increasing trend of rural infections of human influenza A (H7N9) from 2013 to 2017: A retrospective analysis of patient exposure histories in Zhejiang province, China",2018,5
Insurance status and cancer treatment mediate the association between race/ethnicity and cervical cancer survival,2018,11
Relationship between serum bilirubin levels and cardiovascular disease,2018,11
Notch signaling inhibitor DAPT provides protection against acute craniocerebral injury,2018,15
Folic acid derived-P5779 mimetics regulate DAMP-mediated inflammation through disruption of HMGB1:TLR4:MD-2 axes,2018,8
The influence of a change in the meniscus cross-sectional shape on the medio-lateral translation of the knee joint and meniscal extrusion,2018,4
The time-series behavior of neutrophil-to-lymphocyte ratio is useful as a predictive marker in non-small cell lung cancer,2018,34
Selective targeting of tumor associated macrophages in different tumor models,2018,8
"Ex situ cultivation protocol for Cystoseira amentacea var. stricta (Fucales, Phaeophyceae) from a restoration perspective",2018,15
Medical professionalism of foreign-born and foreign-trained physicians under close scrutiny: A qualitative study with stakeholders in Germany,2018,5
Evidence of sex-bias in gene expression in the brain transcriptome of two populations of rainbow trout (Oncorhynchus mykiss) with divergent life histories,2018,4
A novel ligand on astrocytes interacts with natural cytotoxicity receptor NKp44 regulating immune response mediated by NK cells,2018,4
Differences between fellow eyes of acute and chronic primary angle closure (glaucoma): An ultrasound biomicroscopy quantitative study,2018,4
Gp96 deficiency affects TLR4 functionality and impairs ERK and p38 phosphorylation,2018,4
Differences in the intestinal microbiota between uninfected piglets and piglets infected with porcine epidemic diarrhea virus,2018,14
Loop diuretics are associated with greater risk of sarcopenia in patients with non-dialysis-dependent chronic kidney disease,2018,10
Correction: STING expression and response to treatment with STING ligands in premalignant and malignant disease,2018,0
B cell subset distribution is altered in patients with severe periodontitis,2018,12
"Combined impairments in vision, hearing and cognition are associated with greater levels of functional and communication difficulties than cognitive impairment alone: Analysis of interRAI data for home care and long-term care recipients in Ontario",2018,31
Explaining suicide attempt with personality traits of aggression and impulsivity in a high risk tribal population of India,2018,6
Fried food intake and risk of nonfatal acute myocardial infarction in the Costa Rica Heart Study,2018,6
Long-term use of cover crops and no-till shift soil microbial community life strategies in agricultural soil,2018,38
Influence of hiatal hernia and male sex on the relationship between alcohol intake and occurrence of Barrett’s esophagus,2018,2
Adverse obstetric outcomes during delivery hospitalizations complicated by suicidal behavior among US pregnant women,2018,10
Preparedness of lower-level health facilities and the associated factors for the outpatient primary care of hypertension: Evidence from Tanzanian national survey,2018,12
Low-back electromyography (EMG) data-driven load classification for dynamic lifting tasks,2018,3
Optimal dose reduction algorithm using an attenuation-based tube current modulation method for cone-beam CT imaging,2018,1
Progress toward national estimates of police use of force,2018,9
Pathophysiological and neurobehavioral characteristics of a propionic acid-mediated autism-like rat model,2018,27
Effect of park prescriptions with and without group visits to parks on stress reduction in low-income parents: SHINE randomized trial,2018,23
Coaxial technique-promoted diagnostic accuracy of CT-guided percutaneous cutting needle biopsy for small and deep lung lesions,2018,6
Access to health insurance coverage among sub-Saharan African migrants living in France: Results of the ANRS-PARCOURS study,2018,6
Barriers and facilitators to antiretroviral therapy adherence among Peruvian adolescents living with HIV: A qualitative study,2018,6
Optimization of prophylaxis for hemophilia A,2018,3
Low apolipoprotein A-I levels in Friedreich’s ataxia and in frataxin-deficient cells: Implications for therapy,2018,5
Demography of a forest elephant population,2018,7
Effects of breast stimulation for spontaneous onset of labor on salivary oxytocin levels in low-risk pregnant women: A feasibility study,2018,5
Functional imaging of the interaction between gut microbiota and the human host: A proof-of-concept clinical study evaluating novel use for 18F-FDG PET-CT,2018,9
Species-specific regulation of angiogenesis by glucocorticoids reveals contrasting effects on inflammatory and angiogenic pathways,2018,3
How does the interaction radius affect the performance of intervention on collective behavior?,2018,3
Delineating and identifying long-term changes in the whooping crane (Grus americana) migration corridor,2018,5
"Nitrogen isotopes suggest a change in nitrogen dynamics between the Late Pleistocene and modern time in Yukon, Canada",2018,7
Haplotype-based genome-wide association study identifies loci and candidate genes for milk yield in Holsteins,2018,10
"Kinetics of PTEN-mediated PI(3,4,5)P3 hydrolysis on solid supported membranes",2018,4
The enzymatic processing of α-dystroglycan by MMP-2 is controlled by two anchoring sites distinct from the active site,2018,1
Genome mining of Streptomyces scabrisporus NF3 reveals symbiotic features including genes related to plant interactions,2018,9
"Maternal high-fat diet associated with altered gene expression, DNA methylation, and obesity risk in mouse offspring",2018,36
Directional freezing for the cryopreservation of adherent mammalian cells on a substrate,2018,9
"Discovery of two new species of Crotalaria (Leguminosae, Crotalarieae) from Western Ghats, India",2018,5
Hydrological and biogeochemical response of the Mediterranean Sea to freshwater flow changes for the end of the 21st century,2018,5
The impact of EGFR mutations on the incidence and survival of stages I to III NSCLC patients with subsequent brain metastasis,2018,13
Short-term repeated HRV-16 exposure results in an attenuated immune response in vivo in humans,2018,1
Comparative study on the mechanical mechanism of confined concrete supporting arches in underground engineering,2018,3
Development of a decision aid for cardiopulmonary resuscitation and invasive mechanical ventilation in the intensive care unit employing user-centered design and a wiki platform for rapid prototyping,2018,2
Innate immune responses following Kawasaki disease and toxic shock syndrome,2018,6
"Dynamic changes of SETD2, a histone H3K36 methyltransferase, in porcine oocytes, IVF and SCNT embryos",2018,1
The quality of instruments to assess the process of shared decision making: A systematic review,2018,49
