title,year,citations
Tissue Specific Expression of Cre in Rat Tyrosine Hydroxylase and Dopamine Active Transporter-Positive Neurons,2016,9
Non-Oxygenated Sesquiterpenes in the Essential Oil of Copaifera langsdorffii Desf. Increase during the Day in the Dry Season,2016,19
Contrasting Inducible Knockdown of the Auxiliary PTEX Component PTEX88 in P. falciparum and P. berghei Unmasks a Role in Parasite Virulence,2016,16
Does the Establishment of Sustainable Use Reserves Affect Fire Management in the Humid Tropics?,2016,6
Urinary Dysfunction in Progressive Supranuclear Palsy Compared with Other Parkinsonian Disorders,2016,9
The Tocotrienol-Rich Fraction Is Superior to Tocopherol in Promoting Myogenic Differentiation in the Prevention of Replicative Senescence of Myoblasts,2016,21
Importance of Central Retinal Sensitivity for Prediction of Visual Acuity after Intravitreal Bevacizumb in Eyes with Macular Edema Associated with Branch Retinal Vein Occlusion,2016,3
Safety and Efficacy of 5-Aminolevulinic Acid for High Grade Glioma in Usual Clinical Practice: A Prospective Cohort Study,2016,34
"Addition of Phenylboronic Acid to Malus domestica Pollen Tubes Alters Calcium Dynamics, Disrupts Actin Filaments and Affects Cell Wall Architecture",2016,7
Comprehensive Expression Profiling and Functional Network Analysis of p53-Regulated MicroRNAs in HepG2 Cells Treated with Doxorubicin,2016,13
Enhancing the Thermostability of Serratia plymuthica Sucrose Isomerase Using B-Factor-Directed Mutagenesis,2016,18
Cytoskeletal Linker Protein Dystonin Is Not Critical to Terminal Oligodendrocyte Differentiation or CNS Myelination,2016,5
"CDK13, a Kinase Involved in Pre-mRNA Splicing, Is a Component of the Perinucleolar Compartment",2016,8
Single Gene Prognostic Biomarkers in Ovarian Cancer: A Meta-Analysis,2016,48
Involvement of a Novel Class C Beta-Lactamase in the Transglutaminase Mediated Cross-Linking Cascade of Streptomyces mobaraensis DSM 40847,2016,6
p-Curve and p-Hacking in Observational Research,2016,65
Endurance Exercise Enhances the Effect of Strength Training on Muscle Fiber Size and Protein Expression of Akt and mTOR,2016,24
The Ratio of ADP- to TRAP-Induced Platelet Aggregation Quantifies P2Y12-Dependent Platelet Inhibition Independently of the Platelet Count,2016,4
Evidences of Changes in Surface Electrostatic Charge Distribution during Stabilization of HPV16 Virus-Like Particles,2016,5
Genome-Wide De Novo Prediction of Cis-Regulatory Binding Sites in Mycobacterium tuberculosis H37Rv,2016,3
Plaque Size Is Decreased but M1 Macrophage Polarization and Rupture Related Metalloproteinase Expression Are Maintained after Deleting T-Bet in ApoE Null Mice,2016,4
"Functional and Structural Analysis of a β-Glucosidase Involved in β-1,2-Glucan Metabolism in Listeria innocua",2016,21
Impact of a Probiotic-Based Cleaning Intervention on the Microbiota Ecosystem of the Hospital Surfaces: Focus on the Resistome Remodulation,2016,40
Evolution of a Planktonic Foraminifer during Environmental Changes in the Tropical Oceans,2016,5
The Effects of Classroom Interventions on Off-Task and Disruptive Classroom Behavior in Children with Symptoms of Attention-Deficit/Hyperactivity Disorder: A Meta-Analytic Review,2016,18
"Temperature Insensitivity and Behavioural Reduction of the Physiological Stress Response to Longline Capture by the Gummy Shark, Mustelus antarcticus",2016,14
Estrogen Deficiency Leads to Further Bone Loss in the Mandible of CKD Mice,2016,7
Unrecognized Myocardial Infarction Assessed by Cardiac Magnetic Resonance Imaging – Prognostic Implications,2016,7
Ultrasound Assisted Extraction of Phenolic Compounds from Peaches and Pumpkins,2016,57
Multivessel versus Single Vessel Angioplasty in Non-ST Elevation Acute Coronary Syndromes: A Systematic Review and Metaanalysis,2016,10
Naturally-Acquired Immune Response against Plasmodium vivax Rhoptry-Associated Membrane Antigen,2016,8
Hepatitis C Virus Activates a Neuregulin-Driven Circuit to Modify Surface Expression of Growth Factor Receptors of the ErbB Family,2016,5
Development of Bifunctional Gadolinium-Labeled Superparamagnetic Nanoparticles (Gd-MnMEIO) for In Vivo MR Imaging of the Liver in an Animal Model,2016,6
"Tetra-O-Methyl Nordihydroguaiaretic Acid Broadly Suppresses Cancer Metabolism and Synergistically Induces Strong Anticancer Activity in Combination with Etoposide, Rapamycin and UCN-01",2016,13
Voting Intention and Choices: Are Voters Always Rational and Deliberative?,2016,2
"Inducible Defenses with a ""Twist"": Daphnia barbata Abandons Bilateral Symmetry in Response to an Ancient Predator",2016,17
Staying Connected on the Road: A Comparison of Different Types of Smart Phone Use in a Driving Simulator,2016,9
"The High Cost of HIV-Positive Inpatient Care at an Urban Hospital in Johannesburg, South Africa",2016,14
Association between the Severity of Influenza A(H7N9) Virus Infections and Length of the Incubation Period,2016,11
Functional Characterization of the Tau Class Glutathione-S-Transferases Gene (SbGSTU) Promoter of Salicornia brachiata under Salinity and Osmotic Stress,2016,39
"Comparative Analysis of Protocols to Induce Human CD4+Foxp3+ Regulatory T Cells by Combinations of IL-2, TGF-beta, Retinoic Acid, Rapamycin and Butyrate",2016,56
Is Toxoplasma Gondii Infection Related to Brain and Behavior Impairments in Humans? Evidence from a Population-Representative Birth Cohort,2016,73
Hepatitis E Virus Genotype 3 in Colombia: Survey in Patients with Clinical Diagnosis of Viral Hepatitis,2016,9
Are Diet Preferences Associated to Skulls Shape Diversification in Xenodontine Snakes?,2016,22
The Mutational Landscape of Acute Promyelocytic Leukemia Reveals an Interacting Network of Co-Occurrences and Recurrent Mutations,2016,18
"A New Fishfly Species (Megaloptera: Corydalidae: Neohermes Banks) Discovered from North America by a Systematic Revision, with Phylogenetic and Biogeographic Implications",2016,0
Chromoendoscopy with a Standard-Resolution Colonoscope for Evaluation of Rectal Aberrant Crypt Foci,2016,6
Blinded by Beauty: Attractiveness Bias and Accurate Perceptions of Academic Performance,2016,30
Biodeterioration Risk Threatens the 3100 Year Old Staircase of Hallstatt (Austria): Possible Involvement of Halophilic Microorganisms,2016,18
"Eight New Species of Charinus Simon, 1892 (Arachnida: Amblypygi: Charinidae) Endemic for the Brazilian Amazon, with Notes on Their Conservational Status",2016,16
A Finite Element Model Approach to Determine the Influence of Electrode Design and Muscle Architecture on Myoelectric Signal Properties,2016,4
Parameter Estimation in Stratified Cluster Sampling under Randomized Response Models for Sensitive Question Survey,2016,3
Open Access Meets Discoverability: Citations to Articles Posted to Academia.edu,2016,59
Mathematical Model of the Firefly Luciferase Complementation Assay Reveals a Non-Linear Relationship between the Detected Luminescence and the Affinity of the Protein Pair Being Analyzed,2016,3
In Vivo versus Augmented Reality Exposure in the Treatment of Small Animal Phobia: A Randomized Controlled Trial,2016,30
The Effects of 52 Weeks of Soccer or Resistance Training on Body Composition and Muscle Function in +65-Year-Old Healthy Males – A Randomized Controlled Trial,2016,17
"Population Recovery of Nicobar Long-Tailed Macaque Macaca fascicularis umbrosus following a Tsunami in the Nicobar Islands, India",2016,10
Individual Differences in Scotopic Visual Acuity and Contrast Sensitivity: Genetic and Non-Genetic Influences,2016,11
Clinical Impact of a Novel MicroRNA Chemo-Sensitivity Predictor in Gastrooesophageal Cancer,2016,5
Altered Cortico-Striatal Connectivity in Offspring of Schizophrenia Patients Relative to Offspring of Bipolar Patients and Controls,2016,17
Activation of the Nrf2 Cell Defense Pathway by Ancient Foods: Disease Prevention by Important Molecules and Microbes Lost from the Modern Western Diet,2016,39
Radiative Peristaltic Flow of Jeffrey Nanofluid with Slip Conditions and Joule Heating,2016,21
Net Effects of Ecotourism on Threatened Species Survival,2016,42
Why Do Floral Perfumes Become Different? Region-Specific Selection on Floral Scent in a Terrestrial Orchid,2016,33
"Water, Water, Everywhere: Defining and Assessing Data Sharing in Academia",2016,27
Association of Genotyping of Bacillus cereus with Clinical Features of Post-Traumatic Endophthalmitis,2016,2
Carcass Type Affects Local Scavenger Guilds More than Habitat Connectivity,2016,28
Fat King Penguins Are Less Steady on Their Feet,2016,2
"The ""Majority Illusion"" in Social Networks",2016,53
Object Recognition in Flight: How Do Bees Distinguish between 3D Shapes?,2016,5
Rapid Discovery and Functional Characterization of Terpene Synthases from Four Endophytic Xylariaceae,2016,14
"Proteinaceous Pheromone Homologs Identified from the Cloacal Gland Transcriptome of a Male Axolotl, Ambystoma mexicanum",2016,3
Comprehensive Map of Molecules Implicated in Obesity,2016,8
Parental Perception of Weight Status: Influence on Children’s Diet in the Gateshead Millennium Study,2016,21
Effect of Imaging Parameter Thresholds on MRI Prediction of Neoadjuvant Chemotherapy Response in Breast Cancer Subtypes,2016,8
Vaccination with Replication Deficient Adenovectors Encoding YF-17D Antigens Induces Long-Lasting Protection from Severe Yellow Fever Virus Infection in Mice,2016,13
Genome-Wide Comparative Analysis of Chemosensory Gene Families in Five Tsetse Fly Species,2016,17
Embryonic Stem Cell (ES)-Specific Enhancers Specify the Expression Potential of ES Genes in Cancer,2016,2
A Guide to Scientific Crowdfunding,2016,29
Correction: Arsenic Trioxide Sensitizes Glioblastoma to a Myc Inhibitor,2016,0
Attentional and Contextual Priors in Sound Perception,2016,2
Performance of Spot Photoscreener in Detecting Amblyopia Risk Factors in Chinese Pre-school and School Age Children Attending an Eye Clinic,2016,19
"The Impact of Third-Party Information on Trust: Valence, Source, and Reliability",2016,4
The BCL2 -938C>A Promoter Polymorphism Is Associated with Risk for and Time to Aseptic Loosening of Total Hip Arthroplasty,2016,6
"Octopus vulgaris (Cuvier, 1797) in the Mediterranean Sea: Genetic Diversity and Population Structure",2016,15
Influence of Landscape Diversity and Composition on the Parasitism of Cotton Bollworm Eggs in Maize,2016,5
Effect of Serum Cholesterol on Insulin Secretory Capacity: Shimane CoHRE Study,2016,3
"Disparities in Prevalence of Cardiometablic Risk Factors in Rural, Urban-Poor, and Urban-Middle Class Women in India",2016,19
Effect of Stem Cell Therapy on Bone Mineral Density: A Meta-Analysis of Preclinical Studies in Animal Models of Osteoporosis,2016,17
Simultaneous Assessment of Acidogenesis-Mitigation and Specific Bacterial Growth-Inhibition by Dentifrices,2016,2
Structure of a Bacterial Virus DNA-Injection Protein Complex Reveals a Decameric Assembly with a Constricted Molecular Channel,2016,12
Associations between Single-Nucleotide Polymorphisms in Corticotropin-Releasing Hormone-Related Genes and Irritable Bowel Syndrome,2016,8
Identification and Actions of a Novel Third Maresin Conjugate in Tissue Regeneration: MCTR3,2016,32
A Systems Biology Approach to the Coordination of Defensive and Offensive Molecular Mechanisms in the Innate and Adaptive Host–Pathogen Interaction Networks,2016,7
Physiological and Transcriptome Responses to Combinations of Elevated CO2 and Magnesium in Arabidopsis thaliana,2016,13
CD10-Equipped Melanoma Cells Acquire Highly Potent Tumorigenic Activity: A Plausible Explanation of Their Significance for a Poor Prognosis,2016,4
Evaluating Functional Diversity: Missing Trait Data and the Importance of Species Abundance Structure and Data Transformation,2016,46
Release of Matrix Metalloproteinases-2 and 9 by S-Nitrosylated Caveolin-1 Contributes to Degradation of Extracellular Matrix in tPA-Treated Hypoxic Endothelial Cells,2016,13
Phe362Tyr in AChE: A Major Factor Responsible for Azamethiphos Resistance in Lepeophtheirus salmonis in Norway,2016,15
ZBIT Bioinformatics Toolbox: A Web-Platform for Systems Biology and Expression Data Analysis,2016,4
Modelling Visual Change Detection and Identification under Free Viewing Conditions,2016,1
Metabolic Syndrome in South African Patients with Severe Mental Illness: Prevalence and Associated Risk Factors,2016,16
Impacts on Sirtuin Function and Bioavailability of the Dietary Bioactive Compound Dihydrocoumarin,2016,3
Alk7 Depleted Mice Exhibit Prolonged Cardiac Repolarization and Are Predisposed to Ventricular Arrhythmia,2016,4
Health Literacy Measure for Adolescents (HELMA): Development and Psychometric Properties,2016,26
"Tuberculosis Mortality and Living Conditions in Bern, Switzerland, 1856-1950",2016,6
Kinome Profiling of Regulatory T Cells: A Closer Look into a Complex Intracellular Network,2016,4
Survey of the Influence of the Width of Urban Branch Roads on the Meeting of Two-Way Vehicle Flows,2016,1
Interaction Analysis of a Two-Component System Using Nanodiscs,2016,8
Jagn1 Is Induced in Response to ER Stress and Regulates Proinsulin Biosynthesis,2016,4
Inter-Protein Sequence Co-Evolution Predicts Known Physical Interactions in Bacterial Ribosomes and the Trp Operon,2016,28
The Inhibitory Effect of Natural Products on Protein Fibrillation May Be Caused by Degradation Products – A Study Using Aloin and Insulin,2016,3
Clinical Relevance of VPAC1 Receptor Expression in Early Arthritis: Association with IL-6 and Disease Activity,2016,9
Centromere Protein (CENP)-W Interacts with Heterogeneous Nuclear Ribonucleoprotein (hnRNP) U and May Contribute to Kinetochore-Microtubule Attachment in Mitotic Cells,2016,11
Characterization of a Decapentapletic Gene (AccDpp) from Apis cerana cerana and Its Possible Involvement in Development and Response to Oxidative Stress,2016,4
Interocular Difference of Peripheral Refraction in Anisomyopic Eyes of Schoolchildren,2016,3
CDK1 Is a Synthetic Lethal Target for KRAS Mutant Tumours,2016,35
Anthocyanins in Strawberry Polyphenolic Extract Enhance the Beneficial Effects of Diets with Fructooligosaccharides in the Rat Cecal Environment,2016,28
Development of a Xeno-Free Feeder-Layer System from Human Umbilical Cord Mesenchymal Stem Cells for Prolonged Expansion of Human Induced Pluripotent Stem Cells in Culture,2016,5
"Adverse Trends in Ischemic Heart Disease Mortality among Young New Yorkers, Particularly Young Black Women",2016,4
Multiple I-Type Lysozymes in the Hydrothermal Vent Mussel Bathymodiolus azoricus and Their Role in Symbiotic Plasticity,2016,9
De Novo Transcriptome Assembly and Characterization for the Widespread and Stress-Tolerant Conifer Platycladus orientalis,2016,21
Linking Genetic Variation in Adaptive Plant Traits to Climate in Tetraploid and Octoploid Basin Wildrye [Leymus cinereus (Scribn. & Merr.) A. Love] in the Western U.S.,2016,7
"The Cytolytic Amphipathic β(2,2)-Amino Acid LTX-401 Induces DAMP Release in Melanoma Cells and Causes Complete Regression of B16 Melanoma",2016,11
Caregivers’ Attitudes towards HIV Testing and Disclosure of HIV Status to At-Risk Children in Rural Uganda,2016,8
Adaptive Control of Exoskeleton Robots for Periodic Assistive Behaviours Based on EMG Feedback Minimisation,2016,67
Preserving a Comprehensive Vegetation Knowledge Base – An Evaluation of Four Historical Soviet Vegetation Maps of the Western Pamirs (Tajikistan),2016,5
Ambulatory Blood Pressure Monitoring in Individuals with HIV: A Systematic Review and Meta-Analysis,2016,12
Simulation of Daily Snapshot Rhythm Monitoring to Identify Atrial Fibrillation in Continuously Monitored Patients with Stroke Risk Factors,2016,6
SULF2 Expression Is a Potential Diagnostic and Prognostic Marker in Lung Cancer,2016,8
"Clinical Efficacy of Therapy with Recombinant Human Interferon α1b in Hand, Foot, and Mouth Disease with Enterovirus 71 Infection",2016,10
Comparative Analysis of Lacinutrix Genomes and Their Association with Bacterial Habitat,2016,0
Analysis of Plasma Cytokine and Chemokine Profiles in Patients with and without Tuberculosis by Liquid Array-Based Multiplexed Immunoassays,2016,12
AAV-Mediated Clarin-1 Expression in the Mouse Retina: Implications for USH3A Gene Therapy,2016,5
Integrative Analysis of the Physical Transport Network into Australia,2016,9
Assessing Discriminative Performance at External Validation of Clinical Prediction Models,2016,16
A Robust and Accurate Two-Step Auto-Labeling Conditional Iterative Closest Points (TACICP) Algorithm for Three-Dimensional Multi-Modal Carotid Image Registration,2016,7
ZEB1 Upregulates VEGF Expression and Stimulates Angiogenesis in Breast Cancer,2016,29
Examining Associations between Health Information Seeking Behavior and Adult Education Status in the U.S.: An Analysis of the 2012 PIAAC Data,2016,22
MENGA: A New Comprehensive Tool for the Integration of Neuroimaging Data and the Allen Human Brain Transcriptome Atlas,2016,22
"Drone and Worker Brood Microclimates Are Regulated Differentially in Honey Bees, Apis mellifera",2016,9
"The Fungus Tremella mesenterica Encodes the Longest Metallothionein Currently Known: Gene, Protein and Metal Binding Characterization",2016,12
Peripheral Attentional Targets under Covert Attention Lead to Paradoxically Enhanced Alpha Desynchronization in Neurofibromatosis Type 1,2016,4
Age-Associated Lipidome Changes in Metaphase II Mouse Oocytes,2016,13
Sonographic and Clinical Features of Papillary Thyroid Microcarcinoma Less than or Equal to Five Millimeters: A Retrospective Study,2016,7
Developmental Eye Movement (DEM) Test Norms for Mandarin Chinese-Speaking Chinese Children,2016,4
Microbial Community Profile and Water Quality in a Protected Area of the Caatinga Biome,2016,12
Worldwide Alien Invasion: A Methodological Approach to Forecast the Potential Spread of a Highly Invasive Pollinator,2016,19
Odontogenic Differentiation of Human Dental Pulp Stem Cells on Hydrogel Scaffolds Derived from Decellularized Bone Extracellular Matrix and Collagen Type I,2016,69
Preparation and Characterization of Biochars from Eichornia crassipes for Cadmium Removal in Aqueous Solutions,2016,54
Up-Regulation of ENO1 by HIF-1α in Retinal Pigment Epithelial Cells after Hypoxic Challenge Is Not Involved in the Regulation of VEGF Secretion,2016,4
"The Prevalence and Determinants of Chronic Non-Communicable Disease Risk Factors amongst Adults in the Dikgale Health Demographic and Surveillance System (HDSS) Site, Limpopo Province of South Africa",2016,41
Red Blood Cell Fatty Acids and Incident Diabetes Mellitus in the Women’s Health Initiative Memory Study,2016,19
Low Interferon Relative-Response to Cytomegalovirus Is Associated with Low Likelihood of Intrauterine Transmission of the Virus,2016,8
Altered Energetics of Exercise Explain Risk of Rhabdomyolysis in Very Long-Chain Acyl-CoA Dehydrogenase Deficiency,2016,20
Hepatoprotective Effect and Synergism of Bisdemethoycurcumin against MCD Diet-Induced Nonalcoholic Fatty Liver Disease in Mice,2016,11
"Chimeric Vaccine Stimulation of Human Dendritic Cell Indoleamine 2, 3-Dioxygenase Occurs via the Non-Canonical NF-κB Pathway",2016,11
Perception of Graphical Virtual Environments by Blind Users via Sensory Substitution,2016,23
3D Reconstruction of Coronary Artery Vascular Smooth Muscle Cells,2016,5
A Finger-Stick Whole-Blood HIV Self-Test as an HIV Screening Tool Adapted to the General Public,2016,23
Exposure to Pre- and Perinatal Risk Factors Partially Explains Mean Differences in Self-Regulation between Races,2016,9
"Efficacy and Safety of Pafuramidine versus Pentamidine Maleate for Treatment of First Stage Sleeping Sickness in a Randomized, Comparator-Controlled, International Phase 3 Clinical Trial",2016,21
"Efficacy, Safety, and Dose of Pafuramidine, a New Oral Drug for Treatment of First Stage Sleeping Sickness, in a Phase 2a Clinical Study and Phase 2b Randomized Clinical Studies",2016,10
Speckle Tracking Based Strain Analysis Is Sensitive for Early Detection of Pathological Cardiac Hypertrophy,2016,8
A Generic Mechanism for Enhanced Cytokine Signaling via Cytokine-Neutralizing Antibodies,2016,4
A Rapid and Low-Cost PCR Thermal Cycler for Infectious Disease Diagnostics,2016,22
Thrombin Generation in Zebrafish Blood,2016,6
Do Not Divide Count Data with Count Data; A Story from Pollination Ecology with Implications Beyond,2016,16
High-Throughput Sequencing Identifies MicroRNAs from Posterior Intestine of Loach (Misgurnus anguillicaudatus) and Their Response to Intestinal Air-Breathing Inhibition,2016,10
Integration of Stem Cell to Chondrocyte-Derived Cartilage Matrix in Healthy and Osteoarthritic States in the Presence of Hydroxyapatite Nanoparticles,2016,6
Arterial Spin Labeling Perfusion Study in the Patients with Subacute Mild Traumatic Brain Injury,2016,22
Mucorales-Specific T Cells in Patients with Hematologic Malignancies,2016,16
Experimental Study of the Bending Properties and Deformation Analysis of Web-Reinforced Composite Sandwich Floor Slabs with Four Simply Supported Edges,2016,4
Muscle Logic: New Knowledge Resource for Anatomy Enables Comprehensive Searches of the Literature on the Feeding Muscles of Mammals,2016,4
"Comparison of Active Drug Concentrations in the Pulmonary Epithelial Lining Fluid and Interstitial Fluid of Calves Injected with Enrofloxacin, Florfenicol, Ceftiofur, or Tulathromycin",2016,17
Kinetics of Indigenous Nitrate Reducing Sulfide Oxidizing Activity in Microaerophilic Wastewater Biofilms,2016,1
Metagenomic Sequencing of the Chronic Obstructive Pulmonary Disease Upper Bronchial Tract Microbiome Reveals Functional Changes Associated with Disease Severity,2016,27
D-Alanylation of Teichoic Acids and Loss of Poly-N-Acetyl Glucosamine in Staphylococcus aureus during Exponential Growth Phase Enhance IL-12 Production in Murine Dendritic Cells,2016,6
miRNA Repertoires of Demosponges Stylissa carteri and Xestospongia testudinaria,2016,6
Aluminium Accumulation and Intra-Tree Distribution Patterns in Three Arbor aluminosa (Symplocos) Species from Central Sulawesi,2016,13
"Mortality and Morbidity of Urban Road Traffic Crashes in Africa: Capture-Recapture Estimates in Bamako, Mali, 2012",2016,13
Hepatitis C Virus Resistance to Carbohydrate-Binding Agents,2016,5
Charged Molecules Modulate the Volume Exclusion Effects Exerted by Crowders on FtsZ Polymerization,2016,11
Prefrontal Lobe Brain Reserve Capacity with Resistance to Higher Global Amyloid Load and White Matter Hyperintensity Burden in Mild Stage Alzheimer’s Disease,2016,5
Gene Regulatory Network Inference of Immunoresponsive Gene 1 (IRG1) Identifies Interferon Regulatory Factor 1 (IRF1) as Its Transcriptional Regulator in Mammalian Macrophages,2016,32
Optimising EEG-fMRI for Localisation of Focal Epilepsy in Children,2016,14
UBA5 Mutations Cause a New Form of Autosomal Recessive Cerebellar Ataxia,2016,27
"Decreased TUSC3 Promotes Pancreatic Cancer Proliferation, Invasion and Metastasis",2016,18
Genome-Wide Diversity and Phylogeography of Mycobacterium avium subsp. paratuberculosis in Canadian Dairy Cattle,2016,12
Cisplatin-Induced Non-Oliguric Acute Kidney Injury in a Pediatric Experimental Animal Model in Piglets,2016,2
Quantitative Proteomics of the Infectious and Replicative Forms of Chlamydia trachomatis,2016,19
EPICE-HIV: An Epidemiologic Cost-Effectiveness Model for HIV Treatment,2016,2
Age Related Bioenergetics Profiles in Isolated Rat Cardiomyocytes Using Extracellular Flux Analyses,2016,16
CTGF/CCN2 Postconditioning Increases Tolerance of Murine Hearts towards Ischemia-Reperfusion Injury,2016,2
A Feature Selection Algorithm to Compute Gene Centric Methylation from Probe Level Methylation Data,2016,16
Genome-Wide DNA Copy Number Analysis of Acute Lymphoblastic Leukemia Identifies New Genetic Markers Associated with Clinical Outcome,2016,22
Predicting Where a Radiation Will Occur: Acoustic and Molecular Surveys Reveal Overlooked Diversity in Indian Ocean Island Crickets (Mogoplistinae: Ornebius),2016,4
The Impact of HIV Co-Infection on the Genomic Response to Sepsis,2016,3
Regulation of α-Transducin and α-Gustducin Expression by a High Protein Diet in the Pig Gastrointestinal Tract,2016,8
"Omnivory of an Insular Lizard: Sources of Variation in the Diet of Podarcis lilfordi (Squamata, Lacertidae)",2016,13
Intra-Aortic Balloon Pump Counterpulsation during Primary Percutaneous Coronary Intervention for ST-Elevation Myocardial Infarction and Cardiogenic Shock: Insights from the British Columbia Cardiac Registry,2016,13
The Impact of Hyperthermia on Receptor-Mediated Interleukin-6 Regulation in Mouse Skeletal Muscle,2016,11
Effectiveness of Ritonavir-Boosted Protease Inhibitor Monotherapy in Clinical Practice Even with Previous Virological Failures to Protease Inhibitor-Based Regimens,2016,15
Increased Frequency of T Follicular Helper Cells and Elevated Interleukin-27 Plasma Levels in Patients with Pemphigus,2016,23
Engineered Promoters for Potent Transient Overexpression,2016,12
"Understanding HIV Risk Behavior among Tuberculosis Patients with Alcohol Use Disorders in Tomsk, Russian Federation",2016,5
Reduction of Genetic Diversity of the Harpy Eagle in Brazilian Tropical Forests,2016,9
Routine Primary Prophylaxis for Febrile Neutropenia with Biosimilar Granulocyte Colony-Stimulating Factor (Nivestim) or Pegfilgrastim Is Cost Effective in Non-Hodgkin Lymphoma Patients undergoing Curative-Intent R-CHOP Chemotherapy,2016,2
Nest Material Shapes Eggs Bacterial Environment,2016,25
"Association of PON1, P2Y12 and COX1 with Recurrent Ischemic Events in Patients with Extracranial or Intracranial Stenting",2016,23
Holistic Evaluation of Quality Consistency of Ixeris sonchifolia (Bunge) Hance Injectables by Quantitative Fingerprinting in Combination with Antioxidant Activity and Chemometric Methods,2016,19
The Role of Endothelin System in Renal Structure and Function during the Postnatal Development of the Rat Kidney,2016,2
