title,year,citations
Anatomical Grading for Metabolic Activity of Brown Adipose Tissue,2016,13
Assessment of Vascularity in Hepatic Alveolar Echinococcosis: Comparison of Quantified Dual-Energy CT with Histopathologic Parameters,2016,5
The Impacts of Inclusion in Clinical Trials on Outcomes among Patients with Metastatic Breast Cancer (MBC),2016,3
Effects of Hospital Workers’ Friendship Networks on Job Stress,2016,3
Apolipoprotein(a) Kringle-IV Type 2 Copy Number Variation Is Associated with Venous Thromboembolism,2016,13
Applicability and Efficiency of NGS in Routine Diagnosis: In-Depth Performance Analysis of a Complete Workflow for CFTR Mutation Analysis,2016,8
Cell Treatment for Stroke in Type Two Diabetic Rats Improves Vascular Permeability Measured by MRI,2016,6
Bcl6 Is Required for Somatic Hypermutation and Gene Conversion in Chicken DT40 Cells,2016,4
Transcriptional Auto-Regulation of RUNX1 P1 Promoter,2016,11
Sediment Burial Intolerance of Marine Macroinvertebrates,2016,10
Inferring Stop-Locations from WiFi,2016,9
Characterization and Predictive Value of Near Infrared 2-Deoxyglucose Optical Imaging in Severe Acute Pancreatitis,2016,7
Systematic Review of Methods in Low-Consensus Fields: Supporting Commensuration through `Construct-Centered Methods Aggregation’ in the Case of Climate Change Vulnerability Research,2016,5
"Polyunsaturated Fatty Acids Attenuate Diet Induced Obesity and Insulin Resistance, Modulating Mitochondrial Respiratory Uncoupling in Rat Skeletal Muscle",2016,40
Intermuscular Coherence in Normal Adults: Variability and Changes with Age,2016,21
The Prevalence of Metabolic Syndrome Using Three Different Diagnostic Criteria among Low Earning Nomadic Kazakhs in the Far Northwest of China: New Cut-Off Points of Waist Circumference to Diagnose MetS and Its Implications,2016,5
Short Meditation Trainings Enhance Non-REM Sleep Low-Frequency Oscillations,2016,18
Learning of Precise Spike Times with Homeostatic Membrane Potential Dependent Synaptic Plasticity,2016,11
"The Factors Related to CD4+ T-Cell Recovery and Viral Suppression in Patients Who Have Low CD4+ T Cell Counts at the Initiation of HAART: A Retrospective Study of the National HIV Treatment Sub-Database of Zhejiang Province, China, 2014",2016,9
Computing Molecular Devices in L.major through Transcriptome Analysis: Structured Simulation Approach,2016,1
PRMT5-Mediated Methylation of NF-κB p65 at Arg174 Is Required for Endothelial CXCL11 Gene Induction in Response to TNF-α and IFN-γ Costimulation,2016,10
On the Kaolinite Floc Size at the Steady State of Flocculation in a Turbulent Flow,2016,9
The Efficient Coding of Speech: Cross-Linguistic Differences,2016,7
Cortical Reorganisation during a 30-Week Tinnitus Treatment Program,2016,3
miRNA-221-3p Enhances the Secretion of Interleukin-4 in Mast Cells through the Phosphatase and Tensin Homolog/p38/Nuclear Factor-kappaB Pathway,2016,23
Vital Sign Prediction of Adverse Maternal Outcomes in Women with Hypovolemic Shock: The Role of Shock Index,2016,43
The Brain Network of Naming: A Lesson from Primary Progressive Aphasia,2016,24
The Patient-Provider Relationship Is Associated with Hepatitis C Treatment Eligibility: A Prospective Mixed-Methods Cohort Study,2016,10
Complete Genome Sequence and Comparative Genomics of a Novel Myxobacterium Myxococcus hansupus,2016,17
"Identification of an HIV-1 BG Intersubtype Recombinant Form (CRF73_BG), Partially Related to CRF14_BG, Which Is Circulating in Portugal and Spain",2016,8
Risk Factors and Post-Resection Independent Predictive Score for the Recurrence of Hepatitis B-Related Hepatocellular Carcinoma,2016,14
Synthetic Transcription Amplifier System for Orthogonal Control of Gene Expression in Saccharomyces cerevisiae,2016,16
"Insulin-Like Growth Factors Are Expressed in the Taste System, but Do Not Maintain Adult Taste Buds",2016,7
Neuroprotective Effect of a DJ-1 Based Peptide in a Toxin Induced Mouse Model of Multiple System Atrophy,2016,5
The Oropharyngeal Airway in Young Adults with Skeletal Class II and Class III Deformities: A 3-D Morphometric Analysis,2016,8
"A Comprehensive Analysis of the Phylogeny, Genomic Organization and Expression of Immunoglobulin Light Chain Genes in Alligator sinensis, an Endangered Reptile Species",2016,4
Alleles of HLA-DRB1*04 Associated with Pulmonary Tuberculosis in Amazon Brazilian Population,2016,11
Pre-Dialysis Visits to a Nephrology Department and Major Cardiovascular Events in Patients Undergoing Dialysis,2016,2
Specific Neuropilins Expression in Alveolar Macrophages among Tissue-Specific Macrophages,2016,13
Predicting Thermodynamic Properties of PBXTHs with New Quantum Topological Indexes,2016,1
"Trends in CD4 Count Testing, Retention in Pre-ART Care, and ART Initiation Rates over the First Decade of Expansion of HIV Services in Haiti",2016,15
"DNA Copy Number Aberrations, and Human Papillomavirus Status in Penile Carcinoma. Clinico-Pathological Correlations and Potential Driver Genes",2016,11
"Comparison of French and Worldwide Bacillus anthracis Strains Favors a Recent, Post-Columbian Origin of the Predominant North-American Clade",2016,16
Genome Wide Association Studies (GWAS) Identify QTL on SSC2 and SSC17 Affecting Loin Peak Shear Force in Crossbred Commercial Pigs,2016,3
Long Term Outcomes of a Geriatric Liaison Intervention in Frail Elderly Cancer Patients,2016,16
"Predicting Progression from Mild Cognitive Impairment to Alzheimer's Dementia Using Clinical, MRI, and Plasma Biomarkers via Probabilistic Pattern Classification",2016,78
"New Introductions, Spread of Existing Matrilines, and High Rates of Pyrethroid Resistance Result in Chronic Infestations of Bed Bugs (Cimex lectularius L.) in Lower-Income Housing",2016,4
A Molecular Method to Discriminate between Mass-Reared Sterile and Wild Tsetse Flies during Eradication Programmes That Have a Sterile Insect Technique Component,2016,6
Development and Evaluation of Reverse Transcription-Loop-Mediated Isothermal Amplification (RT-LAMP) Assay Coupled with a Portable Device for Rapid Diagnosis of Ebola Virus Disease in Guinea,2016,49
"Dog Demography, Animal Bite Management and Rabies Knowledge-Attitude and Practices in the Awash Basin, Eastern Ethiopia",2016,22
Seasonal Dynamics of Phlebotomine Sand Fly Species Proven Vectors of Mediterranean Leishmaniasis Caused by Leishmania infantum,2016,90
Delayed Time-to-Treatment of an Antisense Morpholino Oligomer Is Effective against Lethal Marburg Virus Infection in Cynomolgus Macaques,2016,14
Mating-Induced Transcriptome Changes in the Reproductive Tract of Female Aedes aegypti,2016,29
Correction: A Simple Auxin Transcriptional Response System Regulates Multiple Morphogenetic Processes in the Liverwort Marchantia polymorpha,2016,0
Correction: Developmental Dynamics of X-Chromosome Dosage Compensation by the DCC and H4K20me1 in C. elegans,2016,0
C-terminal Src Kinase Gates Homeostatic Synaptic Plasticity and Regulates Fasciclin II Expression at the Drosophila Neuromuscular Junction,2016,10
"Liver-Enriched Gene 1, a Glycosylated Secretory Protein, Binds to FGFR and Mediates an Anti-stress Pathway to Protect Liver Development in Zebrafish",2016,10
Identification of Novel Candidate Genes for Early-Onset Colorectal Cancer Susceptibility,2016,31
Which Genetics Variants in DNase-Seq Footprints Are More Likely to Alter Binding?,2016,27
MEF2C and EBF1 Co-regulate B Cell-Specific Transcription,2016,14
Model-Driven Understanding of Palmitoylation Dynamics: Regulated Acylation of the Endoplasmic Reticulum Chaperone Calnexin,2016,16
Non-monotonic Response to Monotonic Stimulus: Regulation of Glyoxylate Shunt Gene-Expression Dynamics in Mycobacterium tuberculosis,2016,9
Control of βAR- and N-methyl-D-aspartate (NMDA) Receptor-Dependent cAMP Dynamics in Hippocampal Neurons,2016,12
An Attention-Sensitive Memory Trace in Macaque MT Following Saccadic Eye Movements,2016,29
Tel1 and Rif2 Regulate MRX Functions in End-Tethering and Repair of DNA Double-Strand Breaks,2016,21
Dengue Virus Nonstructural Protein 5 (NS5) Assembles into a Dimer with a Unique Methyltransferase and Polymerase Interface,2016,55
Neurons are the Primary Target Cell for the Brain-Tropic Intracellular Parasite Toxoplasma gondii,2016,72
Correction: Road Traffic Injury Prevention Initiatives: A Systematic Review and Metasummary of Effectiveness in Low and Middle Income Countries,2016,2
Correction: A Proposal for a Comprehensive Grading of Parkinson's Disease Severity Combining Motor and Non-Motor Assessments: Meeting an Unmet Need,2016,2
Correction: Sampling and Complementarity Effects of Plant Diversity on Resource Use Increases the Invasion Resistance of Communities,2016,1
Correction: Wolbachia in European Populations of the Invasive Pest Drosophila suzukii: Regional Variation in Infection Frequencies,2016,2
Correction: Unilateral Left-Hand Contractions Produce Widespread Depression of Cortical Activity after Their Execution,2016,0
"Correction: Enigmatic Fossils from the Lower Carboniferous Shrimp Bed, Granton, Scotland",2016,0
"Out of Pocket Expenditure for Hospitalization among Below Poverty Line Households in District Solan, Himachal Pradesh, India, 2013",2016,5
HIV-Tat Induces the Nrf2/ARE Pathway through NMDA Receptor-Elicited Spermine Oxidase Activation in Human Neuroblastoma Cells,2016,26
Confirmatory Factor Analysis and Differential Relationships of the Two Subdomains of Negative Symptoms in Chronically Ill Psychotic Patients,2016,15
Regulation of Inflammation by IL-17A and IL-17F Modulates Non-Alcoholic Fatty Liver Disease Pathogenesis,2016,35
Locomotor Trajectories of Stroke Patients during Oriented Gait and Turning,2016,8
What Factors Are Associated with Positive Effects of Dog Ownership in Families with Children with Autism Spectrum Disorder? The Development of the Lincoln Autism Pet Dog Impact Scale,2016,10
A Stable Thoracic Hox Code and Epimorphosis Characterize Posterior Regeneration in Capitella teleta,2016,16
Antacid Use and De Novo Brain Metastases in Patients with Epidermal Growth Factor Receptor-Mutant Non-Small Cell Lung Cancer Who Were Treated Using First-Line First-Generation Epidermal Growth Factor Receptor Tyrosine Kinase Inhibitors,2016,9
The Cure Rate after Placebo or No Therapy in American Cutaneous Leishmaniasis: A Systematic Review and Meta-Analysis,2016,20
Uptake of Cervical Cancer Screening and Associated Factors among Women in Rural Uganda: A Cross Sectional Study,2016,37
The Early Worm Catches the Bird? Productivity and Patterns of Trichobilharzia szidati Cercarial Emission from Lymnaea stagnalis,2016,28
"Pimaradienoic Acid Inhibits Carrageenan-Induced Inflammatory Leukocyte Recruitment and Edema in Mice: Inhibition of Oxidative Stress, Nitric Oxide and Cytokine Production",2016,18
Validation and Assessment of Three Methods to Estimate 24-h Urinary Sodium Excretion from Spot Urine Samples in Chinese Adults,2016,44
Immunisation With Immunodominant Linear B Cell Epitopes Vaccine of Manganese Transport Protein C Confers Protection against Staphylococcus aureus Infection,2016,14
Fatigue in Multiple Sclerosis: Assessing Pontine Involvement Using Proton MR Spectroscopic Imaging,2016,10
Leaf Dynamics of Panicum maximum under Future Climatic Changes,2016,13
Two Small Molecules Block Oral Epithelial Cell Invasion by Porphyromons gingivalis,2016,8
Comparative Analysis and Identification of miRNAs and Their Target Genes Responsive to Salt Stress in Diploid and Tetraploid Paulownia fortunei Seedlings,2016,14
Association of Vitamin D Receptor Polymorphism with Susceptibility to Symptomatic Pertussis,2016,10
Coenzyme Q10 Levels Are Decreased in the Cerebellum of Multiple-System Atrophy Patients,2016,27
Reliability of Task-Based fMRI for Preoperative Planning: A Test-Retest Study in Brain Tumor Patients and Healthy Controls,2016,25
Rosiglitazone Promotes Bone Marrow Adipogenesis to Impair Myelopoiesis under Stress,2016,10
Internal Jugular Vein Cross-Sectional Area Enlargement Is Associated with Aging in Healthy Individuals,2016,12
Influence of Molecular Structure on O2-Binding Properties and Blood Circulation of Hemoglobin‒Albumin Clusters,2016,4
Retinofugal Projections from Melanopsin-Expressing Retinal Ganglion Cells Revealed by Intraocular Injections of Cre-Dependent Virus,2016,12
Measuring Progress on the Control of Porcine Reproductive and Respiratory Syndrome (PRRS) at a Regional Level: The Minnesota N212 Regional Control Project (Rcp) as a Working Example,2016,9
Identification and Validation of Housekeeping Genes for Gene Expression Analysis of Cancer Stem Cells,2016,27
"Impact of Influenza on Outpatient Visits, Hospitalizations, and Deaths by Using a Time Series Poisson Generalized Additive Model",2016,6
"Effects of GHRP-2 and Cysteamine Administration on Growth Performance, Somatotropic Axis Hormone and Muscle Protein Deposition in Yaks (Bos grunniens) with Growth Retardation",2016,9
Differential Juvenile Hormone Variations in Scale Insect Extreme Sexual Dimorphism,2016,12
Model Development for Risk Assessment of Driving on Freeway under Rainy Weather Conditions,2016,5
A Common Phenotype Polymorphism in Mammalian Brains Defined by Concomitant Production of Prolactin and Growth Hormone,2016,2
Texture Descriptors Ensembles Enable Image-Based Classification of Maturation of Human Stem Cell-Derived Retinal Pigmented Epithelium,2016,14
Next-Generation Sequencing of a Single Domain Antibody Repertoire Reveals Quality of Phage Display Selected Candidates,2016,22
Coarsened Exact Matching of Phaco-Trabectome to Trabectome in Phakic Patients: Lack of Additional Pressure Reduction from Phacoemulsification,2016,34
Responses in Micro-Mineral Metabolism in Rainbow Trout to Change in Dietary Ingredient Composition and Inclusion of a Micro-Mineral Premix,2016,11
Percutaneous Vaccination as an Effective Method of Delivery of MVA and MVA-Vectored Vaccines,2016,5
Tubo-Ovarian Abscess (with/without Pseudotumor Area) Mimicking Ovarian Malignancy: Role of Diffusion-Weighted MR Imaging with Apparent Diffusion Coefficient Values,2016,8
Focal Length Affects Depicted Shape and Perception of Facial Images,2016,25
Rotating Flow of Magnetite-Water Nanofluid over a Stretching Surface Inspired by Non-Linear Thermal Radiation,2016,52
Serum 25-Hydroxyvitamin D Levels and Dry Eye Syndrome: Differential Effects of Vitamin D on Ocular Diseases,2016,16
Heme Oxygenase-1 Expression Affects Murine Abdominal Aortic Aneurysm Progression,2016,14
"Genotypic, Phenotypic and Clinical Validation of GeneXpert in Extra-Pulmonary and Pulmonary Tuberculosis in India",2016,19
"Feeding Ecology of Northeast Atlantic Mackerel, Norwegian Spring-Spawning Herring and Blue Whiting in the Norwegian Sea",2016,32
The VITRO Score (Von Willebrand Factor Antigen/Thrombocyte Ratio) as a New Marker for Clinically Significant Portal Hypertension in Comparison to Other Non-Invasive Parameters of Fibrosis Including ELF Test,2016,31
Bimanual Coordination Learning with Different Augmented Feedback Modalities and Information Types,2016,4
"HIV Drug Resistance Mutations (DRMs) Detected by Deep Sequencing in Virologic Failure Subjects on Therapy from Hunan Province, China",2016,11
"The Drug Derived Complexity Index (DDCI) Predicts Mortality, Unplanned Hospitalization and Hospital Readmissions at the Population Level",2016,14
Deltex1 Polymorphisms Are Associated with Hepatitis B Vaccination Non-Response in Southwest China,2016,6
Impact of an Energy Drink on the Structure of Stomach and Pancreas of Albino Rat: Can Omega-3 Provide a Protection?,2016,11
Starch Granule Re-Structuring by Starch Branching Enzyme and Glucan Water Dikinase Modulation Affects Caryopsis Physiology and Metabolism,2016,13
"Evaluation of a Rapid Point of Care Test for Detecting Acute and Established HIV Infection, and Examining the Role of Study Quality on Diagnostic Accuracy: A Bayesian Meta-Analysis",2016,14
Nutritional and Protein Deficiencies in the Short Term following Both Gastric Bypass and Gastric Banding,2016,43
Diverse Effects of a Seven-Year Experimental Grassland Fragmentation on Major Invertebrate Groups,2016,7
Attention Deficit/Hyperactivity Disorder and Urinary Nonylphenol Levels: A Case-Control Study in Taiwanese Children,2016,9
Unmasking Heavily O-Glycosylated Serum Proteins Using Perchloric Acid: Identification of Serum Proteoglycan 4 and Protease C1 Inhibitor as Molecular Indicators for Screening of Breast Cancer,2016,15
RacA-Mediated ROS Signaling Is Required for Polarized Cell Differentiation in Conidiogenesis of Aspergillus fumigatus,2016,9
Whole-Genome Sequencing of Methicillin-Resistant Staphylococcus aureus Resistant to Fifth-Generation Cephalosporins Reveals Potential Non-mecA Mechanisms of Resistance,2016,25
Full Genome Sequence-Based Comparative Study of Wild-Type and Vaccine Strains of Infectious Laryngotracheitis Virus from Italy,2016,14
Evidence for Inbreeding and Genetic Differentiation among Geographic Populations of the Saprophytic Mushroom Trogia venenata from Southwestern China,2016,4
SETD7 Regulates the Differentiation of Human Embryonic Stem Cells,2016,13
Optimizing Mouse Surgery with Online Rectal Temperature Monitoring and Preoperative Heat Supply. Effects on Post-Ischemic Acute Kidney Injury,2016,19
Copper Nanoparticles and Copper Sulphate Induced Cytotoxicity in Hepatocyte Primary Cultures of Epinephelus coioides,2016,22
Structural Study of Cell Attachment Peptide Derived from Laminin by Molecular Dynamics Simulation,2016,4
Analytical Performance of ELISA Assays in Urine: One More Bottleneck towards Biomarker Validation and Clinical Implementation,2016,12
Costing Alternative Birth Settings for Women at Low Risk of Complications: A Systematic Review,2016,11
"Visceral Fat Accumulation, Insulin Resistance, and Elevated Depressive Symptoms in Middle-Aged Japanese Men",2016,8
MiR-449a Affects Epithelial Proliferation during the Pseudoglandular and Canalicular Phases of Avian and Mammal Lung Development,2016,9
A Mathematical Model Coupling Tumor Growth and Angiogenesis,2016,35
The Difference in Prognosis between Renal Sinus Fat and Perinephric Fat Invasion for pT3a Renal Cell Carcinoma: A Meta-Analysis,2016,16
Tyrosine Hydroxylation in Betalain Pigment Biosynthesis Is Performed by Cytochrome P450 Enzymes in Beets (Beta vulgaris),2016,34
Time-Course Transcriptome Analysis Reveals Resistance Genes of Panax ginseng Induced by Cylindrocarpon destructans Infection Using RNA-Seq,2016,11
"T47D Cells Expressing Myeloperoxidase Are Able to Process, Traffic and Store the Mature Protein in Lysosomes: Studies in T47D Cells Reveal a Role for Cys319 in MPO Biosynthesis that Precedes Its Known Role in Inter-Molecular Disulfide Bond Formation",2016,5
The Relationship between Mental and Somatic Practices and Wisdom,2016,9
Does Temporal Integration Occur for Unrecognizable Words in Visual Crowding?,2016,3
SIRT1 Disruption in Human Fetal Hepatocytes Leads to Increased Accumulation of Glucose and Lipids,2016,24
"Vocalisation Repertoire of Female Bluefin Gurnard (Chelidonichthys kumu) in Captivity: Sound Structure, Context and Vocal Activity",2016,4
Clinical Nomograms to Predict Stone-Free Rates after Shock-Wave Lithotripsy: Development and Internal-Validation,2016,12
Unified Saliency Detection Model Using Color and Texture Features,2016,21
Malignant Potential of Gastrointestinal Cancers Assessed by Structural Equation Modeling,2016,3
"No Interaction with Alcohol Consumption, but Independent Effect of C12orf51 (HECTD4) on Type 2 Diabetes Mellitus in Korean Adults Aged 40-69 Years: The KoGES_Ansan and Ansung Study",2016,5
RAB-6.1 and RAB-6.2 Promote Retrograde Transport in C. elegans,2016,5
Identification of Novel Reference Genes Suitable for qRT-PCR Normalization with Respect to the Zebrafish Developmental Stage,2016,17
Microparticle-Induced Activation of the Vascular Endothelium Requires Caveolin-1/Caveolae,2016,10
Measuring Impatience in Intertemporal Choice,2016,11
Comparison of the Performance of Cartomizer Style Electronic Cigarettes from Major Tobacco and Independent Manufacturers,2016,7
Objective Assessment of Nuclear and Cortical Cataracts through Scheimpflug Images: Agreement with the LOCS III Scale,2016,14
Hirsutella sinensis Attenuates Aristolochic Acid-Induced Renal Tubular Epithelial-Mesenchymal Transition by Inhibiting TGF-β1 and Snail Expression,2016,5
Quality Evaluation of Potentilla fruticosa L. by High Performance Liquid Chromatography Fingerprinting Associated with Chemometric Methods,2016,13
Selecting Optimal Random Forest Predictive Models: A Case Study on Predicting the Spatial Distribution of Seabed Hardness,2016,28
Association between Birth Interval and Cardiovascular Outcomes at 30 Years of Age: A Prospective Cohort Study from Brazil,2016,1
Behçet's: A Disease or a Syndrome? Answer from an Expression Profiling Study,2016,8
The Potential Biomarkers to Identify the Development of Steatosis in Hyperuricemia,2016,3
Epidemiological Study of RRT-Treated ESRD in Nanjing - A Ten-Year Experience in Nearly Three Million Insurance Covered Population,2016,5
Surveillance of the Sensitivity towards Antiparasitic Bath-Treatments in the Salmon Louse (Lepeophtheirus salmonis),2016,16
Ingression Progression Complexes Control Extracellular Matrix Remodelling during Cytokinesis in Budding Yeast,2016,8
Synergistic Control of Kinetochore Protein Levels by Psh1 and Ubr2,2016,7
"Exome Sequencing of Uterine Leiomyosarcomas Identifies Frequent Mutations in TP53, ATRX, and MED12",2016,47
Bovine Host Genetic Variation Influences Rumen Microbial Methane Production with Best Selection Criterion for Low Methane Emitting and Efficiently Feed Converting Hosts Based on Metagenomic Gene Abundance,2016,130
Rab6 Is Required for Multiple Apical Transport Pathways but Not the Basolateral Transport Pathway in Drosophila Photoreceptors,2016,17
Integrated Multiregional Analysis Proposing a New Model of Colorectal Cancer Evolution,2016,65
A Feedback Model of Attention Explains the Diverse Effects of Attention on Neural Firing Rates and Receptive Field Structure,2016,10
Quantifying Transmission Investment in Malaria Parasites,2016,11
"Whisking, Sniffing, and the Hippocampal θ-Rhythm: A Tale of Two Oscillators",2016,18
Coherence between Rat Sensorimotor System and Hippocampus Is Enhanced during Tactile Discrimination,2016,40
Membrane Potential Dynamics of Spontaneous and Visually Evoked Gamma Activity in V1 of Awake Mice,2016,21
Gβ Regulates Coupling between Actin Oscillators for Cell Polarity and Directional Migration,2016,21
"mTORC1 in Thymic Epithelial Cells Is Critical for Thymopoiesis, T-Cell Generation, and Temporal Control of γδT17 Development and TCRγ/δ Recombination",2016,15
Interactome Mapping Reveals the Evolutionary History of the Nuclear Pore Complex,2016,47
Bread Wheat (Triticum aestivum L.) Grain Protein Concentration Is Related to Early Post-Flowering Nitrate Uptake under Putative Control of Plant Satiety Level,2016,19
Detection of Talaromyces marneffei from Fresh Tissue of an Inhalational Murine Pulmonary Model Using Nested PCR,2016,5
Frontal Bone Insufficiency in Gsk3β Mutant Mice,2016,7
Distribution and Genetic Profiles of Campylobacter in Commercial Broiler Production from Breeder to Slaughter in Thailand,2016,18
Clinical Implications of Diffuse Excessive High Signal Intensity (DEHSI) on Neonatal MRI in School Age Children Born Extremely Preterm,2016,16
Three Millennia of Southwestern North American Dustiness and Future Implications,2016,12
Rural to Urban Population Density Scaling of Crime and Property Transactions in English and Welsh Parliamentary Constituencies,2016,15
A Balance between Nuclear and Cytoplasmic Volumes Controls Spindle Length,2016,12
Isolating Influenza RNA from Clinical Samples Using Microfluidic Oil-Water Interfaces,2016,12
Mixtures of Two Bile Alcohol Sulfates Function as a Proximity Pheromone in Sea Lamprey,2016,9
Characterization of MazF-Mediated Sequence-Specific RNA Cleavage in Pseudomonas putida Using Massive Parallel Sequencing,2016,9
Rectal HSV-2 Infection May Increase Rectal SIV Acquisition Even in the Context of SIVΔnef Vaccination,2016,7
Modular Synthetic Inverters from Zinc Finger Proteins and Small RNAs,2016,4
Thiamin and Riboflavin in Human Milk: Effects of Lipid-Based Nutrient Supplementation and Stage of Lactation on Vitamer Secretion and Contributions to Total Vitamin Content,2016,17
Serum Collagen Type II Cleavage Epitope and Serum Hyaluronic Acid as Biomarkers for Treatment Monitoring of Dogs with Hip Osteoarthritis,2016,5
siRNA Targeting the 2Apro Genomic Region Prevents Enterovirus 71 Replication In Vitro,2016,5
Increased mRNA Levels of Sphingosine Kinases and S1P Lyase and Reduced Levels of S1P Were Observed in Hepatocellular Carcinoma in Association with Poorer Differentiation and Earlier Recurrence,2016,33
A Panel of Stably Expressed Reference Genes for Real-Time qPCR Gene Expression Studies of Mallards (Anas platyrhynchos),2016,14
Chronic Kidney Disease and Diabetic Retinopathy in Patients with Type 2 Diabetes,2016,31
Robust Classification of Small-Molecule Mechanism of Action Using a Minimalist High-Content Microscopy Screen and Multidimensional Phenotypic Trajectory Analysis,2016,8
Retroperitoneal Laparoscopic Management of Paraganglioma: A Single Institute Experience,2016,10
Predicting Essential Metabolic Genome Content of Niche-Specific Enterobacterial Human Pathogens during Simulation of Host Environments,2016,8
Whole-Body Vibration Partially Reverses Aging-Induced Increases in Visceral Adiposity and Hepatic Lipid Storage in Mice,2016,8
"An Analysis of Sponsors/Collaborators of 69,160 Drug Trials Registered with ClinicalTrials.gov",2016,3
"The Emergence and Spread of Multiple Livestock-Associated Clonal Complex 398 Methicillin-Resistant and Methicillin-Susceptible Staphylococcus aureus Strains among Animals and Humans in the Republic of Ireland, 2010–2014",2016,9
