title,year,citations
Knowledge and utilization of the partograph: A cross-sectional survey among obstetric care providers in urban referral public health institutions in northwest and southwest Cameroon,2017,5
Risk factors for postoperative pancreatic fistula after laparoscopic distal pancreatectomy using stapler closure technique from one single surgeon,2017,8
"Mice, double deficient in lysosomal serine carboxypeptidases Scpep1 and Cathepsin A develop the hyperproliferative vesicular corneal dystrophy and hypertrophic skin thickenings",2017,2
Leaky doors: Private captivity as a prominent source of bird introductions in Australia,2017,12
Usefulness of a novel method for the screening of deep vein thrombosis by using a combined D-dimer- and age-based index before total hip arthroplasty,2017,7
Proximal and distal muscle fatigue differentially affect movement coordination,2017,19
Genome-wide effects of MELK-inhibitor in triple-negative breast cancer cells indicate context-dependent response with p53 as a key determinant,2017,14
Interrater agreement of two adverse drug reaction causality assessment methods: A randomised comparison of the Liverpool Adverse Drug Reaction Causality Assessment Tool and the World Health Organization-Uppsala Monitoring Centre system,2017,14
The buzz about bees and poverty alleviation: Identifying drivers and barriers of beekeeping in sub-Saharan Africa,2017,13
"Isolation and characterization of gluten protein types from wheat, rye, barley and oats for use as reference materials",2017,62
Temporal change of photophobic step-up responses of Euglena gracilis investigated through motion analysis,2017,11
Evaluation of a thermostable Newcastle disease virus strain TS09-C as an in-ovo vaccine for chickens,2017,7
"Usefulness of multiplex PCR methods and respiratory viruses’ distribution in children below 15 years old according to age, seasons and clinical units in France: A 3 years retrospective study",2017,10
The best of both worlds: A combined approach for analyzing microalgal diversity via metabarcoding and morphology-based methods,2017,16
Physical performance analysis: A new approach to assessing free-living physical activity in musculoskeletal pain and mobility-limited populations,2017,11
Comparison of the HUI3 and the EQ-5D-3L in a nursing home setting,2017,4
"Critical role of intestinal interleukin-4 modulating regulatory T cells for desensitization, tolerance, and inflammation of food allergy",2017,10
"Use of cerebrospinal fluid and serum samples impregnated on FTATM Elute filter paper for the diagnosis of infections caused by Neisseria meningitidis, Streptococcus pneumoniae and Haemophilus influenzae",2017,1
Whole genome expression profiling associates activation of unfolded protein response with impaired production and release of epinephrine after recurrent hypoglycemia,2017,1
Disturbance of the let-7/LIN28 double-negative feedback loop is associated with radio- and chemo-resistance in non-small cell lung cancer,2017,18
Phase-specific expression of an insulin-like androgenic gland factor in a marine shrimp Lysmata wurdemanni: Implication for maintaining protandric simultaneous hermaphroditism,2017,6
Cholesterol crystals enhance TLR2- and TLR4-mediated pro-inflammatory cytokine responses of monocytes to the proatherogenic oral bacterium Porphyromonas gingivalis,2017,12
Biases in the SMART-DNA library preparation method associated with genomic poly dA/dT sequences,2017,4
Assessing upper-extremity motion: An innovative method to quantify functional capacity in patients with chronic obstructive pulmonary disease,2017,8
Postnatal and non-invasive prenatal detection of β-thalassemia mutations based on Taqman genotyping assays,2017,6
Habitat selection by two beluga whale populations in the Chukchi and Beaufort seas,2017,13
Quantification of respiratory depression during pre-operative administration of midazolam using a non-invasive respiratory volume monitor,2017,15
"Real world heart failure epidemiology and outcome: A population-based analysis of 88,195 patients",2017,45
Severe fever with thrombocytopenia syndrome virus inhibits exogenous Type I IFN signaling pathway through its NSs in vitro,2017,13
Waterdock 2.0: Water placement prediction for Holo-structures with a pymol plugin,2017,15
How components of facial width to height ratio differently contribute to the perception of social traits,2017,12
Analysis of Spo0M function in Bacillus subtilis,2017,6
Expression patterns of Slit and Robo family members in adult mouse spinal cord and peripheral nervous system,2017,18
Hypothalamic over-expression of VGF in the Siberian hamster increases energy expenditure and reduces body weight gain,2017,12
A high plant density reduces the ability of maize to use soil nitrogen,2017,17
A functional variant in the 3ˈ-UTR of VEGF predicts the 90-day outcome of ischemic stroke in Chinese patients,2017,3
The role of neuromedin U in adiposity regulation. Haplotype analysis in European children from the IDEFICS Cohort,2017,2
"Overexpression of MusaMYB31, a R2R3 type MYB transcription factor gene indicate its role as a negative regulator of lignin biosynthesis in banana",2017,12
RAC1b overexpression stimulates proliferation and NF-kB-mediated anti-apoptotic signaling in thyroid cancer cells,2017,13
Single nucleotide polymorphism discovery in bovine liver using RNA-seq technology,2017,4
"Comprehensive growth performance, immune function, plasma biochemistry, gene expressions and cell death morphology responses to a daily corticosterone injection course in broiler chickens",2017,23
Quantitative and qualitative characteristics of cell wall components and prenyl lipids in the leaves of Tilia x euchlora trees growing under salt stress,2017,7
The single nucleotide variant rs12722489 determines differential estrogen receptor binding and enhancer properties of an IL2RA intronic region,2017,5
A rough set approach for determining weights of decision makers in group decision making,2017,14
Selection of internal reference genes for normalization of reverse transcription quantitative polymerase chain reaction (RT-qPCR) analysis in the rumen epithelium,2017,5
Does metabolite channeling accelerate enzyme-catalyzed cascade reactions?,2017,20
Human interest meets biodiversity hotspots: A new systematic approach for urban ecosystem conservation,2017,4
"Twenty years of ecosystem response after clearcutting and slashburning in conifer forests of central British Columbia, Canada",2017,3
High-normal levels of hs-CRP predict the development of non-alcoholic fatty liver in healthy men,2017,17
Malignant infarction of the middle cerebral artery in a porcine model. A pilot study,2017,6
Direct replication of Gervais & Norenzayan (2012): No evidence that analytic thinking decreases religious belief,2017,31
Lipofuscin-associated photo-oxidative stress during fundus autofluorescence imaging,2017,11
Structural and biochemical studies on Vibrio cholerae Hsp31 reveals a novel dimeric form and Glutathione-independent Glyoxalase activity,2017,1
Characterization of pathogenesis of and immune response to Burkholderia pseudomallei K96243 using both inhalational and intraperitoneal infection models in BALB/c and C57BL/6 mice,2017,12
The natural killer cell response to West Nile virus in young and old individuals with or without a prior history of infection,2017,13
Clinically determined type of 18F-fluoro-2-deoxyglucose uptake as an alternative prognostic marker in resectable pancreatic cancer,2017,6
A three-dimensional block structure consisting exclusively of carbon nanotubes serving as bone regeneration scaffold and as bone defect filler,2017,9
The Salmonella effector SseJ disrupts microtubule dynamics when ectopically expressed in normal rat kidney cells,2017,6
Community recommendations on biobank governance: Results from a deliberative community engagement in California,2017,11
Trichostatin A attenuates ventilation-augmented epithelial-mesenchymal transition in mice with bleomycin-induced acute lung injury by suppressing the Akt pathway,2017,10
FLAIR vascular hyperintensities and 4D MR angiograms for the estimation of collateral blood flow in anterior cerebral artery ischemia,2017,3
Lung cancer specialist physicians’ attitudes towards e-cigarettes: A nationwide survey,2017,7
Recent trends in racial and regional disparities in cervical cancer incidence and mortality in United States,2017,40
Association of maternal age with child health: A Japanese longitudinal study,2017,3
Intimate partner violence during pregnancy and its association with preterm birth and low birth weight in Tanzania: A prospective cohort study,2017,26
Comparison of wrist-worn Fitbit Flex and waist-worn ActiGraph for measuring steps in free-living adults,2017,47
Diagnostic needs for rare diseases and shared prediagnostic phenomena: Results of a German-wide expert Delphi survey,2017,16
Signatures of reproductive events on blood counts and biomarkers of inflammation: Implications for chronic disease risk,2017,5
Interleukin-10 reorganizes the cytoskeleton of mature dendritic cells leading to their impaired biophysical properties and motilities,2017,6
The light-makeup advantage in facial processing: Evidence from event-related potentials,2017,2
Expanding HIV-1 subtype B transmission networks among men who have sex with men in Poland,2017,11
Modulation of functional characteristics of resident and thioglycollate-elicited peritoneal murine macrophages by a recombinant banana lectin,2017,4
The surrounding landscape influences the diversity of leaf-litter ants in riparian cloud forest remnants,2017,10
Identification and validation of superior reference gene for gene expression normalization via RT-qPCR in staminate and pistillate flowers of Jatropha curcas – A biodiesel plant,2017,12
An adaptive random search for short term generation scheduling with network constraints,2017,3
"Conservation status and regional habitat priorities for the Orinoco crocodile: Past, present, and future",2017,3
Application of portable XRF and VNIR sensors for rapid assessment of soil heavy metal pollution,2017,50
Southern elephant seals (Mirounga leonina Linn.) depredate toothfish longlines in the midnight zone,2017,8
Nitrogen addition shifts the microbial community in the rhizosphere of Pinus tabuliformis in Northwestern China,2017,18
Conventional colon adenomas harbor various disturbances in microsatellite stability and contain micro-serrated foci with microsatellite instability,2017,1
Regime shifts in coastal lagoons: Evidence from free-living marine nematodes,2017,11
4D-CTA improves diagnostic certainty and accuracy in the detection of proximal intracranial anterior circulation occlusion in acute ischemic stroke,2017,6
"The relationship of serum vitamins A, D, E and LL-37 levels with allergic status, tonsillar virus detection and immune response",2017,23
"German translation, cultural adaptation, and validation of the Health Literacy Questionnaire (HLQ)",2017,25
"Adaptive management of energy consumption, reliability and delay of wireless sensor node: Application to IEEE 802.15.4 wireless sensor node",2017,4
P53 and Ki-67 as prognostic markers in triple-negative breast cancer patients,2017,24
Determining causes of genetic isolation in a large carnivore (Ursus americanus) population to direct contemporary conservation measures,2017,13
"Individual external doses below the lowest reference level of 1 mSv per year five years after the 2011 Fukushima nuclear accident among all children in Soma City, Fukushima: A retrospective observational study",2017,15
Lens apoptosis in the Astyanax blind cavefish is not triggered by its small size or defects in morphogenesis,2017,3
The impact of job and family demands on partner’s fatigue: A study of Japanese dual-earner parents,2017,1
Effects of a leaf spring structured midsole on joint mechanics and lower limb muscle forces in running,2017,2
Prognostic value of dobutamine stress myocardial perfusion echocardiography in patients with known or suspected coronary artery disease and normal left ventricular function,2017,3
Synergistic interactions between phenolic compounds identified in grape pomace extract with antibiotics of different classes against Staphylococcus aureus and Escherichia coli,2017,46
DNApod: DNA polymorphism annotation database from next-generation sequence read archives,2017,0
Subcellular distribution of non-muscle myosin IIb is controlled by FILIP through Hsc70,2017,1
Improving early diagnosis of pulmonary infections in patients with febrile neutropenia using low-dose chest computed tomography,2017,14
Expression and prognostic impact of matrix metalloproteinase-2 (MMP-2) in astrocytomas,2017,25
Quantifying the demographic cost of human-related mortality to a raptor population,2017,13
Higher body mass index and lower intake of dairy products predict poor glycaemic control among Type 2 Diabetes patients in Malaysia,2017,5
Can milk cell or skim milk miRNAs be used as biomarkers for early pregnancy detection in cattle?,2017,16
Rational design of DKK3 structure-based small peptides as antagonists of Wnt signaling pathway and in silico evaluation of their efficiency,2017,9
Complementary mechanisms for upright balance during walking,2017,19
CRISPR/Cas9 mediated chicken Stra8 gene knockout and inhibition of male germ cell differentiation,2017,14
Association of psychological distress and work psychosocial factors with self-reported musculoskeletal pain among secondary school teachers in Malaysia,2017,14
Peptides actively transported across the tympanic membrane: Functional and structural properties,2017,11
The influence of lightning induced voltage on the distribution power line polymer insulators,2017,4
Comparative pathology of rhesus macaque and common marmoset animal models with Middle East respiratory syndrome coronavirus,2017,14
Why do people buy dogs with potential welfare problems related to extreme conformation and inherited disease? A representative study of Danish owners of four small dog breeds,2017,17
The role of the interaction network in the emergence of diversity of behavior,2017,4
Evaluation of the intestinal permeability of rosemary (Rosmarinus officinalis L.) extract polyphenols and terpenoids in Caco-2 cell monolayers,2017,20
Persistence of senescent prostate cancer cells following prolonged neoadjuvant androgen deprivation therapy,2017,7
Early wound healing and refractive response of different pocket configurations following presbyopic inlay implantation,2017,6
Novel form of miR-29b suppresses bleomycin-induced pulmonary fibrosis,2017,6
Discrimination in lexical decision,2017,38
Automated processing of webcam images for phenological classification,2017,5
"The costs of providing antiretroviral therapy services to HIV-infected individuals presenting with advanced HIV disease at public health centres in Dar es Salaam, Tanzania: Findings from a randomised trial evaluating different health care strategies",2017,9
"Anthropological contributions to historical ecology: 50 questions, infinite prospects",2017,47
The influence of sexual activity on the vaginal microbiota and Gardnerella vaginalis clade diversity in young women,2017,32
Multiple functional therapeutic effects of TnP: A small stable synthetic peptide derived from fish venom in a mouse model of multiple sclerosis,2017,5
"Dispersion of radiocesium-contaminated bottom sediment caused by heavy rainfall in Joso City, Japan",2017,1
"Post-breeding movements of Ancient Murrelet Synthliboramphus antiquus family groups, subsequent migration of adults and implications for management",2017,9
Assessment of laboratory and daily energy expenditure estimates from consumer multi-sensor physical activity monitors,2017,47
A three-way approach for protein function classification,2017,11
Genome-wide association analysis of agronomic traits in wheat under drought-stressed and non-stressed conditions,2017,48
"Morphological comparison of five species of poison dart frogs of the genus Ranitomeya (Anura: Dendrobatidae) including the skeleton, the muscle system and inner organs",2017,7
Abdominal desmoplastic small round cell tumor without extraperitoneal metastases: Is there a benefit for HIPEC after macroscopically complete cytoreductive surgery?,2017,22
Capecitabine and cisplatin (XP) combination systemic chemotherapy in heavily pre-treated HER2 negative metastatic breast cancer,2017,3
Importance of CD200 expression by tumor or host cells to regulation of immunotherapy in a mouse breast cancer model,2017,5
A model for oxygen conservation associated with titration during pediatric oxygen therapy,2017,1
Identification and VIGS-based characterization of Bx1 ortholog in rye (Secale cereale L.),2017,12
"Biotransformation of a potent anabolic steroid, mibolerone, with Cunninghamella blakesleeana, C. echinulata, and Macrophomina phaseolina, and biological activity evaluation of its metabolites",2017,11
Clustering cancer gene expression data by projective clustering ensemble,2017,19
"Biomimetic, ultrathin and elastic hydrogels regulate human neutrophil extravasation across endothelial-pericyte bilayers",2017,5
Hyperthermia influences fate determination of neural stem cells with lncRNAs alterations in the early differentiation,2017,4
Influence of nitrogen and phosphorous on the growth and root morphology of Acer mono,2017,64
Mapping cerebral pulse pressure and arterial compliance over the adult lifespan with optical imaging,2017,11
Association of IFIH1 and pro-inflammatory mediators: Potential new clues in SLE-associated pathogenesis,2017,2
"Perioperative onset of acquired von Willebrand syndrome: Comparison between HVAD, HeartMate II and on-pump coronary bypass surgery",2017,7
Demulsification of crude oil-in-water emulsions by means of fungal spores,2017,4
Formononetin protects against acetaminophen-induced hepatotoxicity through enhanced NRF2 activity,2017,17
The prevalence of insomnia in the general population in China: A meta-analysis,2017,75
Semi-quantitative proteomics of mammalian cells upon short-term exposure to non-ionizing electromagnetic fields,2017,6
The impacts of forest management strategies for woodland caribou vary across biogeographic gradients,2017,7
"Implementing at-scale, community-based distribution of misoprostol tablets to mothers in the third stage of labor for the prevention of postpartum haemorrhage in Sokoto State, Nigeria: Early results and lessons learned",2017,5
Role of the CX3C chemokine receptor CX3CR1 in the pathogenesis of atherosclerosis after aortic transplantation,2017,2
Plant species classification using flower images—A comparative study of local feature representations,2017,29
Socio-ecological costs of Amazon nut and timber production at community household forests in the Bolivian Amazon,2017,8
Handedness is a biomarker of variation in anal sex role behavior and Recalled Childhood Gender Nonconformity among gay men,2017,9
Can treefrog phylogeographical clades and species’ phylogenetic topologies be recovered by bioacoustical analyses?,2017,13
Frequency of chimerism in populations of the kelp Lessonia spicata in central Chile,2017,6
Human Alpha-1-Antitrypsin (hAAT) therapy reduces renal dysfunction and acute tubular necrosis in a murine model of bilateral kidney ischemia-reperfusion injury,2017,13
Enhanced acarbose production by Streptomyces M37 using a two-stage fermentation strategy,2017,3
Open sesame: Identification of sesame oil and oil soot ink in organic deposits of Tang Dynasty lamps from Astana necropolis in China,2017,5
Endomyocardial involvement in asymptomatic sub-Saharan immigrants with helminth-related eosinophilia,2017,0
Experimental infection and transmission of Leishmania by Lutzomyia cruzi (Diptera: Psychodidae): Aspects of the ecology of parasite-vector interactions,2017,14
Immunization with Tc52 or its amino terminal domain adjuvanted with c-di-AMP induces Th17+Th1 specific immune responses and confers protection against Trypanosoma cruzi,2017,11
Suppressor of rid1 (SID1) shares common targets with RID1 on florigen genes to initiate floral transition in rice,2017,9
Kinetics of large-scale chromosomal movement during asymmetric cell division in Escherichia coli,2017,11
A new link between transcriptional initiation and pre-mRNA splicing: The RNA binding histone variant H2A.B,2017,15
Imputation for transcription factor binding predictions based on deep learning,2017,31
On the stability and dynamics of stochastic spiking neuron models: Nonlinear Hawkes process and point process GLMs,2017,23
Neurocomputational mechanisms underlying subjective valuation of effort costs,2017,78
Correction: HTLV-1 bZIP Factor Enhances T-cell Proliferation by Impeding the Suppressive Signaling of Co-inhibitory Receptors,2017,1
Applying antibody-sensitive hypervariable region 1-deleted hepatitis C virus to the study of escape pathways of neutralizing human monoclonal antibody AR5A,2017,12
Precision engineering for PRRSV resistance in pigs: Macrophages from genome edited pigs lacking CD163 SRCR5 domain are fully resistant to both PRRSV genotypes while maintaining biological function,2017,138
A mouse model of paralytic myelitis caused by enterovirus D68,2017,89
Analysis of the T Cell Response to Zika Virus and Identification of a Novel CD8+ T Cell Epitope in Immunocompetent Mice,2017,60
"Molecular detection and genotyping of enteroviruses from CSF samples of patients with suspected sepsis-like illness and/or aseptic meningitis from 2012 to 2015 in West Bank, Palestine",2017,8
The effects of cervical transcutaneous spinal direct current stimulation on motor pathways supplying the upper limb in humans,2017,8
"Analysis of spatial mobility in subjects from a Dengue endemic urban locality in Morelos State, Mexico",2017,6
Effect of maternal death on child survival in rural West Africa: 25 years of prospective surveillance data in The Gambia,2017,11
Mulberry-extract improves glucose tolerance and decreases insulin concentrations in normoglycaemic adults: Results of a randomised double-blind placebo-controlled study,2017,11
"Betel nut chewing, oral premalignant lesions, and the oral microbiome",2017,31
"The risk of disabling, surgery and reoperation in Crohn’s disease – A decision tree-based approach to prognosis",2017,4
Chronic treatment of non-small-cell lung cancer cells with gefitinib leads to an epigenetic loss of epithelial properties associated with reductions in microRNA-155 and -200c,2017,15
Female reproductive factors are associated with objectively measured physical activity in middle-aged women,2017,8
Perioperative hemoglobin area under the curve is an independent predictor of renal failure after cardiac surgery. Results from a Spanish multicenter retrospective cohort study,2017,11
"Effect of various nitrogen conditions on population growth, temporary cysts and cellular biochemical compositions of Karenia mikimotoi",2017,9
A reconfiguration of the sex trade: How social and structural changes in eastern Zimbabwe left women involved in sex work and transactional sex more vulnerable,2017,10
A novel approach to eliminate detection of contaminating Staphylococcal species introduced during clinical testing,2017,2
The phylodynamics of the rabies virus in the Russian Federation,2017,8
A novel intraperitoneal metastatic xenograft mouse model for survival outcome assessment of esophageal adenocarcinoma,2017,5
Linear mixed-effects models to describe length-weight relationships for yellow croaker (Larimichthys Polyactis) along the north coast of China,2017,13
"Validation of band counts in eyestalks for the determination of age of Antarctic krill, Euphausia superba",2017,15
Prevalence and factors associated with food intake difficulties among residents with dementia,2017,11
Management of vesicovaginal fistulas (VVFs) in women following benign gynaecologic surgery: A systematic review and meta-analysis,2017,33
Environmental characteristics drive variation in Amazonian understorey bird assemblages,2017,6
Non-melanoma skin cancer and risk of Alzheimer’s disease and all-cause dementia,2017,11
A distal intergenic region controls pancreatic endocrine differentiation by acting as a transcriptional enhancer and as a polycomb response element,2017,4
"Symptomatic spinal metastasis: A systematic literature review of the preoperative prognostic factors for survival, neurological, functional and quality of life in surgically treated patients and methodological recommendations for prognostic studies",2017,10
Heart and skeletal muscle inflammation (HSMI) disease diagnosed on a British Columbia salmon farm through a longitudinal farm study,2017,41
"Forest dynamics in the U.S. indicate disproportionate attrition in western forests, rural areas and public lands",2017,4
Whole-genome duplication and molecular evolution in Cornus L. (Cornaceae) – Insights from transcriptome sequences,2017,11
Combined small RNA and degradome sequencing reveals complex microRNA regulation of catechin biosynthesis in tea (Camellia sinensis),2017,14
"Cancer prevalence, incidence and mortality in people who experience incarceration in Ontario, Canada: A population-based retrospective cohort study",2017,6
Genetic polymorphisms and plasma levels of BCL11A contribute to the development of laryngeal squamous cell carcinoma,2017,7
GNB3 and CREB1 gene polymorphisms combined with negative life events increase susceptibility to major depression in a Chinese Han population,2017,9
"Chronic pain, depression and cardiovascular disease linked through a shared genetic predisposition: Analysis of a family-based cohort and twin study",2017,20
Marine Actinobacteria as a source of compounds for phytopathogen control: An integrative metabolic-profiling / bioactivity and taxonomical approach,2017,23
"Anti-rheumatic treatment is not associated with reduction of pentraxin 3 in rheumatoid arthritis, psoriatic arthritis and ankylosing spondylitis",2017,9
