title,year,citations
SF-6D utility values for the better- and worse-seeing eye for health states based on the Snellen equivalent in patients with age-related macular degeneration,2017,2
Multicenter experiences in temporal bone cancer surgery based on 89 cases,2017,6
"Interferon β-1a for the treatment of Ebola virus disease: A historically controlled, single-arm proof-of-concept trial",2017,22
Cynomolgus macaques naturally infected with Trypanosoma cruzi-I exhibit an overall mixed pro-inflammatory/modulated cytokine signature characteristic of human Chagas disease,2017,8
"ALPK1 controls TIFA/TRAF6-dependent innate immunity against heptose-1,7-bisphosphate of gram-negative bacteria",2017,36
The thermodynamics of Pr55Gag-RNA interaction regulate the assembly of HIV,2017,16
Correction: IGF-1 Induces GHRH Neuronal Axon Elongation during Early Postnatal Life in Mice,2017,0
Correction: Relaxation Response and Resiliency Training and Its Effect on Healthcare Resource Utilization,2017,0
"Correction: Relaxation Response Induces Temporal Transcriptome Changes in Energy Metabolism, Insulin Secretion and Inflammatory Pathways",2017,2
Correction: Genomic and Clinical Effects Associated with a Relaxation Response Mind-Body Intervention in Patients with Irritable Bowel Syndrome and Inflammatory Bowel Disease,2017,0
Correction: The Feasibility and Impact of Delivering a Mind-Body Intervention in a Virtual World,2017,1
Correction: Genomic Counter-Stress Changes Induced by the Relaxation Response,2017,0
Correction: Beyond Academia – Interrogating Research Impact in the Research Excellence Framework,2017,2
Correction: A Complete Fossil-Calibrated Phylogeny of Seed Plant Families as a Tool for Comparative Analyses: Testing the ‘Time for Speciation’ Hypothesis,2017,0
Correction: Induction of Multiple miR-200/182 Members in the Brains of Mice Are Associated with Acute Herpes Simplex Virus 1 Encephalitis,2017,0
Effect of meal composition on postprandial lipid concentrations and lipoprotein particle numbers: A randomized cross-over study,2017,3
Owner perceived differences between mixed-breed and purebred dogs,2017,11
Modelling the effects of environmental conditions on the acoustic occurrence and behaviour of Antarctic blue whales,2017,4
In situ single cell detection via microfluidic magnetic bead assay,2017,9
Understanding tree growth responses after partial cuttings: A new approach,2017,39
Evaluation of 18-F-fluoro-2-deoxyglucose (FDG) positron emission tomography/computed tomography (PET/CT) as a staging and monitoring tool for dogs with stage-2 splenic hemangiosarcoma – A pilot study,2017,8
Poor replication validity of biomedical association studies reported by newspapers,2017,35
RhoA promotes epidermal stem cell proliferation via PKN1-cyclin D1 signaling,2017,7
"The distinct features of microbial ‘dysbiosis’ of Crohn’s disease do not occur to the same extent in their unaffected, genetically-linked kindred",2017,10
Correction: Auranofin Inhibits Retinal Pigment Epithelium Cell Survival through Reactive Oxygen Species-Dependent Epidermal Growth Factor Receptor/ Mitogen-Activated Protein Kinase Signaling Pathway,2017,1
Blastocystis subtyping and its association with intestinal parasites in children from different geographical regions of Colombia,2017,33
Generalized min-max bound-based MRI pulse sequence design framework for wide-range T1 relaxometry: A case study on the tissue specific imaging sequence,2017,4
Biomechanical investigation of two plating systems for medial column fusion in foot,2017,2
"Investigating human geographic origins using dual-isotope (87Sr/86Sr, δ18O) assignment approaches",2017,33
"Molecular epidemiology of Mycobacterium tuberculosis complex in Brussels, 2010–2013",2017,9
Forecasting outpatient visits using empirical mode decomposition coupled with back-propagation artificial neural networks optimized by particle swarm optimization,2017,14
Pre-existing neutralizing antibody mitigates B cell dysregulation and enhances the Env-specific antibody response in SHIV-infected rhesus macaques,2017,2
Ecological and human health risks associated with abandoned gold mine tailings contaminated soil,2017,62
Factors associated with post-diagnosis pregnancies in women living with HIV in the south of Brazil,2017,2
Emergence and development of gut motility in the chicken embryo,2017,11
Back to basics: The effects of block vs. interleaved trial administration on pro- and anti-saccade performance,2017,7
"Epidemiological tracing of bovine tuberculosis in Switzerland, multilocus variable number of tandem repeat analysis of Mycobacterium bovis and Mycobacterium caprae",2017,17
SlMAPK3 enhances tolerance to tomato yellow leaf curl virus (TYLCV) by regulating salicylic acid and jasmonic acid signaling in tomato (Solanum lycopersicum),2017,24
Optimal combinations of control strategies and cost-effective analysis for visceral leishmaniasis disease transmission,2017,8
Fewer acute respiratory infection episodes among patients receiving treatment for gastroesophageal reflux disease,2017,2
Elderly fall risk prediction using static posturography,2017,49
COMT and DRD2/ANKK-1 gene-gene interaction account for resetting of gamma neural oscillations to auditory stimulus-driven attention,2017,2
"Social, structural, behavioral and clinical factors influencing retention in Pre-Exposure Prophylaxis (PrEP) care in Mississippi",2017,76
Revised Hammersmith Scale for spinal muscular atrophy: A SMA specific clinical outcome assessment tool,2017,22
"Costs and effects of a state-wide health promotion program in primary schools in Germany – the Baden-Württemberg Study: A cluster-randomized, controlled trial",2017,12
"The role of spatial mobility in malaria transmission in the Brazilian Amazon: The case of Porto Velho municipality, Rondônia, Brazil (2010-2012)",2017,7
Brugia malayi microfilariae transport alphaviruses across the mosquito midgut,2017,3
The effect of anti-angiogenic agents on overall survival in metastatic oesophago-gastric cancer: A systematic review and meta-analysis,2017,7
Development of topical ophthalmic In Situ gel-forming estradiol delivery system intended for the prevention of age-related cataracts,2017,26
Do family and neighbourhood matter in secondary school completion? A multilevel study of determinants and their interactions in a life-course perspective,2017,5
Deriving effective vaccine allocation strategies for pandemic influenza: Comparison of an agent-based simulation and a compartmental model,2017,3
Examining current or future trade-offs for biodiversity conservation in north-eastern Australia,2017,7
Streptococcus sanguinis induces neutrophil cell death by production of hydrogen peroxide,2017,11
Differentially expressed proteins underlying childhood cortical dysplasia with epilepsy identified by iTRAQ proteomic profiling,2017,8
A non-synonymous SNP with the allele frequency correlated with the altitude may contribute to the hypoxia adaptation of Tibetan chicken,2017,4
Use of heterologous immunoassays for quantification of serum proteins: The case of canine C-reactive protein,2017,18
microRNA-200a silencing protects neural stem cells against cerebral ischemia/reperfusion injury,2017,17
A purified MAA-based ELISA is a useful tool for determining anti-MAA antibody titer with high sensitivity,2017,5
Autoantibodies against mono- and tri-methylated lysine display similar but also distinctive characteristics,2017,0
"Bayesian stock assessment of Pacific herring in Prince William Sound, Alaska",2017,8
Antidepressive and antinociceptive effects of ethanolic extract and fruticuline A from Salvia lachnostachys Benth leaves on rodents,2017,7
Phospholipid binding to the FAK catalytic domain impacts function,2017,2
Salient object changes influence overt attentional prioritization and object-based targeting in natural scenes,2017,6
Stress increases the risk of type 2 diabetes onset in women: A 12-year longitudinal study using causal modelling,2017,23
Decellularized Wharton’s Jelly from human umbilical cord as a novel 3D scaffolding material for tissue engineering applications,2017,22
Toothbrush abrasivity in a long-term simulation on human dentin depends on brushing mode and bristle arrangement,2017,13
The desert gerbil Psammomys obesus as a model for metformin-sensitive nutritional type 2 diabetes to protect hepatocellular metabolic damage: Impact of mitochondrial redox state,2017,10
Dexmedetomidine preconditioning may attenuate myocardial ischemia/reperfusion injury by down-regulating the HMGB1-TLR4-MyD88-NF-кB signaling pathway,2017,38
Alteration of the exDNA profile in blood serum of LLC-bearing mice under the decrease of tumour invasion potential by bovine pancreatic DNase I treatment,2017,7
"GLM-based optimization of NGS data analysis: A case study of Roche 454, Ion Torrent PGM and Illumina NextSeq sequencing data",2017,2
Evaluation of factors associated with severe and frequent back pain in high school athletes,2017,9
Polymorphisms and features of cytomegalovirus UL144 and UL146 in congenitally infected neonates with hepatic involvement,2017,2
Dissecting nutrient-related co-expression networks in phosphate starved poplars,2017,8
Cataract surgery causes biomechanical alterations to the eye detectable by Corvis ST tonometry,2017,7
Oxidative stress-mediated NFκB phosphorylation upregulates p62/SQSTM1 and promotes retinal pigmented epithelial cell survival through increased autophagy,2017,47
PPD-induced monocyte mitochondrial damage is associated with a protective effect to develop tuberculosis in BCG vaccinated individuals: A cohort study,2017,1
Morphological study of tooth development in podoplanin-deficient mice,2017,4
Transcriptional response to 131I exposure of rat thyroid gland,2017,4
Genome-wide study of resistant hypertension identified from electronic health records,2017,16
Different antibiotic growth promoters induce specific changes in the cecal microbiota membership of broiler chicken,2017,41
Multicenter study of skin rashes and hepatotoxicity in antiretroviral-naïve HIV-positive patients receiving non-nucleoside reverse-transcriptase inhibitor plus nucleoside reverse-transcriptase inhibitors in Taiwan,2017,16
A meta-analysis of the abscopal effect in preclinical models: Is the biologically effective dose a relevant physical trigger?,2017,41
Social networks and inference about unknown events: A case of the match between Google’s AlphaGo and Sedol Lee,2017,5
Algorithmic design of a noise-resistant and efficient closed-loop deep brain stimulation system: A computational approach,2017,6
The role of short-term memory and visuo-spatial skills in numerical magnitude processing: Evidence from Turner syndrome,2017,4
How important is thermodynamics for identifying elementary flux modes?,2017,12
Cardiac strength-interval curves calculated using a bidomain tissue with a parsimonious ionic current,2017,2
What do sales data tell us about implant survival?,2017,4
"Maternal psychological stress-induced developmental disability, neonatal mortality and stillbirth in the offspring of Wistar albino rats",2017,9
Metabolite profiling of the carnivorous pitcher plants Darlingtonia and Sarracenia,2017,4
Screening for depressive symptoms in adolescents at school: New validity evidences on the short form of the Reynolds Depression Scale,2017,5
GIS-based landform classification of Bronze Age archaeological sites on Crete Island,2017,5
Heteromeric Slick/Slack K+ channels show graded sensitivity to cell volume changes,2017,4
Soret and Dufour effects on MHD peristaltic transport of Jeffrey fluid in a curved channel with convective boundary conditions,2017,13
Seed and peel essential oils obtained from Campomanesia adamantium fruit inhibit inflammatory and pain parameters in rodents,2017,8
Cytotoxic effector functions of T cells are not required for protective immunity against fatal Rickettsia typhi infection in a murine model of infection: Role of TH1 and TH17 cytokines in protection and pathology,2017,7
Ultrasonographic evaluation of urinary tract morbidity in school-aged and preschool-aged children infected with Schistosoma haematobium and its evolution after praziquantel treatment: A randomized controlled trial,2017,12
Leprosy reactions: The predictive value of Mycobacterium leprae-specific serology evaluated in a Brazilian cohort of leprosy patients (U-MDT/CT-BR),2017,16
Dengue virus antibody database: Systematically linking serotype-specificity with epitope mapping in dengue virus,2017,11
Anti-trypanosomal activity of non-peptidic nitrile-based cysteine protease inhibitors,2017,15
"Unusual pattern of chikungunya virus epidemic in the Americas, the Panamanian experience",2017,9
Precision oncology: Charting a path forward to broader deployment of genomic profiling,2017,10
Evidence for scaling up HIV treatment in sub-Saharan Africa: A call for incorporating health system constraints,2017,24
Delays and loss to follow-up before treatment of drug-resistant tuberculosis following implementation of Xpert MTB/RIF in South Africa: A retrospective cohort study,2017,48
Housing Improvements and Malaria Risk in Sub-Saharan Africa: A Multi-Country Analysis of Survey Data,2017,51
A genome wide association study identifies a lncRna as risk factor for pathological inflammatory responses in leprosy,2017,17
ANLN truncation causes a familial fatal acute respiratory distress syndrome in Dalmatian dogs,2017,7
Active zone proteins are transported via distinct mechanisms regulated by Par-1 kinase,2017,4
The genetic basis of resistance and matching-allele interactions of a host-parasite system: The Daphnia magna-Pasteuria ramosa model,2017,20
Stat3/Cdc25a-dependent cell proliferation promotes embryonic axis extension during zebrafish gastrulation,2017,19
Metacoder: An R package for visualization and manipulation of community taxonomic diversity data,2017,101
Two dynamic regimes in the human gut microbiome,2017,33
A high-throughput genetic screen identifies previously uncharacterized Borrelia burgdorferi genes important for resistance against reactive oxygen and nitrogen species,2017,16
Correction: Type I Interferon Receptor Deficiency in Dendritic Cells Facilitates Systemic Murine Norovirus Persistence Despite Enhanced Adaptive Immunity,2017,0
Probability matching in perceptrons: Effects of conditional dependence and linear nonseparability,2017,1
A simplified fractional order impedance model and parameter identification method for lithium-ion batteries,2017,23
Colour preferences of UK garden birds at supplementary seed feeders,2017,3
Relationship between pre-anesthetic and intra-anesthetic airway resistance in patients undergoing general anesthesia: A prospective observational study,2017,2
Rbm46 regulates mouse embryonic stem cell differentiation by targeting β-Catenin mRNA for degradation,2017,2
Prognostic and clinicopathological value of poly (adenosine diphosphate-ribose) polymerase expression in breast cancer: A meta-analysis,2017,3
"Ecto-5' -Nucleotidase CD73 (NT5E), vitamin D receptor and FGF23 gene polymorphisms may play a role in the development of calcific uremic arteriolopathy in dialysis patients – Data from the German Calciphylaxis Registry",2017,9
"Job satisfaction and determinant factors among midwives working at health facilities in Addis Ababa city, Ethiopia",2017,13
Preload-based Starling-like control of rotary blood pumps: An in-vitro evaluation,2017,4
The nature of allometry in an exaggerated trait: The postocular flange in Platyneuromus Weele (Insecta: Megaloptera),2017,7
Hepatic transcriptome analysis and identification of differentially expressed genes response to dietary oxidized fish oil in loach Misgurnus anguillicaudatus,2017,12
Expression and activity of multidrug resistance proteins in mature endothelial cells and their precursors: A challenging correlation,2017,5
Diffuse large B-cell lymphoma with concurrent high MYC and BCL2 expression shows evidence of active B-cell receptor signaling by quantitative immunofluorescence,2017,9
Cerebrospinal fluid biomarkers of infantile congenital hydrocephalus,2017,10
Elevated GM3 plasma concentration in idiopathic Parkinson’s disease: A lipidomic analysis,2017,24
Genetically encoded ratiometric fluorescent thermometer with wide range and rapid response,2017,30
Depressive disorder and gastrointestinal dysfunction after myocardial infarct are associated with abnormal tryptophan-5-hydroxytryptamine metabolism in rats,2017,7
Evaluating the lexico-grammatical differences in the writing of native and non-native speakers of English in peer-reviewed medical journals in the field of pediatric oncology: Creation of the genuine index scoring system,2017,0
A low-cost DAC BIST structure using a resistor loop,2017,0
"Accumulation of medium-chain, saturated fatty acyl moieties in seed oils of transgenic Camelina sativa",2017,9
Multiple processes in two-dimensional visual statistical learning,2017,0
Complementary and alternative medicine for the treatment of bronchiolitis in infants: A systematic review,2017,6
Zooxanthellal genetic varieties in giant clams are partially determined by species-intrinsic and growth-related characteristics,2017,13
De novo assembly of the sea trout (Salmo trutta m. trutta) skin transcriptome to identify putative genes involved in the immune response and epidermal mucus secretion,2017,14
The effect of tumour size on drug transport and uptake in 3-D tumour models reconstructed from magnetic resonance images,2017,14
Comparison of theoretical and experimental values for plant uptake of pesticide from soil,2017,15
Epidemiology of low-proteinuric chronic kidney disease in renal clinics,2017,19
Lack of impact of pre-existing T97A HIV-1 integrase mutation on integrase strand transfer inhibitor resistance and treatment outcome,2017,13
Global economic impacts of climate variability and change during the 20th century,2017,8
"Novel molecular, structural and evolutionary characteristics of the phosphoketolases from bifidobacteria and Coriobacteriales",2017,22
Surveys of public knowledge and attitudes with regard to antibiotics in Poland: Did the European Antibiotic Awareness Day campaigns change attitudes?,2017,27
The p53 isoform delta133p53ß regulates cancer cell apoptosis in a RhoB-dependent manner,2017,13
Aflatoxin exposure during the first 36 months of life was not associated with impaired growth in Nepalese children: An extension of the MAL-ED study,2017,23
"Instrument design and protocol for the study of light controlled processes in aquatic organisms, and its application to examine the effect of infrared light on zebrafish",2017,6
A novel hemagglutinin protein produced in bacteria protects chickens against H5N1 highly pathogenic avian influenza viruses by inducing H5 subtype-specific neutralizing antibodies,2017,5
Energy intake and energy expenditure of pre-professional female contemporary dancers,2017,14
Experimental evidence of formation of transparent exopolymer particles (TEP) and POC export provoked by dust addition under current and high pCO2 conditions,2017,7
Risk factors for central nervous system tumors in children: New findings from a case-control study,2017,10
Emergent inequality and self-organized social classes in a network of power and frustration,2017,4
SplitAx: A novel method to assess the function of engineered nucleases,2017,0
Plants promote mating and dispersal of the human pathogenic fungus Cryptococcus,2017,14
Mediterranean dietary pattern and VEGF +405 G/C gene polymorphisms in patients with metabolic syndrome: An aspect of gene-nutrient interaction,2017,5
Long term effects of fetal undernutrition on rat heart. Role of hypertension and oxidative stress,2017,20
Evaluation of university scientific research ability based on the output of sci-tech papers: A D-AHP approach,2017,6
Recurrent rearrangements of the Myb/SANT-like DNA-binding domain containing 3 gene (MSANTD3) in salivary gland acinic cell carcinoma,2017,16
A targeted gene expression platform allows for rapid analysis of chemical-induced antioxidant mRNA expression in zebrafish larvae,2017,7
Sustainability of common pool resources,2017,13
Phenolic extract from oleaster (Olea europaea var. Sylvestris) leaves reduces colon cancer growth and induces caspase-dependent apoptosis in colon cancer cells via the mitochondrial apoptotic pathway,2017,18
A mathematical model of aortic aneurysm formation,2017,7
Pathogenic waterborne free-living amoebae: An update from selected Southeast Asian countries,2017,18
Decline in infection-related morbidities following drug-mediated reductions in the intensity of Schistosoma infection: A systematic review and meta-analysis,2017,34
Modelling the risk of Taenia solium exposure from pork produced in western Kenya,2017,8
Distribution and abundance of key vectors of Rift Valley fever and other arboviruses in two ecologically distinct counties in Kenya,2017,19
Epilepsy-associated gene Nedd4-2 mediates neuronal activity and seizure susceptibility through AMPA receptors,2017,14
Sequencing the extrachromosomal circular mobilome reveals retrotransposon activity in plants,2017,37
The Legionella pneumophila genome evolved to accommodate multiple regulatory mechanisms controlled by the CsrA-system,2017,29
Correction: Psychotic Experiences and Overhasty Inferences Are Related to Maladaptive Learning,2017,1
graph-GPA: A graphical model for prioritizing GWAS results and investigating pleiotropic architecture,2017,6
Optimality principles reveal a complex interplay of intermediate toxicity and kinetic efficiency in the regulation of prokaryotic metabolism,2017,7
"A single mutation in the envelope protein modulates flavivirus antigenicity, stability, and pathogenesis",2017,36
Mucosal stromal fibroblasts markedly enhance HIV infection of CD4+ T cells,2017,30
RNA-Seq analysis of chikungunya virus infection and identification of granzyme A as a major promoter of arthritic inflammation,2017,36
Resolving host–pathogen interactions by dual RNA-seq,2017,101
Correction: Reversing Age Related Changes of the Laryngeal Muscles by Chronic Electrostimulation of the Recurrent Laryngeal Nerve,2017,0
Correction: Inflammation in Sickle Cell Disease: Differential and Down-Expressed Plasma Levels of Annexin A1 Protein,2017,1
Correction: Chronic Activation of Hepatic Nrf2 Has No Major Effect on Fatty Acid and Glucose Metabolism in Adult Mice,2017,0
Correction: A Source Area Approach Demonstrates Moderate Predictive Ability but Pronounced Variability of Invasive Species Traits,2017,0
Correction: Whole Exome Sequencing of Growing and Non-Growing Cutaneous Neurofibromas from a Single Patient with Neurofibromatosis Type 1,2017,0
Correction: Inhibitory Effects of Hydroethanolic Leaf Extracts of Kalanchoe brasiliensis and Kalanchoe pinnata (Crassulaceae) against Local Effects Induced by Bothrops jararaca Snake Venom,2017,1
Correction: A European Spectrum of Pharmacogenomic Biomarkers: Implications for Clinical Pharmacogenomics,2017,1
"Methamphetamine treatment outcomes among gay men attending a LGBTI-specific treatment service in Sydney, Australia",2017,14
"Platelet-, monocyte-derived and tissue factor-carrying circulating microparticles are related to acute myocardial infarction severity",2017,38
Differential effects of silencing crustacean hyperglycemic hormone gene expression on the metabolic profiles of the muscle and hepatopancreas in the crayfish Procambarus clarkii,2017,6
Skeletal muscle metabolic adaptations to endurance exercise training are attainable in mice with simvastatin treatment,2017,15
Acetylcholine versus cold pressor testing for evaluation of coronary endothelial function,2017,3
"Triethylene glycol, an active component of Ashwagandha (Withania somnifera) leaves, is responsible for sleep induction",2017,8
The metastasis suppressor KISS1 is an intrinsically disordered protein slightly more extended than a random coil,2017,2
Novel approaches for the taxonomic and metabolic characterization of lactobacilli: Integration of 16S rRNA gene sequencing with MALDI-TOF MS and 1H-NMR,2017,25
Reproducibility and comparison of oxygen-enhanced T1 quantification in COPD and asthma patients,2017,11
Breeding matters: Natal experience influences population state-dependent host acceptance by an eruptive insect herbivore,2017,5
Thermal stability and structural changes in bacterial toxins responsible for food poisoning,2017,3
Comparison of HLA allelic imputation programs,2017,24
Identification of age-dependent motor and neuropsychological behavioural abnormalities in a mouse model of Mucopolysaccharidosis Type II,2017,12
"Non-small cell lung cancer: Whole-lesion histogram analysis of the apparent diffusion coefficient for assessment of tumor grade, lymphovascular invasion and pleural invasion",2017,18
Human cortical neural correlates of visual fatigue during binocular depth perception: An fNIRS study,2017,8
Generalist dispersers promote germination of an alien fleshy-fruited tree invading natural grasslands,2017,9
The association between human endogenous retroviruses and multiple sclerosis: A systematic review and meta-analysis,2017,39
"Structure, kinetic characterization and subcellular localization of the two ribulose 5-phosphate epimerase isoenzymes from Trypanosoma cruzi",2017,3
Factors influencing antiretroviral treatment suboptimal adherence among perinatally HIV-infected adolescents in Thailand,2017,14
The psychometric properties of the ‘safety attitudes questionnaire’ in out-of-hours primary care services in the Netherlands,2017,12
Growth and life history variability of the grey reef shark (Carcharhinus amblyrhynchos) across its range,2017,17
The association between body mass index and mortality among Asian peritoneal dialysis patients: A meta-analysis,2017,9
Women and HIV in the United States,2017,10
Replication of SNP associations with keratoconus in a Czech cohort,2017,11
